### ISSUE TITLE
negative caching default behavior incorrect

### ISSUE THREAD

**Issue by kornface13** [systemd/systemd#28580]
### systemd version the issue has been seen with

249

### Used distribution

Ubuntu 22.04

### Linux kernel version used

5.19.0-1027-gcp

### CPU architectures issue was seen on

x86_64

### Component

systemd-resolved

### Expected behaviour you didn't see

Default is Cache=yes according to documentation.  I am not seeing negative queries being cached in the default configuration (cache is commented out, but does say `Cache=no-negative`, which maybe imples that no-negative might be the default?)

### Unexpected behaviour you saw

I'm running `while [ true ]; do curl http://localhost.<blah>.com; sleep 1; done` and also running `watch resolvctl statistics`.  I see a cache hit and cache miss everytime curl runs.  I ran a tcpdump and verified that an AAAA query happens for each request, while an A query only happens for the first request (or when the records TTL expires).  

There is a valid A record but not a valid AAAA record for this domain.  If caching is enabled by default I expect the A record and the negative response for the AAAA record to be cached.  

If I modify `/etc/systemd/resolved.conf` and add `Cache=yes` then I no longer see AAAA queries leaving the system and I only see cache hits in `resolvectl statistics`.  This shows that cache=no-negative is the default behavior but I cannot find any documentation stating this, nor do I see anything in the configuration showing me the current cache setting.  

Side feature request....please make `systemctl status` output the actual running configuration with all flags.  

### Steps to reproduce the problem

Find a website that has an A record but not a AAAA record.  Curl that website multiple times and watch resolvectl statistics or tcpdump on port 53 and watch the queries that leave the system.   

### Additional program output to the terminal or log subsystem illustrating the issue

```sh
18:21:39.807706 lo    In  IP 127.0.0.1.36897 > 127.0.0.53.53: 40439+ [1au] A? localhost.blah.com. (52)
18:21:39.807719 lo    In  IP 127.0.0.1.36897 > 127.0.0.53.53: 42229+ [1au] AAAA? localhost.blah.com. (52)
18:21:39.807813 lo    In  IP 127.0.0.53.53 > 127.0.0.1.36897: 40439 1/0/1 A 127.0.0.1 (68)
18:21:39.807905 ens4  Out IP 10.248.6.84.60280 > 169.254.169.254.53: 11332+ [1au] AAAA? localhost.blah.com. (52)
18:21:39.808249 ens4  In  IP 169.254.169.254.53 > 10.248.6.84.60280: 11332 0/1/1 (142)
18:21:39.808319 lo    In  IP 127.0.0.53.53 > 127.0.0.1.36897: 42229 0/1/1 (142)
18:21:39.820523 lo    In  IP 127.0.0.1.47505 > 127.0.0.53.53: 34755+ [1au] A? localhost.blah.com. (52)
18:21:39.820536 lo    In  IP 127.0.0.1.47505 > 127.0.0.53.53: 55501+ [1au] AAAA? localhost.blah.com. (52)
18:21:39.820627 lo    In  IP 127.0.0.53.53 > 127.0.0.1.47505: 34755 1/0/1 A 127.0.0.1 (68)
18:21:39.820724 ens4  Out IP 10.248.6.84.51708 > 169.254.169.254.53: 61704+ [1au] AAAA? localhost.blah.com. (52)
18:21:39.821044 ens4  In  IP 169.254.169.254.53 > 10.248.6.84.51708: 61704 0/1/1 (142)
18:21:39.821112 lo    In  IP 127.0.0.53.53 > 127.0.0.1.47505: 55501 0/1/1 (142)
18:21:39.833420 lo    In  IP 127.0.0.1.42684 > 127.0.0.53.53: 10718+ [1au] A? localhost.blah.com. (52)
18:21:39.833435 lo    In  IP 127.0.0.1.42684 > 127.0.0.53.53: 53212+ [1au] AAAA? localhost.blah.com. (52)
18:21:39.833523 lo    In  IP 127.0.0.53.53 > 127.0.0.1.42684: 10718 1/0/1 A 127.0.0.1 (68)
18:21:39.833612 ens4  Out IP 10.248.6.84.37583 > 169.254.169.254.53: 29208+ [1au] AAAA? localhost.blah.com. (52)
18:21:39.833915 ens4  In  IP 169.254.169.254.53 > 10.248.6.84.37583: 29208 0/1/1 (142)
```

**Comment by poettering** [comment]
OK, this is a downstream bug. Let's close this here.
