### ISSUE TITLE
systemd-resolved times out if other nameservers in /etc/resolv.conf and a query fails

### ISSUE THREAD

**Issue by fjros** [systemd/systemd#9243]
**systemd version the issue has been seen with**
systemd 237

**Used distribution**
Ubuntu 18.04

**Expected behaviour you didn't see**

```
root@systemd-01:~# gpg --recv-keys --keyserver hkp://keyserver.ubuntu.com:80 14AA40EC0831756756D7F66C4F4EA0AAE5267A6C
gpg: /root/.gnupg/trustdb.gpg: trustdb created
gpg: key 4F4EA0AAE5267A6C: public key "Launchpad PPA for Ondřej Surý" imported
gpg: Total number processed: 1
gpg:               imported: 1
```

**Unexpected behaviour you saw**

```
root@systemd-01:~# gpg --recv-keys --keyserver hkp://keyserver.ubuntu.com:80 14AA40EC0831756756D7F66C4F4EA0AAE5267A6C
gpg: keyserver receive failed: Invalid argument
```

**Steps to reproduce the problem**

I've come across an Ubuntu 18.04 image that messes with `resolvconf` and `systemd-resolved` configs. While the resulting setup is flawed and I think the cloud provider must fix it, I haven't seen anything in `systemd-resolved`'s manual that implies it must not work.

In the following I show how I reproduced the bug on a different provider where 127.0.0.53 (originally) was the only nameserver and whose Ubuntu 18.04 image didn't have the aforementioned problem.

Remove the symlink from `/etc/resolv.conf` and create file `/etc/resolv.conf` with the following content:

```
nameserver 127.0.0.53
nameserver 1.1.1.1
```

Run `systemctl restart systemd-resolved.service`.

Output of `systemd-resolve --status`:

```
Global
         DNS Servers: 1.1.1.1
          DNSSEC NTA: 10.in-addr.arpa
                      16.172.in-addr.arpa
                      168.192.in-addr.arpa
                      17.172.in-addr.arpa
                      18.172.in-addr.arpa
                      19.172.in-addr.arpa
                      20.172.in-addr.arpa
                      21.172.in-addr.arpa
                      22.172.in-addr.arpa
                      23.172.in-addr.arpa
                      24.172.in-addr.arpa
                      25.172.in-addr.arpa
                      26.172.in-addr.arpa
                      27.172.in-addr.arpa
                      28.172.in-addr.arpa
                      29.172.in-addr.arpa
                      30.172.in-addr.arpa
                      31.172.in-addr.arpa
                      corp
                      d.f.ip6.arpa
                      home
                      internal
                      intranet
                      lan
                      local
                      private
                      test

Link 3 (eth1)
      Current Scopes: DNS
       LLMNR setting: yes
MulticastDNS setting: no
      DNSSEC setting: no
    DNSSEC supported: no
         DNS Servers: 67.207.67.3
                      67.207.67.2

Link 2 (eth0)
      Current Scopes: DNS
       LLMNR setting: yes
MulticastDNS setting: no
      DNSSEC setting: no
    DNSSEC supported: no
         DNS Servers: 67.207.67.3
                      67.207.67.2
```

Output of `gpg --recv-keys --keyserver hkp://keyserver.ubuntu.com:80 14AA40EC0831756756D7F66C4F4EA0AAE5267A6C`:

```
gpg: keybox '/root/.gnupg/pubring.kbx' created
gpg: keyserver receive failed: Invalid argument
```

`gpg` talks with `dirmngr` by means of a unix socket. The relevant output of `cat /var/log/syslog | grep dirmngr`:

```
Jun  8 21:16:26 systemd-01 dirmngr[1545]: resolving 'keyserver.ubuntu.com' failed: Invalid argument
Jun  8 21:16:26 systemd-01 dirmngr[1545]: number of system provided CAs: 133
Jun  8 21:16:31 systemd-01 dirmngr[1545]: resolving 'keyserver.ubuntu.com' failed: Invalid argument
Jun  8 21:16:31 systemd-01 dirmngr[1545]: can't connect to 'keyserver.ubuntu.com': host not found
Jun  8 21:16:31 systemd-01 dirmngr[1545]: error connecting to 'http://keyserver.ubuntu.com:80': Invalid argument
Jun  8 21:16:31 systemd-01 dirmngr[1545]: command 'KS_GET' failed: Invalid argument
```

Output of `journalctl -u systemd-resolved.service -f`:

```
Jun 08 21:16:21 systemd-01 systemd-resolved[1414]: Got DNS stub UDP query packet for id 12239
Jun 08 21:16:21 systemd-01 systemd-resolved[1414]: Looking up RR for keyserver.ubuntu.com IN A.
Jun 08 21:16:21 systemd-01 systemd-resolved[1414]: Switching to DNS server 67.207.67.3 for interface eth1.
Jun 08 21:16:21 systemd-01 systemd-resolved[1414]: Switching to DNS server 67.207.67.3 for interface eth0.
Jun 08 21:16:21 systemd-01 systemd-resolved[1414]: Cache miss for keyserver.ubuntu.com IN A
Jun 08 21:16:21 systemd-01 systemd-resolved[1414]: Transaction 9496 for <keyserver.ubuntu.com IN A> scope dns on */*.
Jun 08 21:16:21 systemd-01 systemd-resolved[1414]: Using feature level UDP+EDNS0 for transaction 9496.
Jun 08 21:16:21 systemd-01 systemd-resolved[1414]: Using DNS server 1.1.1.1 for transaction 9496.
Jun 08 21:16:21 systemd-01 systemd-resolved[1414]: Sending query packet with id 9496.
Jun 08 21:16:21 systemd-01 systemd-resolved[1414]: Cache miss for keyserver.ubuntu.com IN A
Jun 08 21:16:21 systemd-01 systemd-resolved[1414]: Transaction 38237 for <keyserver.ubuntu.com IN A> scope dns on eth0/*.
Jun 08 21:16:21 systemd-01 systemd-resolved[1414]: Using feature level UDP+EDNS0 for transaction 38237.
Jun 08 21:16:21 systemd-01 systemd-resolved[1414]: Using DNS server 67.207.67.3 for transaction 38237.
Jun 08 21:16:21 systemd-01 systemd-resolved[1414]: Sending query packet with id 38237.
Jun 08 21:16:21 systemd-01 systemd-resolved[1414]: Cache miss for keyserver.ubuntu.com IN A
Jun 08 21:16:21 systemd-01 systemd-resolved[1414]: Transaction 62913 for <keyserver.ubuntu.com IN A> scope dns on eth1/*.
Jun 08 21:16:21 systemd-01 systemd-resolved[1414]: Using feature level UDP+EDNS0 for transaction 62913.
Jun 08 21:16:21 systemd-01 systemd-resolved[1414]: Using DNS server 67.207.67.3 for transaction 62913.
Jun 08 21:16:21 systemd-01 systemd-resolved[1414]: Sending query packet with id 62913.
Jun 08 21:16:21 systemd-01 systemd-resolved[1414]: Processing query...
Jun 08 21:16:21 systemd-01 systemd-resolved[1414]: Processing incoming packet on transaction 38237. (rcode=SUCCESS)
Jun 08 21:16:21 systemd-01 systemd-resolved[1414]: Verified we get a response at feature level UDP+EDNS0 from DNS server 67.207.67.3.
Jun 08 21:16:21 systemd-01 systemd-resolved[1414]: Added positive unauthenticated cache entry for keyserver.ubuntu.com IN A 410s on */INET/67
Jun 08 21:16:21 systemd-01 systemd-resolved[1414]: Added positive unauthenticated cache entry for keyserver.ubuntu.com IN A 410s on */INET/67
Jun 08 21:16:21 systemd-01 systemd-resolved[1414]: Transaction 38237 for <keyserver.ubuntu.com IN A> on scope dns on eth0/* now complete with
Jun 08 21:16:21 systemd-01 systemd-resolved[1414]: Freeing transaction 9496.
Jun 08 21:16:21 systemd-01 systemd-resolved[1414]: Freeing transaction 62913.
Jun 08 21:16:21 systemd-01 systemd-resolved[1414]: Sending response packet with id 12239 on interface 1/AF_INET.
Jun 08 21:16:21 systemd-01 systemd-resolved[1414]: Freeing transaction 38237.
Jun 08 21:16:21 systemd-01 systemd-resolved[1414]: Got DNS stub UDP query packet for id 48583
Jun 08 21:16:21 systemd-01 systemd-resolved[1414]: Looking up RR for keyserver.ubuntu.com IN AAAA.
Jun 08 21:16:21 systemd-01 systemd-resolved[1414]: Cache miss for keyserver.ubuntu.com IN AAAA
Jun 08 21:16:21 systemd-01 systemd-resolved[1414]: Transaction 34117 for <keyserver.ubuntu.com IN AAAA> scope dns on */*.
Jun 08 21:16:21 systemd-01 systemd-resolved[1414]: Using feature level UDP+EDNS0 for transaction 34117.
Jun 08 21:16:21 systemd-01 systemd-resolved[1414]: Using DNS server 1.1.1.1 for transaction 34117.
Jun 08 21:16:21 systemd-01 systemd-resolved[1414]: Sending query packet with id 34117.
Jun 08 21:16:21 systemd-01 systemd-resolved[1414]: Cache miss for keyserver.ubuntu.com IN AAAA
Jun 08 21:16:21 systemd-01 systemd-resolved[1414]: Transaction 25123 for <keyserver.ubuntu.com IN AAAA> scope dns on eth0/*.
Jun 08 21:16:21 systemd-01 systemd-resolved[1414]: Using feature level UDP+EDNS0 for transaction 25123.
Jun 08 21:16:21 systemd-01 systemd-resolved[1414]: Using DNS server 67.207.67.3 for transaction 25123.
Jun 08 21:16:21 systemd-01 systemd-resolved[1414]: Sending query packet with id 25123.
Jun 08 21:16:21 systemd-01 systemd-resolved[1414]: Cache miss for keyserver.ubuntu.com IN AAAA
Jun 08 21:16:21 systemd-01 systemd-resolved[1414]: Transaction 15384 for <keyserver.ubuntu.com IN AAAA> scope dns on eth1/*.
Jun 08 21:16:21 systemd-01 systemd-resolved[1414]: Using feature level UDP+EDNS0 for transaction 15384.
Jun 08 21:16:21 systemd-01 systemd-resolved[1414]: Using DNS server 67.207.67.3 for transaction 15384.
Jun 08 21:16:21 systemd-01 systemd-resolved[1414]: Sending query packet with id 15384.
Jun 08 21:16:21 systemd-01 systemd-resolved[1414]: Processing query...
Jun 08 21:16:21 systemd-01 systemd-resolved[1414]: Processing incoming packet on transaction 25123. (rcode=SUCCESS)
Jun 08 21:16:21 systemd-01 systemd-resolved[1414]: Added NODATA cache entry for keyserver.ubuntu.com IN AAAA 2596s
Jun 08 21:16:21 systemd-01 systemd-resolved[1414]: Transaction 25123 for <keyserver.ubuntu.com IN AAAA> on scope dns on eth0/* now complete w
Jun 08 21:16:21 systemd-01 systemd-resolved[1414]: Freeing transaction 34117.
Jun 08 21:16:21 systemd-01 systemd-resolved[1414]: Freeing transaction 15384.
Jun 08 21:16:21 systemd-01 systemd-resolved[1414]: Sending response packet with id 48583 on interface 1/AF_INET.
Jun 08 21:16:21 systemd-01 systemd-resolved[1414]: Freeing transaction 25123.
Jun 08 21:16:21 systemd-01 systemd-resolved[1414]: Got DNS stub UDP query packet for id 26594
Jun 08 21:16:21 systemd-01 systemd-resolved[1414]: Failed to extract resources from incoming packet, ignoring packet: Bad message
Jun 08 21:16:21 systemd-01 systemd-resolved[1414]: Sending response packet with id 26594 on interface 1/AF_INET.
Jun 08 21:16:26 systemd-01 systemd-resolved[1414]: Got DNS stub UDP query packet for id 40928
Jun 08 21:16:26 systemd-01 systemd-resolved[1414]: Looking up RR for keyserver.ubuntu.com IN A.
Jun 08 21:16:26 systemd-01 systemd-resolved[1414]: Cache miss for keyserver.ubuntu.com IN A
Jun 08 21:16:26 systemd-01 systemd-resolved[1414]: Transaction 31371 for <keyserver.ubuntu.com IN A> scope dns on */*.
Jun 08 21:16:26 systemd-01 systemd-resolved[1414]: Using feature level UDP+EDNS0 for transaction 31371.
Jun 08 21:16:26 systemd-01 systemd-resolved[1414]: Using DNS server 1.1.1.1 for transaction 31371.
Jun 08 21:16:26 systemd-01 systemd-resolved[1414]: Sending query packet with id 31371.
Jun 08 21:16:26 systemd-01 systemd-resolved[1414]: Positive cache hit for keyserver.ubuntu.com IN A
Jun 08 21:16:26 systemd-01 systemd-resolved[1414]: Transaction 21982 for <keyserver.ubuntu.com IN A> on scope dns on eth0/* now complete with
Jun 08 21:16:26 systemd-01 systemd-resolved[1414]: Cache miss for keyserver.ubuntu.com IN A
Jun 08 21:16:26 systemd-01 systemd-resolved[1414]: Transaction 1409 for <keyserver.ubuntu.com IN A> scope dns on eth1/*.
Jun 08 21:16:26 systemd-01 systemd-resolved[1414]: Using feature level UDP+EDNS0 for transaction 1409.
Jun 08 21:16:26 systemd-01 systemd-resolved[1414]: Using DNS server 67.207.67.3 for transaction 1409.
Jun 08 21:16:26 systemd-01 systemd-resolved[1414]: Sending query packet with id 1409.
Jun 08 21:16:26 systemd-01 systemd-resolved[1414]: Freeing transaction 31371.
Jun 08 21:16:26 systemd-01 systemd-resolved[1414]: Freeing transaction 21982.
Jun 08 21:16:26 systemd-01 systemd-resolved[1414]: Freeing transaction 1409.
Jun 08 21:16:26 systemd-01 systemd-resolved[1414]: Sending response packet with id 40928 on interface 1/AF_INET.
Jun 08 21:16:26 systemd-01 systemd-resolved[1414]: Processing query...
Jun 08 21:16:26 systemd-01 systemd-resolved[1414]: Got DNS stub UDP query packet for id 47949
Jun 08 21:16:26 systemd-01 systemd-resolved[1414]: Looking up RR for keyserver.ubuntu.com IN AAAA.
Jun 08 21:16:26 systemd-01 systemd-resolved[1414]: Cache miss for keyserver.ubuntu.com IN AAAA
Jun 08 21:16:26 systemd-01 systemd-resolved[1414]: Transaction 28168 for <keyserver.ubuntu.com IN AAAA> scope dns on */*.
Jun 08 21:16:26 systemd-01 systemd-resolved[1414]: Using feature level UDP+EDNS0 for transaction 28168.
Jun 08 21:16:26 systemd-01 systemd-resolved[1414]: Using DNS server 1.1.1.1 for transaction 28168.
Jun 08 21:16:26 systemd-01 systemd-resolved[1414]: Sending query packet with id 28168.
Jun 08 21:16:26 systemd-01 systemd-resolved[1414]: NODATA cache hit for keyserver.ubuntu.com IN AAAA
Jun 08 21:16:26 systemd-01 systemd-resolved[1414]: Transaction 28718 for <keyserver.ubuntu.com IN AAAA> on scope dns on eth0/* now complete w
Jun 08 21:16:26 systemd-01 systemd-resolved[1414]: Cache miss for keyserver.ubuntu.com IN AAAA
Jun 08 21:16:26 systemd-01 systemd-resolved[1414]: Transaction 8824 for <keyserver.ubuntu.com IN AAAA> scope dns on eth1/*.
Jun 08 21:16:26 systemd-01 systemd-resolved[1414]: Using feature level UDP+EDNS0 for transaction 8824.
Jun 08 21:16:26 systemd-01 systemd-resolved[1414]: Using DNS server 67.207.67.3 for transaction 8824.
Jun 08 21:16:26 systemd-01 systemd-resolved[1414]: Sending query packet with id 8824.
Jun 08 21:16:26 systemd-01 systemd-resolved[1414]: Freeing transaction 28168.
Jun 08 21:16:26 systemd-01 systemd-resolved[1414]: Freeing transaction 28718.
Jun 08 21:16:26 systemd-01 systemd-resolved[1414]: Freeing transaction 8824.
Jun 08 21:16:26 systemd-01 systemd-resolved[1414]: Sending response packet with id 47949 on interface 1/AF_INET.
Jun 08 21:16:26 systemd-01 systemd-resolved[1414]: Processing query...
Jun 08 21:16:26 systemd-01 systemd-resolved[1414]: Got DNS stub UDP query packet for id 32567
Jun 08 21:16:26 systemd-01 systemd-resolved[1414]: Failed to extract resources from incoming packet, ignoring packet: Bad message
Jun 08 21:16:26 systemd-01 systemd-resolved[1414]: Sending response packet with id 32567 on interface 1/AF_INET.
```

Output of `tcpdump -An -i any port 53`:

```
listening on any, link-type LINUX_SLL (Linux cooked), capture size 262144 bytes
21:16:21.774480 IP 127.0.0.1.10218 > 127.0.0.53.53: 53039+ A? keyserver.ubuntu.com. (38)
E..B..@.@..r.......5'..5...u./..........	keyserver.ubuntu.com.....
21:16:21.774906 IP 178.62.70.18.47711 > 1.1.1.1.53: 6181+ [1au] A? keyserver.ubuntu.com. (49)
E..M.l@.@.Q..>F......_.5.9...%..........	keyserver.ubuntu.com.......)........
21:16:21.774997 IP 178.62.70.18.50561 > 67.207.67.3.53: 23957+ [1au] A? keyserver.ubuntu.com. (49)
E..M..@.@....>F.C.C....5.9.m]...........	keyserver.ubuntu.com.......)........
21:16:21.775060 IP 178.62.70.18.60285 > 67.207.67.3.53: 49653+ [1au] A? keyserver.ubuntu.com. (49)
E..M..@.@....>F.C.C..}.5.9.m............	keyserver.ubuntu.com.......)........
21:16:21.775783 IP 67.207.67.3.53 > 178.62.70.18.50561: 23957 2/0/1 A 91.189.90.55, A 91.189.89.49 (81)
E..mn5@.?.N(C.C..>F..5...Y..]...........	keyserver.ubuntu.com.................[.Z7............[.Y1..)........
21:16:21.780537 IP 127.0.0.53.53 > 127.0.0.1.10218: 51133 0/0/0 (38)
E..B..@.@......5.....5'....u............	keyserver.ubuntu.com.....
21:16:21.780704 IP 127.0.0.1.10218 > 127.0.0.53.53: 57959+ Type0 (Class 7168)? keyserver.ubuntu.com. (39)
E..C..@.@..o.......5'..5./.v.g..........	keyserver.ubuntu.com......
21:16:21.780913 IP 127.0.0.53.53 > 127.0.0.1.10218: 57959 FormErr [0q] 0/0/0 (12)
E..(..@.@......5.....5'....[.g..........
21:16:21.781173 IP 1.1.1.1.53 > 178.62.70.18.39002: 17797 0/1/1 (110)
E.....@.=..#.....>F..5.Z.v..E...........	keyserver.ubuntu.com................1.ns1	canonical..
hostmaster.6xI....*0.....	:.......)........
21:16:21.781434 IP 67.207.67.3.53 > 178.62.70.18.34948: 6204 0/1/1 (110)
E...n8@.?.N.C.C..>F..5...v...<..........	keyserver.ubuntu.com................1.ns1	canonical..
hostmaster.6xI....*0.....	:.......)........
21:16:26.802271 IP 127.0.0.1.41816 > 127.0.0.53.53: 57503+ A? keyserver.ubuntu.com. (38)
E..B.,@.@..H.......5.X.5...u............	keyserver.ubuntu.com.....
21:16:26.802593 IP 178.62.70.18.50761 > 1.1.1.1.53: 35706+ [1au] A? keyserver.ubuntu.com. (49)
E..M.c@.@.N..>F......I.5.9...z..........	keyserver.ubuntu.com.......)........
21:16:26.802700 IP 178.62.70.18.33391 > 67.207.67.3.53: 33029+ [1au] A? keyserver.ubuntu.com. (49)
E..M..@.@.,..>F.C.C..o.5.9.m............	keyserver.ubuntu.com.......)........
21:16:26.802785 IP 127.0.0.53.53 > 127.0.0.1.41816: 57503 2/0/0 A 91.189.89.49, A 91.189.90.55 (70)
E..b..@.@..b...5.....5.X.N..............	keyserver.ubuntu.com.................[.Y1............[.Z7
21:16:26.803171 IP 67.207.67.3.53 > 178.62.70.18.33391: 33029 2/0/1 A 91.189.90.55, A 91.189.89.49 (81)
E..mpl@.?.K.C.C..>F..5.o.Y.3............	keyserver.ubuntu.com..............S..[.Z7.........S..[.Y1..)........
21:16:26.805258 IP 127.0.0.1.41816 > 127.0.0.53.53: 19899+ AAAA? keyserver.ubuntu.com. (38)
E..B.-@.@..G.......5.X.5...uM...........	keyserver.ubuntu.com.....
21:16:26.805495 IP 178.62.70.18.59478 > 1.1.1.1.53: 2158+ [1au] AAAA? keyserver.ubuntu.com. (49)
E..M.d@.@.N..>F......V.5.9...n..........	keyserver.ubuntu.com.......)........
21:16:26.805589 IP 178.62.70.18.52653 > 67.207.67.3.53: 30754+ [1au] AAAA? keyserver.ubuntu.com. (49)
E..M..@.@.,..>F.C.C....5.9.mx"..........	keyserver.ubuntu.com.......)........
21:16:26.805665 IP 127.0.0.53.53 > 127.0.0.1.41816: 19899 0/0/0 (38)
E..B..@.@......5.....5.X...uM...........	keyserver.ubuntu.com.....
21:16:26.806067 IP 67.207.67.3.53 > 178.62.70.18.52653: 30754 0/1/1 (110)
E...pm@.?.K.C.C..>F..5...v.]x"..........	keyserver.ubuntu.com................1.ns1	canonical..
hostmaster.6xI....*0.....	:.......)........
21:16:26.807846 IP 1.1.1.1.53 > 178.62.70.18.59478: 2158 0/1/1 (110)
E...?.@.=........>F..5.V.v.1.n..........	keyserver.ubuntu.com................1.ns1	canonical..
hostmaster.6xI....*0.....	:.......)........
21:16:26.808059 IP 127.0.0.1.41816 > 127.0.0.53.53: 14207+ Type0 (Class 7168)? keyserver.ubuntu.com. (39)
E..C..@.@..E.......5.X.5./.v7...........	keyserver.ubuntu.com......
21:16:26.808298 IP 127.0.0.53.53 > 127.0.0.1.41816: 14207 FormErr [0q] 0/0/0 (12)
E..(..@.@......5.....5.X...[7...........
```

Please note that:
* #9241 occurs
* All queries time out and are retried - however 127.0.0.53 had already provided `dirmngr` with A and AAAA records
* When 127.0.0.53 is the only nameserver, the `gpg` command works and the only query that is retried is the one asking for RRSIG

**Comment by jaschaio** [comment]
Are you seeing this on DigitalOcean?

My Droplet running 18.04 looses temporary all network connectivity. This is what I see in the Logs:

```
Feb 15 17:54:44 vps systemd-resolved[737]: Using degraded feature set (UDP) for DNS server 67.207.67.2.
Feb 15 18:03:51 vps systemd-resolved[737]: Grace period over, resuming full feature set (UDP+EDNS0) for DNS server 67.207.67.2.
```

The DNS server `67.207.67.2` seems to be the one provided by Digitalocean.

This is my `/etc/resolv.conf`:

```
# Dynamic resolv.conf(5) file for glibc resolver(3) generated by resolvconf(8)
#     DO NOT EDIT THIS FILE BY HAND -- YOUR CHANGES WILL BE OVERWRITTEN
# 127.0.0.53 is the systemd-resolved stub resolver.
# run "systemd-resolve --status" to see details about the actual nameservers.

nameserver 67.207.67.2
nameserver 67.207.67.3
nameserver 127.0.0.53
options edns0
```

[Somebody on Stackoverflow seems to have the same problem](https://askubuntu.com/questions/1113360/systemd-resolved-not-resolving-specific-domains). Any insights on how to prevent this from happening?

**Comment by Vanav** [comment]
Some sort of workaround while preserving some nameserver failover:

Keep default symlink `/etc/resolv.conf` -> `/run/systemd/resolve/stub-resolv.conf`.
Move nameservers to global config of `systemd-resolvd`:
`/etc/systemd/resolved.conf.d/my.conf`
```
[Resolve]
DNS = 1.1.1.1 1.0.0.1
```
Apply changes:
```
systemctl restart systemd-resolved
```
Check:
```
# systemd-resolve --status
Global
         DNS Servers: 1.1.1.1
                      1.0.0.1
...
Link 2 (eth0)
...
         DNS Servers: 67.207.67.3
                      67.207.67.2
```
Test:
```
# time apt-key adv --recv-keys --keyserver hkp://keyserver.ubuntu.com:80 0xF1656F24C74CD1D8Executing: /tmp/apt-key-gpghome.uCRJ7BAcGV/gpg.1.sh --recv-keys --keyserver hkp://keyserver.ubuntu.com:80 0xF1656F24C74CD1D8
gpg: key F1656F24C74CD1D8: 6 signatures not checked due to missing keys
gpg: key F1656F24C74CD1D8: "MariaDB Signing Key <signing-key@mariadb.org>" not changed
gpg: Total number processed: 1
gpg:              unchanged: 1

real    0m10.352s
user    0m0.109s
sys     0m0.018s
```

This way we keep backup nameservers (1.1.1.1 1.0.0.1) in addition to provider's nameservers (per link), they will be queried in parallel. Not the same as multiple `nameserver` in `/etc/resolv.conf`, but should be similar for failover.

Notice that `apt-key adv` will answer only after all timeouts have passed (10 s). I'm not sure if it will break something, but to improve speed you can write:
`/etc/resolv.conf`
```
nameserver 127.0.0.53
options timeout:1 attempts:1 edns0
```

**Comment by larroy** [comment]
I have a related problem in ubuntu 18.04. it seems to be making AAAA queries which are not resolved from the upstream DNS and hanging. Also happens after disabling ipv6 on all interfaces.

I disabled systemd resolved and the problem is gone.


```
piotr@panther:0: ~> host github.com
github.com has address 192.30.255.113
;; connection timed out; no servers could be reached
github.com mail is handled by 5 alt2.aspmx.l.google.com.
github.com mail is handled by 5 alt1.aspmx.l.google.com.
github.com mail is handled by 10 alt4.aspmx.l.google.com.
github.com mail is handled by 10 alt3.aspmx.l.google.com.
github.com mail is handled by 1 aspmx.l.google.com.


```


```
23:24:45.021792 IP 192.168.0.1.53 > 192.168.0.27.43813: 53526 2/0/1 CNAME gstaticadssl.l.google.com., A 172.217.6.67 (98)
23:24:49.233775 IP 192.168.0.27.49858 > 192.168.0.1.53: 54647+ [1au] AAAA? github.com. (39)
23:24:54.483780 IP 192.168.0.27.49858 > 192.168.0.1.53: 54647+ [1au] AAAA? github.com. (39)
23:24:59.733773 IP 192.168.0.27.49858 > 192.168.0.1.53: 54647+ [1au] AAAA? github.com. (39)
23:25:04.983787 IP 192.168.0.27.49858 > 192.168.0.1.53: 54647+ [1au] AAAA? github.com. (39)
23:25:10.233798 IP 192.168.0.27.49858 > 192.168.0.1.53: 54647+ [1au] AAAA? github.com. (39)
23:25:15.483780 IP 192.168.0.27.49858 > 192.168.0.1.53: 54647+ [1au] AAAA? github.com. (39)
23:25:20.733782 IP 192.168.0.27.49858 > 192.168.0.1.53: 54647+ [1au] AAAA? github.com. (39)
23:25:25.983785 IP 192.168.0.27.49858 > 192.168.0.1.53: 54647+ [1au] AAAA? github.com. (39)
23:25:28.808157 IP 192.168.0.27.41055 > 192.168.0.1.53: 6862+ [1au] A? lh6.googleusercontent.com. (54)
23:25:28.834298 IP 192.168.0.1.53 > 192.168.0.27.41055: 6862 1/0/1 A 172.217.164.97 (70)
23:25:31.233809 IP 192.168.0.27.49858 > 192.168.0.1.53: 54647+ [1au] AAAA? github.com. (39)
23:25:36.483765 IP 192.168.0.27.49858 > 192.168.0.1.53: 54647+ [1au] AAAA? github.com. (39)
23:25:41.733809 IP 192.168.0.27.49858 > 192.168.0.1.53: 54647+ [1au] AAAA? github.com. (39)


```

**Comment by mpoletiek** [comment]
I might have had a similar issue in Ubuntu 19 in GCP.

https://stackoverflow.com/questions/61191482/apache-tls-handshakes-timeout-after-dhcp-lease-renewal

**Comment by timiscoding** [comment]
I just spent the last couple days trying to fix slow dns issues after upgrading from 16.04 to 18.04. I was seeing similar output to @larroy after running host but the tcpdump was showing localhost making repeated AAAA requests at ~2s intervals and getting 0 response. I had set my router to use static ipv6 dns servers but my internet provider doesn't support ipv6. I set it back to 'Obtain from WAN interface' and now my lookups are back to normal.

@larroy I noticed your tcpdump is making AAAA requests every 5s. While researching my own problem I found out some extra options that can be set in resolv.conf that seem to [solve that problem](https://unix.stackexchange.com/questions/290987/resolving-hostname-takes-5-seconds): 

```
options single-request 
options single-request-reopen
```

**Comment by GBeauregard** [comment]
> I just spent the last couple days trying to fix slow dns issues after upgrading from 16.04 to 18.04. I was seeing similar output to @larroy after running host but the tcpdump was showing localhost making repeated AAAA requests at ~2s intervals and getting 0 response. I had set my router to use static ipv6 dns servers but my internet provider doesn't support ipv6. I set it back to 'Obtain from WAN interface' and now my lookups are back to normal.
> 
> @larroy I noticed your tcpdump is making AAAA requests every 5s. While researching my own problem I found out some extra options that can be set in resolv.conf that seem to [solve that problem](https://unix.stackexchange.com/questions/290987/resolving-hostname-takes-5-seconds):
> 
> ```
> options single-request 
> options single-request-reopen
> ```

Is there a way to do this with systemd-resolved? Right now systemd-resolved manages that file so I can't just add a line to it

**Comment by ivanmlerner** [comment]
> > I just spent the last couple days trying to fix slow dns issues after upgrading from 16.04 to 18.04. I was seeing similar output to @larroy after running host but the tcpdump was showing localhost making repeated AAAA requests at ~2s intervals and getting 0 response. I had set my router to use static ipv6 dns servers but my internet provider doesn't support ipv6. I set it back to 'Obtain from WAN interface' and now my lookups are back to normal.
> > @larroy I noticed your tcpdump is making AAAA requests every 5s. While researching my own problem I found out some extra options that can be set in resolv.conf that seem to [solve that problem](https://unix.stackexchange.com/questions/290987/resolving-hostname-takes-5-seconds):
> > ```
> > options single-request 
> > options single-request-reopen
> > ```
> 
> Is there a way to do this with systemd-resolved? Right now systemd-resolved manages that file so I can't just add a line to it

Yes, there is, one of the modes of operation uses the static file /usr/lib/systemd/resolv.conf. You can edit this file, and symlink it to /etc/resolv.conf to make systemd-resolved go to static mode.
