### ISSUE TITLE
systemd-resolved attempts PTR lookup for non-local addresses via mDNS and LLMNR

### ISSUE THREAD

**Issue by larsch** [systemd/systemd#20267]
Command `dig -x 2a00:1450:4013:c01::65 @127.0.0.53`, or the equivalent lookup using `gethostbyaddr()`. Also reproduced by a simple `ping -6 google.com`.

Result: Nameserver 8.8.8.8 respond with NXDOMAIN, but systemd-resolved proceeds to attempt lookup via mDNS and LLMNR.

LLMNR TCP SYN request is sent 3 times direct to 2a00:1450:4013:c01::65 with HLIM=1, even though it is not link-local, causing uplink router to respond with ICMPv6 time-exceeded.

Can't say whether this is actually correct behaviour, but it causes PTR lookups to be extremely slow to get NXDOMAIN result. For example, a `ping -6 google.com` on my system only pings once every 10 seconds or so, due to this issue, caused by slow reverse lookups.

Also, the eventual NXDOMAIN result is not cached. Next lookup is still slow.

I would think that mDNS and LLMNR should be skipped for reverse lookup of non-local addresses?

**Comment by notgood** [comment]
resolvectl --version
systemd 251 (251.1-1-arch)

mDNS resolver is unusable, it still tries to reverse lookup global IPv6 by spamming local mDNS queries, 
Something simple like `ping bbc.com` becomes unusable.

Here is a tcpdump,:
```
11:31:35.134704 IP6 fe80::1ac0:4dff:fe89:1174.5353 > ff02::fb.5353: 0 [6a] PTR (QM)? 1.8.0.0.0.0.0.0.0.0.0.0.0.0.0.0.0.0.0.0.0.0.0.0.2.4.e.4.4.0.a.2.ip6.arpa. (265)
11:31:36.209922 IP6 fe80::1ac0:4dff:fe89:1174.5353 > ff02::fb.5353: 0 [6a] PTR (QM)? 1.8.0.0.0.0.0.0.0.0.0.0.0.0.0.0.0.0.0.0.0.0.0.0.2.4.e.4.4.0.a.2.ip6.arpa. (265)
11:31:38.459917 IP6 fe80::1ac0:4dff:fe89:1174.5353 > ff02::fb.5353: 0 [6a] PTR (QM)? 1.8.0.0.0.0.0.0.0.0.0.0.0.0.0.0.0.0.0.0.0.0.0.0.2.4.e.4.4.0.a.2.ip6.arpa. (265)
11:31:42.939914 IP6 fe80::1ac0:4dff:fe89:1174.5353 > ff02::fb.5353: 0 [6a] PTR (QM)? 1.8.0.0.0.0.0.0.0.0.0.0.0.0.0.0.0.0.0.0.0.0.0.0.2.4.e.4.4.0.a.2.ip6.arpa. (265)
11:31:43.959648 IP6 fe80::1ac0:4dff:fe89:1174.5353 > ff02::fb.5353: 0 [6a] PTR (QM)? 1.8.0.0.0.0.0.0.0.0.0.0.0.0.0.0.0.0.0.0.0.0.0.0.2.4.e.4.4.0.a.2.ip6.arpa. (265)
```
