### ISSUE TITLE
DNS lookup for ephemeral urls causes DNS leakage with VPN tunnel active 

### ISSUE THREAD

**Issue by anshah1216** [systemd/systemd#28201]
### Component

Need to configure systemd-resolved to allow ephemeral URL to be resolved when the VPN is up without causing DNS leakage.

### Is your feature request related to a problem? Please describe

I'm using Ubuntu 20.04 with GlobalProtect for Linux, and I'm seeing DNS leakage from the physical interface (ens33) when trying to resolve an ephemeral URL using the DNS lookup utility. I'm using tcpdump on physical (ens33) and tunnel (gpd0) to detect leakage on the interface. I do not see this leakage for normal urls.

DNS Lookup for ephemeral URL
```
$ dig 84A6AEF711729113795D839A96E112C5.gr7.us-east-1.eks.amazonaws.com

; <<>> DiG 9.16.1-Ubuntu <<>> 84A6AEF711729113795D839A96E112C5.gr7.us-east-1.eks.amazonaws.com
;; global options: +cmd
;; Got answer:
;; ->>HEADER<<- opcode: QUERY, status: NOERROR, id: 4090
;; flags: qr rd ra; QUERY: 1, ANSWER: 2, AUTHORITY: 0, ADDITIONAL: 1

;; OPT PSEUDOSECTION:
; EDNS: version: 0, flags:; udp: 65494
;; QUESTION SECTION:
;84A6AEF711729113795D839A96E112C5.gr7.us-east-1.eks.amazonaws.com. IN A

;; ANSWER SECTION:
84A6AEF711729113795D839A96E112C5.gr7.us-east-1.eks.amazonaws.com. 5 IN A 10.41.143.5
84A6AEF711729113795D839A96E112C5.gr7.us-east-1.eks.amazonaws.com. 5 IN A 10.41.146.219

;; Query time: 28 msec
;; SERVER: 127.0.0.53#53(127.0.0.53)
;; WHEN: Thu Jun 29 08:48:19 PDT 2023
;; MSG SIZE  rcvd: 125
```

Physical and Tunnel tcpdump results for normal URL DNS Lookup

Physical Interface (ens33) LEAK!!!
```
$ sudo tcpdump -i ens33 port 53
08:48:19.954850 IP 192.168.194.130.50988 > 192.168.194.2.domain: 14338+ A? 84A6AEF711729113795D839A96E112C5.gr7.us-east-1.eks.amazonaws.com. (82)
08:48:19.982692 IP 192.168.194.2.domain > 192.168.194.130.50988: 14338 2/0/0 A 10.41.143.5, A 10.41.146.219 (114)
```

GP Tunnel Interface
```
$ sudo tcpdump -i gpd0 port 53
08:48:18.954476 IP 172.20.1.16.50988 > 172.20.1.1.domain: 4090+ [1au] A? 84A6AEF711729113795D839A96E112C5.gr7.us-east-1.eks.amazonaws.com. (105)
08:48:18.955322 IP 172.20.1.16.50988 > 172.20.1.1.domain: 20038+ PTR? 1.1.20.172.in-addr.arpa. (41)
08:48:19.030969 IP 172.20.1.1.domain > 172.20.1.16.50988: 20038 NXDomain 0/1/0 (138)
```

Here are my DNS / Domain settings when VPN tunnel is up:

**Resolv.conf**
```
$ cat /etc/resolv.conf
nameserver 172.20.2.1
nameserver 127.0.0.53
search localdomain
```

**DNS Settings**
```
$ resolvectl dns
Global: 172.20.1.1
Link 3 (gpd0): 172.20.1.1
Link 2 (ens33): 192.168.194.2

```

**Domain Settings**
```
$ sudo resolvectl domain
Global: localdomain
Link 3 (gpd0): ~.
Link 2 (ens33): ~. localdomain
```

### Describe the solution you'd like

Need to know how systemd-resolved can be configured to allow ephemeral urls to be resolved at the same time with no DNS leakage while the VPN tunnel is active.

### Describe alternatives you've considered

I tried disabling DNS Stub Listener but that cause ephemeral URLs fail to resolve.

### The systemd version you checked that didn't have the feature you are asking for

Whichever version that is available on Ubuntu 20.04.

**Comment by rpigott** [comment]
Remove the catch all route-only domain on ens33 if you don't want it to be considered for lookups.

**Comment by poettering** [comment]
i don't know what an "ephemeral URL" is, and what you mean by "resource leakage".

It appears to me you are asking for DNS routing features though but using a system with out any routing configured, just global configuration. As such, please read up on the docs, and may contact the systemd mailing list, where we deal with support questions.

This is a bug and feature tracker though, hence the wrong place. Closing.

**Comment by poettering** [comment]
*[Canned reply follows]*

This is a bug and feature request tracker, and not a support forum. In order to keep frustration at a minimum the submission form should have made this very clear.

If you have questions about systemd use or how to do or make use of certain things, please contact a more appropriate forum, for example the systemd mailing list:

https://lists.freedesktop.org/mailman/listinfo/systemd-devel

Thank you for understanding.
