### ISSUE TITLE
resolved returing REFUSED for local A lookups while NXDOMAIN for AAAA lookups

### ISSUE THREAD

**Issue by Luap99** [systemd/systemd#37969]
### systemd version the issue has been seen with

systemd-257.6-1.fc43.x86_64

### Used distribution

Fedora rawhide

### Linux kernel version used

6.16.0-0.rc2.24.fc43.x86_64

### CPU architectures issue was seen on

None

### Component

systemd-resolved

### Expected behaviour you didn't see

```
$ dig A abc. | grep status
;; ->>HEADER<<- opcode: QUERY, status: NXDOMAIN, id: 32568
$ dig AAAA abc. | grep status
;; ->>HEADER<<- opcode: QUERY, status: NXDOMAIN, id: 36016
```
I guess both returning REFUSED is also fine if you prefer to use REFUSED for local names without a domain but I would say it say it should be consistent.

### Unexpected behaviour you saw

```
$ dig A abc. | grep status
;; ->>HEADER<<- opcode: QUERY, status: REFUSED, id: 32568
$ dig AAAA abc. | grep status
;; ->>HEADER<<- opcode: QUERY, status: NXDOMAIN, id: 36016
```

Also worse in our podman CI we see a flake where sometimes the A query returns REFUSED while other times it returns NXDOMAIN, for two requests done shortly after, with tcpdump I was able to see this which seems super strange that we get two different status codes for the same request that return around the same time. However I was not able to reproduce this outside of our specific CI test suite.
```
13:13:33.188754 lo    In  IP 127.0.0.1.64666 > 127.0.0.53.53: 34345+ A? con1. (22)
13:13:35.690791 lo    In  IP 127.0.0.1.65506 > 127.0.0.53.53: 1146+ A? con1. (22)
13:13:36.468498 lo    In  IP 127.0.0.53.53 > 127.0.0.1.65506: 1146 Refused* 0/0/0 (22)
13:13:36.468540 lo    In  IP 127.0.0.53.53 > 127.0.0.1.64666: 34345 NXDomain* 0/0/0 (22)
```

### Steps to reproduce the problem

`dig A abc. | grep status`
`dig AAAA abc. | grep status`

Also the request are quite slow (close to 4s), I guess from looking at the logs because it does llmnr lookups each time? 

### Additional program output to the terminal or log subsystem illustrating the issue

```sh

```
