### ISSUE TITLE
resolved fails to use ::1 as only DNS server available.

### ISSUE THREAD

**Issue by Anvil** [systemd/systemd#18081]
**systemd version the issue has been seen with**
 > 246.7-2.fc33.x86_64

**Used distribution**
 > fedora 33

**Linux kernel version used** (`uname -a`)
 > 5.9.15-200.fc33.x86_64 (worked the same with 5.8 provided by fedora)

**CPU architecture issue was seen on**
 > x86_64 (from cpuinfo: model name: AMD Ryzen 5 4500U with Radeon Graphics)

**Expected behaviour you didn't see**
 > System DNS resolution should worked when '::1' is the only resolver configured in systemd-resolved

**Unexpected behaviour you saw**
 > System DNS resolution reports "connection times out" 

**Steps to reproduce the problem**
 > 
```bash
# Install power dns recursor, and ensure you have the host command
# With fedora 33, it's pdns-recursor-4.3.5-1.fc33.x86_64
dnf install pdns-recursor bind-utils-9.11.25-2.fc33.x86_64
# My local configuration is this.. Cant remember if I've explicitly changed anything from the default.
cat <<EOF > /etc/pdns-recursor/recursor.conf
allow-from=127.0.0.0/8, ::1/128, fe80::/10
local-address=127.0.0.1,::1
security-poll-suffix=
setgid=pdns-recursor
setuid=pdns-recursor
EOF
# Start it
systemctl restart pdns-recursor.service
# Check it's working
host google.com ::1
# This should report something like
# Using domain server:
# Name: ::1
# Address: ::1#53
# Aliases: 
# 
# google.com has address 172.217.21.14
# google.com has IPv6 address 2a00:1450:4006:808::200e
# google.com mail is handled by 10 aspmx.l.google.com.
# ...
# Next step, configure resolved and your network connection to only have ::1 as resolver
resolvectl
# And check you have something like:
# Global
#          Protocols: LLMNR=resolve -mDNS -DNSOverTLS DNSSEC=no/unsupported
#   resolv.conf mode: stub                                                 
# Current DNS Server: ::1                                                  
#        DNS Servers: ::1                                                  
# 
# Link 2 (wlp2s0)
#     Current Scopes: DNS LLMNR/IPv4 LLMNR/IPv6                                   
#          Protocols: +DefaultRoute +LLMNR -mDNS -DNSOverTLS DNSSEC=no/unsupported
# Current DNS Server: ::1                                                         
#        DNS Servers: ::1                                                         
#         DNS Domain: ~.
# 
#  While your host google.com ::1 should still working and
# your /etc/resolv.conf should be a symlink to resolved stub file
# /etc/resolv.conf -> ../run/systemd/resolve/stub-resolv.conf
# And its content should be:
# nameserver 127.0.0.53
# options edns0 trust-ad
# Check the resolution through resolved.
host google.com
# which currently reports
# ;; connection timed out; no servers could be reached

**Comment by poettering** [comment]
please provide log output from resolved when this happens, ideally with debug logging on, i.e. do "systemctl edit systemd-resolved" then type in:

```
[Service]
Environment=SYSTEMD_LOG_LEVEL=debug
```

then save/exit editor, and restart resolved, reproduce and paste output when this happens here.

**Comment by Anvil** [comment]
Hello @poettering, and happy new year.

```
janv. 07 00:46:36 krampoez systemd-resolved[28578]: Processing query...
janv. 07 00:46:39 krampoez systemd-resolved[28578]: Got message type=method_call sender=:1.4577 destination=org.freedesktop.resolve1 path=/org/freedesktop/resolve1 interface=org.freedesktop.resolve1.Manager member=ResolveHostname cookie=2 reply_cookie=0 signature=isit error-name=n/a error-message=n/a
janv. 07 00:46:39 krampoez systemd-resolved[28578]: idn2_lookup_u8: push.services.mozilla.com → push.services.mozilla.com
janv. 07 00:46:39 krampoez systemd-resolved[28578]: Looking up RR for push.services.mozilla.com IN A.
janv. 07 00:46:39 krampoez systemd-resolved[28578]: Looking up RR for push.services.mozilla.com IN AAAA.
janv. 07 00:46:39 krampoez systemd-resolved[28578]: Sent message type=method_call sender=n/a destination=org.freedesktop.DBus path=/org/freedesktop/DBus interface=org.freedesktop.DBus member=AddMatch cookie=3938 reply_cookie=0 signature=s error-name=n/a error-message=n/a
janv. 07 00:46:39 krampoez systemd-resolved[28578]: Sent message type=method_call sender=n/a destination=org.freedesktop.DBus path=/org/freedesktop/DBus interface=org.freedesktop.DBus member=GetNameOwner cookie=3939 reply_cookie=0 signature=s error-name=n/a error-message=n/a
janv. 07 00:46:39 krampoez systemd-resolved[28578]: Got message type=method_return sender=org.freedesktop.DBus destination=:1.3578 path=n/a interface=n/a member=n/a cookie=4294967295 reply_cookie=3939 signature=s error-name=n/a error-message=n/a
janv. 07 00:46:39 krampoez systemd-resolved[28578]: Cache miss for push.services.mozilla.com IN A
janv. 07 00:46:39 krampoez systemd-resolved[28578]: Transaction 57938 for <push.services.mozilla.com IN A> scope dns on wlp2s0/*.
janv. 07 00:46:39 krampoez systemd-resolved[28578]: Using feature level UDP+EDNS0 for transaction 57938.
janv. 07 00:46:39 krampoez systemd-resolved[28578]: Using DNS server ::1 for transaction 57938.
janv. 07 00:46:39 krampoez systemd-resolved[28578]: Sending query packet with id 57938 of size 54.
janv. 07 00:46:39 krampoez systemd-resolved[28578]: Cache miss for push.services.mozilla.com IN A
janv. 07 00:46:39 krampoez systemd-resolved[28578]: Transaction 57938 for <push.services.mozilla.com IN A> scope dns on wlp2s0/*.
janv. 07 00:46:39 krampoez systemd-resolved[28578]: Using feature level UDP+EDNS0 for transaction 57938.
janv. 07 00:46:39 krampoez systemd-resolved[28578]: Sending query packet with id 57938 of size 54.
janv. 07 00:46:39 krampoez systemd-resolved[28578]: Cache miss for push.services.mozilla.com IN A
janv. 07 00:46:39 krampoez systemd-resolved[28578]: Transaction 57938 for <push.services.mozilla.com IN A> scope dns on wlp2s0/*.
janv. 07 00:46:39 krampoez systemd-resolved[28578]: Using feature level UDP+EDNS0 for transaction 57938.
janv. 07 00:46:39 krampoez systemd-resolved[28578]: Sending query packet with id 57938 of size 54.
janv. 07 00:46:39 krampoez systemd-resolved[28578]: Cache miss for push.services.mozilla.com IN A
janv. 07 00:46:39 krampoez systemd-resolved[28578]: Transaction 57938 for <push.services.mozilla.com IN A> scope dns on wlp2s0/*.
janv. 07 00:46:39 krampoez systemd-resolved[28578]: Using feature level UDP+EDNS0 for transaction 57938.
janv. 07 00:46:39 krampoez systemd-resolved[28578]: Sending query packet with id 57938 of size 54.
janv. 07 00:46:39 krampoez systemd-resolved[28578]: Cache miss for push.services.mozilla.com IN A
janv. 07 00:46:39 krampoez systemd-resolved[28578]: Transaction 57938 for <push.services.mozilla.com IN A> scope dns on wlp2s0/*.
janv. 07 00:46:39 krampoez systemd-resolved[28578]: Using feature level UDP+EDNS0 for transaction 57938.
janv. 07 00:46:39 krampoez systemd-resolved[28578]: Sending query packet with id 57938 of size 54.
janv. 07 00:46:39 krampoez systemd-resolved[28578]: Cache miss for push.services.mozilla.com IN A
janv. 07 00:46:39 krampoez systemd-resolved[28578]: Transaction 57938 for <push.services.mozilla.com IN A> scope dns on wlp2s0/*.
janv. 07 00:46:39 krampoez systemd-resolved[28578]: Using feature level UDP+EDNS0 for transaction 57938.
janv. 07 00:46:39 krampoez systemd-resolved[28578]: Sending query packet with id 57938 of size 54.
janv. 07 00:46:39 krampoez systemd-resolved[28578]: Cache miss for push.services.mozilla.com IN A
janv. 07 00:46:39 krampoez systemd-resolved[28578]: Transaction 57938 for <push.services.mozilla.com IN A> scope dns on wlp2s0/*.
janv. 07 00:46:39 krampoez systemd-resolved[28578]: Using feature level UDP+EDNS0 for transaction 57938.
janv. 07 00:46:39 krampoez systemd-resolved[28578]: Sending query packet with id 57938 of size 54.
janv. 07 00:46:39 krampoez systemd-resolved[28578]: Cache miss for push.services.mozilla.com IN A
janv. 07 00:46:39 krampoez systemd-resolved[28578]: Transaction 57938 for <push.services.mozilla.com IN A> scope dns on wlp2s0/*.
janv. 07 00:46:39 krampoez systemd-resolved[28578]: Using feature level UDP+EDNS0 for transaction 57938.
janv. 07 00:46:39 krampoez systemd-resolved[28578]: Sending query packet with id 57938 of size 54.
janv. 07 00:46:39 krampoez systemd-resolved[28578]: Cache miss for push.services.mozilla.com IN A
janv. 07 00:46:39 krampoez systemd-resolved[28578]: Transaction 57938 for <push.services.mozilla.com IN A> scope dns on wlp2s0/*.
janv. 07 00:46:39 krampoez systemd-resolved[28578]: Using feature level UDP+EDNS0 for transaction 57938.
janv. 07 00:46:39 krampoez systemd-resolved[28578]: Sending query packet with id 57938 of size 54.
janv. 07 00:46:39 krampoez systemd-resolved[28578]: Cache miss for push.services.mozilla.com IN A
janv. 07 00:46:39 krampoez systemd-resolved[28578]: Transaction 57938 for <push.services.mozilla.com IN A> scope dns on wlp2s0/*.
janv. 07 00:46:39 krampoez systemd-resolved[28578]: Using feature level UDP+EDNS0 for transaction 57938.
janv. 07 00:46:39 krampoez systemd-resolved[28578]: Sending query packet with id 57938 of size 54.
janv. 07 00:46:39 krampoez systemd-resolved[28578]: Cache miss for push.services.mozilla.com IN A
janv. 07 00:46:39 krampoez systemd-resolved[28578]: Transaction 57938 for <push.services.mozilla.com IN A> scope dns on wlp2s0/*.
janv. 07 00:46:39 krampoez systemd-resolved[28578]: Using feature level UDP+EDNS0 for transaction 57938.
janv. 07 00:46:39 krampoez systemd-resolved[28578]: Sending query packet with id 57938 of size 54.
janv. 07 00:46:39 krampoez systemd-resolved[28578]: Cache miss for push.services.mozilla.com IN A
janv. 07 00:46:39 krampoez systemd-resolved[28578]: Transaction 57938 for <push.services.mozilla.com IN A> scope dns on wlp2s0/*.
janv. 07 00:46:39 krampoez systemd-resolved[28578]: Using feature level UDP+EDNS0 for transaction 57938.
janv. 07 00:46:39 krampoez systemd-resolved[28578]: Sending query packet with id 57938 of size 54.
janv. 07 00:46:39 krampoez systemd-resolved[28578]: Cache miss for push.services.mozilla.com IN A
janv. 07 00:46:39 krampoez systemd-resolved[28578]: Transaction 57938 for <push.services.mozilla.com IN A> scope dns on wlp2s0/*.
janv. 07 00:46:39 krampoez systemd-resolved[28578]: Using feature level UDP+EDNS0 for transaction 57938.
janv. 07 00:46:39 krampoez systemd-resolved[28578]: Sending query packet with id 57938 of size 54.
janv. 07 00:46:39 krampoez systemd-resolved[28578]: Cache miss for push.services.mozilla.com IN A
janv. 07 00:46:39 krampoez systemd-resolved[28578]: Transaction 57938 for <push.services.mozilla.com IN A> scope dns on wlp2s0/*.
janv. 07 00:46:39 krampoez systemd-resolved[28578]: Using feature level UDP+EDNS0 for transaction 57938.
janv. 07 00:46:39 krampoez systemd-resolved[28578]: Sending query packet with id 57938 of size 54.
janv. 07 00:46:39 krampoez systemd-resolved[28578]: Cache miss for push.services.mozilla.com IN A
janv. 07 00:46:39 krampoez systemd-resolved[28578]: Transaction 57938 for <push.services.mozilla.com IN A> scope dns on wlp2s0/*.
janv. 07 00:46:39 krampoez systemd-resolved[28578]: Using feature level UDP+EDNS0 for transaction 57938.
janv. 07 00:46:39 krampoez systemd-resolved[28578]: Sending query packet with id 57938 of size 54.
janv. 07 00:46:39 krampoez systemd-resolved[28578]: Cache miss for push.services.mozilla.com IN A
janv. 07 00:46:39 krampoez systemd-resolved[28578]: Transaction 57938 for <push.services.mozilla.com IN A> scope dns on wlp2s0/*.
janv. 07 00:46:39 krampoez systemd-resolved[28578]: Using feature level UDP+EDNS0 for transaction 57938.
janv. 07 00:46:39 krampoez systemd-resolved[28578]: Sending query packet with id 57938 of size 54.
janv. 07 00:46:39 krampoez systemd-resolved[28578]: Cache miss for push.services.mozilla.com IN A
janv. 07 00:46:39 krampoez systemd-resolved[28578]: Transaction 57938 for <push.services.mozilla.com IN A> scope dns on wlp2s0/*.
janv. 07 00:46:39 krampoez systemd-resolved[28578]: Using feature level UDP+EDNS0 for transaction 57938.
janv. 07 00:46:39 krampoez systemd-resolved[28578]: Sending query packet with id 57938 of size 54.
janv. 07 00:46:39 krampoez systemd-resolved[28578]: Cache miss for push.services.mozilla.com IN A
janv. 07 00:46:39 krampoez systemd-resolved[28578]: Transaction 57938 for <push.services.mozilla.com IN A> scope dns on wlp2s0/*.
janv. 07 00:46:39 krampoez systemd-resolved[28578]: Using feature level UDP+EDNS0 for transaction 57938.
janv. 07 00:46:39 krampoez systemd-resolved[28578]: Sending query packet with id 57938 of size 54.
janv. 07 00:46:39 krampoez systemd-resolved[28578]: Cache miss for push.services.mozilla.com IN A
janv. 07 00:46:39 krampoez systemd-resolved[28578]: Transaction 57938 for <push.services.mozilla.com IN A> scope dns on wlp2s0/*.
janv. 07 00:46:39 krampoez systemd-resolved[28578]: Using feature level UDP+EDNS0 for transaction 57938.
janv. 07 00:46:39 krampoez systemd-resolved[28578]: Sending query packet with id 57938 of size 54.
janv. 07 00:46:39 krampoez systemd-resolved[28578]: Cache miss for push.services.mozilla.com IN A
janv. 07 00:46:39 krampoez systemd-resolved[28578]: Transaction 57938 for <push.services.mozilla.com IN A> scope dns on wlp2s0/*.
janv. 07 00:46:39 krampoez systemd-resolved[28578]: Using feature level UDP+EDNS0 for transaction 57938.
janv. 07 00:46:39 krampoez systemd-resolved[28578]: Sending query packet with id 57938 of size 54.
janv. 07 00:46:39 krampoez systemd-resolved[28578]: Cache miss for push.services.mozilla.com IN A
janv. 07 00:46:39 krampoez systemd-resolved[28578]: Transaction 57938 for <push.services.mozilla.com IN A> scope dns on wlp2s0/*.
janv. 07 00:46:39 krampoez systemd-resolved[28578]: Using feature level UDP+EDNS0 for transaction 57938.
janv. 07 00:46:39 krampoez systemd-resolved[28578]: Sending query packet with id 57938 of size 54.
janv. 07 00:46:39 krampoez systemd-resolved[28578]: Cache miss for push.services.mozilla.com IN A
janv. 07 00:46:39 krampoez systemd-resolved[28578]: Transaction 57938 for <push.services.mozilla.com IN A> scope dns on wlp2s0/*.
janv. 07 00:46:39 krampoez systemd-resolved[28578]: Using feature level UDP+EDNS0 for transaction 57938.
janv. 07 00:46:39 krampoez systemd-resolved[28578]: Sending query packet with id 57938 of size 54.
janv. 07 00:46:39 krampoez systemd-resolved[28578]: Cache miss for push.services.mozilla.com IN A
janv. 07 00:46:39 krampoez systemd-resolved[28578]: Transaction 57938 for <push.services.mozilla.com IN A> scope dns on wlp2s0/*.
janv. 07 00:46:39 krampoez systemd-resolved[28578]: Using feature level UDP+EDNS0 for transaction 57938.
janv. 07 00:46:39 krampoez systemd-resolved[28578]: Sending query packet with id 57938 of size 54.
janv. 07 00:46:39 krampoez systemd-resolved[28578]: Cache miss for push.services.mozilla.com IN A
janv. 07 00:46:39 krampoez systemd-resolved[28578]: Transaction 57938 for <push.services.mozilla.com IN A> scope dns on wlp2s0/*.
janv. 07 00:46:39 krampoez systemd-resolved[28578]: Using feature level UDP+EDNS0 for transaction 57938.
janv. 07 00:46:39 krampoez systemd-resolved[28578]: Sending query packet with id 57938 of size 54.
janv. 07 00:46:39 krampoez systemd-resolved[28578]: Transaction 57938 for <push.services.mozilla.com IN A> on scope dns on wlp2s0/* now complete with <attempts-max-reached> from none (unsigned).
janv. 07 00:46:39 krampoez systemd-resolved[28578]: Cache miss for push.services.mozilla.com IN AAAA
janv. 07 00:46:39 krampoez systemd-resolved[28578]: Transaction 16065 for <push.services.mozilla.com IN AAAA> scope dns on wlp2s0/*.
janv. 07 00:46:39 krampoez systemd-resolved[28578]: Using feature level UDP+EDNS0 for transaction 16065.
janv. 07 00:46:39 krampoez systemd-resolved[28578]: Using DNS server ::1 for transaction 16065.
janv. 07 00:46:39 krampoez systemd-resolved[28578]: Sending query packet with id 16065 of size 54.
janv. 07 00:46:39 krampoez systemd-resolved[28578]: Cache miss for push.services.mozilla.com IN AAAA
janv. 07 00:46:39 krampoez systemd-resolved[28578]: Transaction 16065 for <push.services.mozilla.com IN AAAA> scope dns on wlp2s0/*.
janv. 07 00:46:39 krampoez systemd-resolved[28578]: Using feature level UDP+EDNS0 for transaction 16065.
janv. 07 00:46:39 krampoez systemd-resolved[28578]: Sending query packet with id 16065 of size 54.
janv. 07 00:46:39 krampoez systemd-resolved[28578]: Cache miss for push.services.mozilla.com IN AAAA
janv. 07 00:46:39 krampoez systemd-resolved[28578]: Transaction 16065 for <push.services.mozilla.com IN AAAA> scope dns on wlp2s0/*.
janv. 07 00:46:39 krampoez systemd-resolved[28578]: Using feature level UDP+EDNS0 for transaction 16065.
janv. 07 00:46:39 krampoez systemd-resolved[28578]: Sending query packet with id 16065 of size 54.
janv. 07 00:46:39 krampoez systemd-resolved[28578]: Cache miss for push.services.mozilla.com IN AAAA
janv. 07 00:46:39 krampoez systemd-resolved[28578]: Transaction 16065 for <push.services.mozilla.com IN AAAA> scope dns on wlp2s0/*.
janv. 07 00:46:39 krampoez systemd-resolved[28578]: Using feature level UDP+EDNS0 for transaction 16065.
janv. 07 00:46:39 krampoez systemd-resolved[28578]: Sending query packet with id 16065 of size 54.
janv. 07 00:46:39 krampoez systemd-resolved[28578]: Cache miss for push.services.mozilla.com IN AAAA
janv. 07 00:46:39 krampoez systemd-resolved[28578]: Transaction 16065 for <push.services.mozilla.com IN AAAA> scope dns on wlp2s0/*.
janv. 07 00:46:39 krampoez systemd-resolved[28578]: Using feature level UDP+EDNS0 for transaction 16065.
janv. 07 00:46:39 krampoez systemd-resolved[28578]: Sending query packet with id 16065 of size 54.
janv. 07 00:46:39 krampoez systemd-resolved[28578]: Cache miss for push.services.mozilla.com IN AAAA
janv. 07 00:46:39 krampoez systemd-resolved[28578]: Transaction 16065 for <push.services.mozilla.com IN AAAA> scope dns on wlp2s0/*.
janv. 07 00:46:39 krampoez systemd-resolved[28578]: Using feature level UDP+EDNS0 for transaction 16065.
janv. 07 00:46:39 krampoez systemd-resolved[28578]: Sending query packet with id 16065 of size 54.
janv. 07 00:46:39 krampoez systemd-resolved[28578]: Cache miss for push.services.mozilla.com IN AAAA
janv. 07 00:46:39 krampoez systemd-resolved[28578]: Transaction 16065 for <push.services.mozilla.com IN AAAA> scope dns on wlp2s0/*.
janv. 07 00:46:39 krampoez systemd-resolved[28578]: Using feature level UDP+EDNS0 for transaction 16065.
janv. 07 00:46:39 krampoez systemd-resolved[28578]: Sending query packet with id 16065 of size 54.
janv. 07 00:46:39 krampoez systemd-resolved[28578]: Cache miss for push.services.mozilla.com IN AAAA
janv. 07 00:46:39 krampoez systemd-resolved[28578]: Transaction 16065 for <push.services.mozilla.com IN AAAA> scope dns on wlp2s0/*.
janv. 07 00:46:39 krampoez systemd-resolved[28578]: Using feature level UDP+EDNS0 for transaction 16065.
janv. 07 00:46:39 krampoez systemd-resolved[28578]: Sending query packet with id 16065 of size 54.
janv. 07 00:46:39 krampoez systemd-resolved[28578]: Cache miss for push.services.mozilla.com IN AAAA
janv. 07 00:46:39 krampoez systemd-resolved[28578]: Transaction 16065 for <push.services.mozilla.com IN AAAA> scope dns on wlp2s0/*.
janv. 07 00:46:39 krampoez systemd-resolved[28578]: Using feature level UDP+EDNS0 for transaction 16065.
janv. 07 00:46:39 krampoez systemd-resolved[28578]: Sending query packet with id 16065 of size 54.
janv. 07 00:46:39 krampoez systemd-resolved[28578]: Cache miss for push.services.mozilla.com IN AAAA
janv. 07 00:46:39 krampoez systemd-resolved[28578]: Transaction 16065 for <push.services.mozilla.com IN AAAA> scope dns on wlp2s0/*.
janv. 07 00:46:39 krampoez systemd-resolved[28578]: Using feature level UDP+EDNS0 for transaction 16065.
janv. 07 00:46:39 krampoez systemd-resolved[28578]: Sending query packet with id 16065 of size 54.
janv. 07 00:46:39 krampoez systemd-resolved[28578]: Cache miss for push.services.mozilla.com IN AAAA
janv. 07 00:46:39 krampoez systemd-resolved[28578]: Transaction 16065 for <push.services.mozilla.com IN AAAA> scope dns on wlp2s0/*.
janv. 07 00:46:39 krampoez systemd-resolved[28578]: Using feature level UDP+EDNS0 for transaction 16065.
janv. 07 00:46:39 krampoez systemd-resolved[28578]: Sending query packet with id 16065 of size 54.
janv. 07 00:46:39 krampoez systemd-resolved[28578]: Cache miss for push.services.mozilla.com IN AAAA
janv. 07 00:46:39 krampoez systemd-resolved[28578]: Transaction 16065 for <push.services.mozilla.com IN AAAA> scope dns on wlp2s0/*.
janv. 07 00:46:39 krampoez systemd-resolved[28578]: Using feature level UDP+EDNS0 for transaction 16065.
janv. 07 00:46:39 krampoez systemd-resolved[28578]: Sending query packet with id 16065 of size 54.
janv. 07 00:46:39 krampoez systemd-resolved[28578]: Cache miss for push.services.mozilla.com IN AAAA
janv. 07 00:46:39 krampoez systemd-resolved[28578]: Transaction 16065 for <push.services.mozilla.com IN AAAA> scope dns on wlp2s0/*.
janv. 07 00:46:39 krampoez systemd-resolved[28578]: Using feature level UDP+EDNS0 for transaction 16065.
janv. 07 00:46:39 krampoez systemd-resolved[28578]: Sending query packet with id 16065 of size 54.
janv. 07 00:46:39 krampoez systemd-resolved[28578]: Cache miss for push.services.mozilla.com IN AAAA
janv. 07 00:46:39 krampoez systemd-resolved[28578]: Transaction 16065 for <push.services.mozilla.com IN AAAA> scope dns on wlp2s0/*.
janv. 07 00:46:39 krampoez systemd-resolved[28578]: Using feature level UDP+EDNS0 for transaction 16065.
janv. 07 00:46:39 krampoez systemd-resolved[28578]: Sending query packet with id 16065 of size 54.
janv. 07 00:46:39 krampoez systemd-resolved[28578]: Cache miss for push.services.mozilla.com IN AAAA
janv. 07 00:46:39 krampoez systemd-resolved[28578]: Transaction 16065 for <push.services.mozilla.com IN AAAA> scope dns on wlp2s0/*.
janv. 07 00:46:39 krampoez systemd-resolved[28578]: Using feature level UDP+EDNS0 for transaction 16065.
janv. 07 00:46:39 krampoez systemd-resolved[28578]: Sending query packet with id 16065 of size 54.
janv. 07 00:46:39 krampoez systemd-resolved[28578]: Cache miss for push.services.mozilla.com IN AAAA
janv. 07 00:46:39 krampoez systemd-resolved[28578]: Transaction 16065 for <push.services.mozilla.com IN AAAA> scope dns on wlp2s0/*.
janv. 07 00:46:39 krampoez systemd-resolved[28578]: Using feature level UDP+EDNS0 for transaction 16065.
janv. 07 00:46:39 krampoez systemd-resolved[28578]: Sending query packet with id 16065 of size 54.
janv. 07 00:46:39 krampoez systemd-resolved[28578]: Cache miss for push.services.mozilla.com IN AAAA
janv. 07 00:46:39 krampoez systemd-resolved[28578]: Transaction 16065 for <push.services.mozilla.com IN AAAA> scope dns on wlp2s0/*.
janv. 07 00:46:39 krampoez systemd-resolved[28578]: Using feature level UDP+EDNS0 for transaction 16065.
janv. 07 00:46:39 krampoez systemd-resolved[28578]: Sending query packet with id 16065 of size 54.
janv. 07 00:46:39 krampoez systemd-resolved[28578]: Cache miss for push.services.mozilla.com IN AAAA
janv. 07 00:46:39 krampoez systemd-resolved[28578]: Transaction 16065 for <push.services.mozilla.com IN AAAA> scope dns on wlp2s0/*.
janv. 07 00:46:39 krampoez systemd-resolved[28578]: Using feature level UDP+EDNS0 for transaction 16065.
janv. 07 00:46:39 krampoez systemd-resolved[28578]: Sending query packet with id 16065 of size 54.
janv. 07 00:46:39 krampoez systemd-resolved[28578]: Cache miss for push.services.mozilla.com IN AAAA
janv. 07 00:46:39 krampoez systemd-resolved[28578]: Transaction 16065 for <push.services.mozilla.com IN AAAA> scope dns on wlp2s0/*.
janv. 07 00:46:39 krampoez systemd-resolved[28578]: Using feature level UDP+EDNS0 for transaction 16065.
janv. 07 00:46:39 krampoez systemd-resolved[28578]: Sending query packet with id 16065 of size 54.
janv. 07 00:46:39 krampoez systemd-resolved[28578]: Cache miss for push.services.mozilla.com IN AAAA
janv. 07 00:46:39 krampoez systemd-resolved[28578]: Transaction 16065 for <push.services.mozilla.com IN AAAA> scope dns on wlp2s0/*.
janv. 07 00:46:39 krampoez systemd-resolved[28578]: Using feature level UDP+EDNS0 for transaction 16065.
janv. 07 00:46:39 krampoez systemd-resolved[28578]: Sending query packet with id 16065 of size 54.
janv. 07 00:46:39 krampoez systemd-resolved[28578]: Cache miss for push.services.mozilla.com IN AAAA
janv. 07 00:46:39 krampoez systemd-resolved[28578]: Transaction 16065 for <push.services.mozilla.com IN AAAA> scope dns on wlp2s0/*.
janv. 07 00:46:39 krampoez systemd-resolved[28578]: Using feature level UDP+EDNS0 for transaction 16065.
janv. 07 00:46:39 krampoez systemd-resolved[28578]: Sending query packet with id 16065 of size 54.
janv. 07 00:46:39 krampoez systemd-resolved[28578]: Cache miss for push.services.mozilla.com IN AAAA
janv. 07 00:46:39 krampoez systemd-resolved[28578]: Transaction 16065 for <push.services.mozilla.com IN AAAA> scope dns on wlp2s0/*.
janv. 07 00:46:39 krampoez systemd-resolved[28578]: Using feature level UDP+EDNS0 for transaction 16065.
janv. 07 00:46:39 krampoez systemd-resolved[28578]: Sending query packet with id 16065 of size 54.
janv. 07 00:46:39 krampoez systemd-resolved[28578]: Cache miss for push.services.mozilla.com IN AAAA
janv. 07 00:46:39 krampoez systemd-resolved[28578]: Transaction 16065 for <push.services.mozilla.com IN AAAA> scope dns on wlp2s0/*.
janv. 07 00:46:39 krampoez systemd-resolved[28578]: Using feature level UDP+EDNS0 for transaction 16065.
janv. 07 00:46:39 krampoez systemd-resolved[28578]: Sending query packet with id 16065 of size 54.
janv. 07 00:46:39 krampoez systemd-resolved[28578]: Cache miss for push.services.mozilla.com IN AAAA
janv. 07 00:46:39 krampoez systemd-resolved[28578]: Transaction 16065 for <push.services.mozilla.com IN AAAA> scope dns on wlp2s0/*.
janv. 07 00:46:39 krampoez systemd-resolved[28578]: Using feature level UDP+EDNS0 for transaction 16065.
janv. 07 00:46:39 krampoez systemd-resolved[28578]: Sending query packet with id 16065 of size 54.
janv. 07 00:46:39 krampoez systemd-resolved[28578]: Transaction 16065 for <push.services.mozilla.com IN AAAA> on scope dns on wlp2s0/* now complete with <attempts-max-reached> from none (unsigned).
janv. 07 00:46:39 krampoez systemd-resolved[28578]: Freeing transaction 57938.
janv. 07 00:46:39 krampoez systemd-resolved[28578]: Freeing transaction 16065.
janv. 07 00:46:39 krampoez systemd-resolved[28578]: Sent message type=error sender=n/a destination=:1.4577 path=n/a interface=n/a member=n/a cookie=3940 reply_cookie=2 signature=s error-name=org.freedesktop.DBus.Error.Timeout error-message=All attempts to contact name servers or networks failed
janv. 07 00:46:39 krampoez systemd-resolved[28578]: Sent message type=method_call sender=n/a destination=org.freedesktop.DBus path=/org/freedesktop/DBus interface=org.freedesktop.DBus member=RemoveMatch cookie=3941 reply_cookie=0 signature=s error-name=n/a error-message=n/a
janv. 07 00:46:39 krampoez systemd-resolved[28578]: Got message type=method_return sender=org.freedesktop.DBus destination=:1.3578 path=n/a interface=n/a member=n/a cookie=4294967295 reply_cookie=3938 signature= error-name=n/a error-message=n/a
janv. 07 00:46:39 krampoez systemd-resolved[28578]: Got DNS stub UDP query packet for id 53588
janv. 07 00:46:39 krampoez systemd-resolved[28578]: Looking up RR for push.services.mozilla.com IN A.
janv. 07 00:46:39 krampoez systemd-resolved[28578]: Cache miss for push.services.mozilla.com IN A
janv. 07 00:46:39 krampoez systemd-resolved[28578]: Transaction 61288 for <push.services.mozilla.com IN A> scope dns on wlp2s0/*.
janv. 07 00:46:39 krampoez systemd-resolved[28578]: Using feature level UDP+EDNS0 for transaction 61288.
janv. 07 00:46:39 krampoez systemd-resolved[28578]: Using DNS server ::1 for transaction 61288.
janv. 07 00:46:39 krampoez systemd-resolved[28578]: Sending query packet with id 61288 of size 54.
janv. 07 00:46:39 krampoez systemd-resolved[28578]: Cache miss for push.services.mozilla.com IN A
janv. 07 00:46:39 krampoez systemd-resolved[28578]: Transaction 61288 for <push.services.mozilla.com IN A> scope dns on wlp2s0/*.
janv. 07 00:46:39 krampoez systemd-resolved[28578]: Using feature level UDP+EDNS0 for transaction 61288.
janv. 07 00:46:39 krampoez systemd-resolved[28578]: Sending query packet with id 61288 of size 54.
janv. 07 00:46:39 krampoez systemd-resolved[28578]: Cache miss for push.services.mozilla.com IN A
janv. 07 00:46:39 krampoez systemd-resolved[28578]: Transaction 61288 for <push.services.mozilla.com IN A> scope dns on wlp2s0/*.
janv. 07 00:46:39 krampoez systemd-resolved[28578]: Using feature level UDP+EDNS0 for transaction 61288.
janv. 07 00:46:39 krampoez systemd-resolved[28578]: Sending query packet with id 61288 of size 54.
janv. 07 00:46:39 krampoez systemd-resolved[28578]: Cache miss for push.services.mozilla.com IN A
janv. 07 00:46:39 krampoez systemd-resolved[28578]: Transaction 61288 for <push.services.mozilla.com IN A> scope dns on wlp2s0/*.
janv. 07 00:46:39 krampoez systemd-resolved[28578]: Using feature level UDP+EDNS0 for transaction 61288.
janv. 07 00:46:39 krampoez systemd-resolved[28578]: Sending query packet with id 61288 of size 54.
janv. 07 00:46:39 krampoez systemd-resolved[28578]: Cache miss for push.services.mozilla.com IN A
janv. 07 00:46:39 krampoez systemd-resolved[28578]: Transaction 61288 for <push.services.mozilla.com IN A> scope dns on wlp2s0/*.
janv. 07 00:46:39 krampoez systemd-resolved[28578]: Using feature level UDP+EDNS0 for transaction 61288.
janv. 07 00:46:39 krampoez systemd-resolved[28578]: Sending query packet with id 61288 of size 54.
janv. 07 00:46:39 krampoez systemd-resolved[28578]: Cache miss for push.services.mozilla.com IN A
janv. 07 00:46:39 krampoez systemd-resolved[28578]: Transaction 61288 for <push.services.mozilla.com IN A> scope dns on wlp2s0/*.
janv. 07 00:46:39 krampoez systemd-resolved[28578]: Using feature level UDP+EDNS0 for transaction 61288.
janv. 07 00:46:39 krampoez systemd-resolved[28578]: Sending query packet with id 61288 of size 54.
janv. 07 00:46:39 krampoez systemd-resolved[28578]: Cache miss for push.services.mozilla.com IN A
janv. 07 00:46:39 krampoez systemd-resolved[28578]: Transaction 61288 for <push.services.mozilla.com IN A> scope dns on wlp2s0/*.
janv. 07 00:46:39 krampoez systemd-resolved[28578]: Using feature level UDP+EDNS0 for transaction 61288.
janv. 07 00:46:39 krampoez systemd-resolved[28578]: Sending query packet with id 61288 of size 54.
janv. 07 00:46:39 krampoez systemd-resolved[28578]: Cache miss for push.services.mozilla.com IN A
janv. 07 00:46:39 krampoez systemd-resolved[28578]: Transaction 61288 for <push.services.mozilla.com IN A> scope dns on wlp2s0/*.
janv. 07 00:46:39 krampoez systemd-resolved[28578]: Using feature level UDP+EDNS0 for transaction 61288.
janv. 07 00:46:39 krampoez systemd-resolved[28578]: Sending query packet with id 61288 of size 54.
janv. 07 00:46:39 krampoez systemd-resolved[28578]: Cache miss for push.services.mozilla.com IN A
janv. 07 00:46:39 krampoez systemd-resolved[28578]: Transaction 61288 for <push.services.mozilla.com IN A> scope dns on wlp2s0/*.
janv. 07 00:46:39 krampoez systemd-resolved[28578]: Using feature level UDP+EDNS0 for transaction 61288.
janv. 07 00:46:39 krampoez systemd-resolved[28578]: Sending query packet with id 61288 of size 54.
janv. 07 00:46:39 krampoez systemd-resolved[28578]: Cache miss for push.services.mozilla.com IN A
janv. 07 00:46:39 krampoez systemd-resolved[28578]: Transaction 61288 for <push.services.mozilla.com IN A> scope dns on wlp2s0/*.
janv. 07 00:46:39 krampoez systemd-resolved[28578]: Using feature level UDP+EDNS0 for transaction 61288.
janv. 07 00:46:39 krampoez systemd-resolved[28578]: Sending query packet with id 61288 of size 54.
janv. 07 00:46:39 krampoez systemd-resolved[28578]: Cache miss for push.services.mozilla.com IN A
janv. 07 00:46:39 krampoez systemd-resolved[28578]: Transaction 61288 for <push.services.mozilla.com IN A> scope dns on wlp2s0/*.
janv. 07 00:46:39 krampoez systemd-resolved[28578]: Using feature level UDP+EDNS0 for transaction 61288.
janv. 07 00:46:39 krampoez systemd-resolved[28578]: Sending query packet with id 61288 of size 54.
janv. 07 00:46:39 krampoez systemd-resolved[28578]: Cache miss for push.services.mozilla.com IN A
janv. 07 00:46:39 krampoez systemd-resolved[28578]: Transaction 61288 for <push.services.mozilla.com IN A> scope dns on wlp2s0/*.
janv. 07 00:46:39 krampoez systemd-resolved[28578]: Using feature level UDP+EDNS0 for transaction 61288.
janv. 07 00:46:39 krampoez systemd-resolved[28578]: Sending query packet with id 61288 of size 54.
janv. 07 00:46:39 krampoez systemd-resolved[28578]: Cache miss for push.services.mozilla.com IN A
janv. 07 00:46:39 krampoez systemd-resolved[28578]: Transaction 61288 for <push.services.mozilla.com IN A> scope dns on wlp2s0/*.
janv. 07 00:46:39 krampoez systemd-resolved[28578]: Using feature level UDP+EDNS0 for transaction 61288.
janv. 07 00:46:39 krampoez systemd-resolved[28578]: Sending query packet with id 61288 of size 54.
janv. 07 00:46:39 krampoez systemd-resolved[28578]: Cache miss for push.services.mozilla.com IN A
janv. 07 00:46:39 krampoez systemd-resolved[28578]: Transaction 61288 for <push.services.mozilla.com IN A> scope dns on wlp2s0/*.
janv. 07 00:46:39 krampoez systemd-resolved[28578]: Using feature level UDP+EDNS0 for transaction 61288.
janv. 07 00:46:39 krampoez systemd-resolved[28578]: Sending query packet with id 61288 of size 54.
janv. 07 00:46:39 krampoez systemd-resolved[28578]: Cache miss for push.services.mozilla.com IN A
janv. 07 00:46:39 krampoez systemd-resolved[28578]: Transaction 61288 for <push.services.mozilla.com IN A> scope dns on wlp2s0/*.
janv. 07 00:46:39 krampoez systemd-resolved[28578]: Using feature level UDP+EDNS0 for transaction 61288.
janv. 07 00:46:39 krampoez systemd-resolved[28578]: Sending query packet with id 61288 of size 54.
janv. 07 00:46:39 krampoez systemd-resolved[28578]: Cache miss for push.services.mozilla.com IN A
janv. 07 00:46:39 krampoez systemd-resolved[28578]: Transaction 61288 for <push.services.mozilla.com IN A> scope dns on wlp2s0/*.
janv. 07 00:46:39 krampoez systemd-resolved[28578]: Using feature level UDP+EDNS0 for transaction 61288.
janv. 07 00:46:39 krampoez systemd-resolved[28578]: Sending query packet with id 61288 of size 54.
janv. 07 00:46:39 krampoez systemd-resolved[28578]: Cache miss for push.services.mozilla.com IN A
janv. 07 00:46:39 krampoez systemd-resolved[28578]: Transaction 61288 for <push.services.mozilla.com IN A> scope dns on wlp2s0/*.
janv. 07 00:46:39 krampoez systemd-resolved[28578]: Using feature level UDP+EDNS0 for transaction 61288.
janv. 07 00:46:39 krampoez systemd-resolved[28578]: Sending query packet with id 61288 of size 54.
janv. 07 00:46:39 krampoez systemd-resolved[28578]: Cache miss for push.services.mozilla.com IN A
janv. 07 00:46:39 krampoez systemd-resolved[28578]: Transaction 61288 for <push.services.mozilla.com IN A> scope dns on wlp2s0/*.
janv. 07 00:46:39 krampoez systemd-resolved[28578]: Using feature level UDP+EDNS0 for transaction 61288.
janv. 07 00:46:39 krampoez systemd-resolved[28578]: Sending query packet with id 61288 of size 54.
janv. 07 00:46:39 krampoez systemd-resolved[28578]: Cache miss for push.services.mozilla.com IN A
janv. 07 00:46:39 krampoez systemd-resolved[28578]: Transaction 61288 for <push.services.mozilla.com IN A> scope dns on wlp2s0/*.
janv. 07 00:46:39 krampoez systemd-resolved[28578]: Using feature level UDP+EDNS0 for transaction 61288.
janv. 07 00:46:39 krampoez systemd-resolved[28578]: Sending query packet with id 61288 of size 54.
janv. 07 00:46:39 krampoez systemd-resolved[28578]: Cache miss for push.services.mozilla.com IN A
janv. 07 00:46:39 krampoez systemd-resolved[28578]: Transaction 61288 for <push.services.mozilla.com IN A> scope dns on wlp2s0/*.
janv. 07 00:46:39 krampoez systemd-resolved[28578]: Using feature level UDP+EDNS0 for transaction 61288.
janv. 07 00:46:39 krampoez systemd-resolved[28578]: Sending query packet with id 61288 of size 54.
janv. 07 00:46:39 krampoez systemd-resolved[28578]: Cache miss for push.services.mozilla.com IN A
janv. 07 00:46:39 krampoez systemd-resolved[28578]: Transaction 61288 for <push.services.mozilla.com IN A> scope dns on wlp2s0/*.
janv. 07 00:46:39 krampoez systemd-resolved[28578]: Using feature level UDP+EDNS0 for transaction 61288.
janv. 07 00:46:39 krampoez systemd-resolved[28578]: Sending query packet with id 61288 of size 54.
janv. 07 00:46:39 krampoez systemd-resolved[28578]: Cache miss for push.services.mozilla.com IN A
janv. 07 00:46:39 krampoez systemd-resolved[28578]: Transaction 61288 for <push.services.mozilla.com IN A> scope dns on wlp2s0/*.
janv. 07 00:46:39 krampoez systemd-resolved[28578]: Using feature level UDP+EDNS0 for transaction 61288.
janv. 07 00:46:39 krampoez systemd-resolved[28578]: Sending query packet with id 61288 of size 54.
janv. 07 00:46:39 krampoez systemd-resolved[28578]: Cache miss for push.services.mozilla.com IN A
janv. 07 00:46:39 krampoez systemd-resolved[28578]: Transaction 61288 for <push.services.mozilla.com IN A> scope dns on wlp2s0/*.
janv. 07 00:46:39 krampoez systemd-resolved[28578]: Using feature level UDP+EDNS0 for transaction 61288.
janv. 07 00:46:39 krampoez systemd-resolved[28578]: Sending query packet with id 61288 of size 54.
janv. 07 00:46:39 krampoez systemd-resolved[28578]: Cache miss for push.services.mozilla.com IN A
janv. 07 00:46:39 krampoez systemd-resolved[28578]: Transaction 61288 for <push.services.mozilla.com IN A> scope dns on wlp2s0/*.
janv. 07 00:46:39 krampoez systemd-resolved[28578]: Using feature level UDP+EDNS0 for transaction 61288.
janv. 07 00:46:39 krampoez systemd-resolved[28578]: Sending query packet with id 61288 of size 54.
janv. 07 00:46:39 krampoez systemd-resolved[28578]: Transaction 61288 for <push.services.mozilla.com IN A> on scope dns on wlp2s0/* now complete with <attempts-max-reached> from none (unsigned).
janv. 07 00:46:39 krampoez systemd-resolved[28578]: Freeing transaction 61288.
janv. 07 00:46:39 krampoez systemd-resolved[28578]: Processing query...
janv. 07 00:46:39 krampoez systemd-resolved[28578]: Got DNS stub UDP query packet for id 56364
janv. 07 00:46:39 krampoez systemd-resolved[28578]: Looking up RR for push.services.mozilla.com IN AAAA.
janv. 07 00:46:39 krampoez systemd-resolved[28578]: Cache miss for push.services.mozilla.com IN AAAA
janv. 07 00:46:39 krampoez systemd-resolved[28578]: Transaction 64849 for <push.services.mozilla.com IN AAAA> scope dns on wlp2s0/*.
janv. 07 00:46:39 krampoez systemd-resolved[28578]: Using feature level UDP+EDNS0 for transaction 64849.
janv. 07 00:46:39 krampoez systemd-resolved[28578]: Using DNS server ::1 for transaction 64849.
janv. 07 00:46:39 krampoez systemd-resolved[28578]: Sending query packet with id 64849 of size 54.
janv. 07 00:46:39 krampoez systemd-resolved[28578]: Cache miss for push.services.mozilla.com IN AAAA
janv. 07 00:46:39 krampoez systemd-resolved[28578]: Transaction 64849 for <push.services.mozilla.com IN AAAA> scope dns on wlp2s0/*.
janv. 07 00:46:39 krampoez systemd-resolved[28578]: Using feature level UDP+EDNS0 for transaction 64849.
janv. 07 00:46:39 krampoez systemd-resolved[28578]: Sending query packet with id 64849 of size 54.
janv. 07 00:46:39 krampoez systemd-resolved[28578]: Cache miss for push.services.mozilla.com IN AAAA
janv. 07 00:46:39 krampoez systemd-resolved[28578]: Transaction 64849 for <push.services.mozilla.com IN AAAA> scope dns on wlp2s0/*.
janv. 07 00:46:39 krampoez systemd-resolved[28578]: Using feature level UDP+EDNS0 for transaction 64849.
janv. 07 00:46:39 krampoez systemd-resolved[28578]: Sending query packet with id 64849 of size 54.
janv. 07 00:46:39 krampoez systemd-resolved[28578]: Cache miss for push.services.mozilla.com IN AAAA
janv. 07 00:46:39 krampoez systemd-resolved[28578]: Transaction 64849 for <push.services.mozilla.com IN AAAA> scope dns on wlp2s0/*.
janv. 07 00:46:39 krampoez systemd-resolved[28578]: Using feature level UDP+EDNS0 for transaction 64849.
janv. 07 00:46:39 krampoez systemd-resolved[28578]: Sending query packet with id 64849 of size 54.
janv. 07 00:46:39 krampoez systemd-resolved[28578]: Cache miss for push.services.mozilla.com IN AAAA
janv. 07 00:46:39 krampoez systemd-resolved[28578]: Transaction 64849 for <push.services.mozilla.com IN AAAA> scope dns on wlp2s0/*.
janv. 07 00:46:39 krampoez systemd-resolved[28578]: Using feature level UDP+EDNS0 for transaction 64849.
janv. 07 00:46:39 krampoez systemd-resolved[28578]: Sending query packet with id 64849 of size 54.
janv. 07 00:46:39 krampoez systemd-resolved[28578]: Cache miss for push.services.mozilla.com IN AAAA
janv. 07 00:46:39 krampoez systemd-resolved[28578]: Transaction 64849 for <push.services.mozilla.com IN AAAA> scope dns on wlp2s0/*.
janv. 07 00:46:39 krampoez systemd-resolved[28578]: Using feature level UDP+EDNS0 for transaction 64849.
janv. 07 00:46:39 krampoez systemd-resolved[28578]: Sending query packet with id 64849 of size 54.
janv. 07 00:46:39 krampoez systemd-resolved[28578]: Cache miss for push.services.mozilla.com IN AAAA
janv. 07 00:46:39 krampoez systemd-resolved[28578]: Transaction 64849 for <push.services.mozilla.com IN AAAA> scope dns on wlp2s0/*.
janv. 07 00:46:39 krampoez systemd-resolved[28578]: Using feature level UDP+EDNS0 for transaction 64849.
janv. 07 00:46:39 krampoez systemd-resolved[28578]: Sending query packet with id 64849 of size 54.
janv. 07 00:46:39 krampoez systemd-resolved[28578]: Cache miss for push.services.mozilla.com IN AAAA
janv. 07 00:46:39 krampoez systemd-resolved[28578]: Transaction 64849 for <push.services.mozilla.com IN AAAA> scope dns on wlp2s0/*.
janv. 07 00:46:39 krampoez systemd-resolved[28578]: Using feature level UDP+EDNS0 for transaction 64849.
janv. 07 00:46:39 krampoez systemd-resolved[28578]: Sending query packet with id 64849 of size 54.
janv. 07 00:46:39 krampoez systemd-resolved[28578]: Cache miss for push.services.mozilla.com IN AAAA
janv. 07 00:46:39 krampoez systemd-resolved[28578]: Transaction 64849 for <push.services.mozilla.com IN AAAA> scope dns on wlp2s0/*.
janv. 07 00:46:39 krampoez systemd-resolved[28578]: Using feature level UDP+EDNS0 for transaction 64849.
janv. 07 00:46:39 krampoez systemd-resolved[28578]: Sending query packet with id 64849 of size 54.
janv. 07 00:46:39 krampoez systemd-resolved[28578]: Cache miss for push.services.mozilla.com IN AAAA
janv. 07 00:46:39 krampoez systemd-resolved[28578]: Transaction 64849 for <push.services.mozilla.com IN AAAA> scope dns on wlp2s0/*.
janv. 07 00:46:39 krampoez systemd-resolved[28578]: Using feature level UDP+EDNS0 for transaction 64849.
janv. 07 00:46:39 krampoez systemd-resolved[28578]: Sending query packet with id 64849 of size 54.
janv. 07 00:46:39 krampoez systemd-resolved[28578]: Cache miss for push.services.mozilla.com IN AAAA
janv. 07 00:46:39 krampoez systemd-resolved[28578]: Transaction 64849 for <push.services.mozilla.com IN AAAA> scope dns on wlp2s0/*.
janv. 07 00:46:39 krampoez systemd-resolved[28578]: Using feature level UDP+EDNS0 for transaction 64849.
janv. 07 00:46:39 krampoez systemd-resolved[28578]: Sending query packet with id 64849 of size 54.
janv. 07 00:46:39 krampoez systemd-resolved[28578]: Cache miss for push.services.mozilla.com IN AAAA
janv. 07 00:46:39 krampoez systemd-resolved[28578]: Transaction 64849 for <push.services.mozilla.com IN AAAA> scope dns on wlp2s0/*.
janv. 07 00:46:39 krampoez systemd-resolved[28578]: Using feature level UDP+EDNS0 for transaction 64849.
janv. 07 00:46:39 krampoez systemd-resolved[28578]: Sending query packet with id 64849 of size 54.
janv. 07 00:46:39 krampoez systemd-resolved[28578]: Cache miss for push.services.mozilla.com IN AAAA
janv. 07 00:46:39 krampoez systemd-resolved[28578]: Transaction 64849 for <push.services.mozilla.com IN AAAA> scope dns on wlp2s0/*.
janv. 07 00:46:39 krampoez systemd-resolved[28578]: Using feature level UDP+EDNS0 for transaction 64849.
janv. 07 00:46:39 krampoez systemd-resolved[28578]: Sending query packet with id 64849 of size 54.
janv. 07 00:46:39 krampoez systemd-resolved[28578]: Cache miss for push.services.mozilla.com IN AAAA
janv. 07 00:46:39 krampoez systemd-resolved[28578]: Transaction 64849 for <push.services.mozilla.com IN AAAA> scope dns on wlp2s0/*.
janv. 07 00:46:39 krampoez systemd-resolved[28578]: Using feature level UDP+EDNS0 for transaction 64849.
janv. 07 00:46:39 krampoez systemd-resolved[28578]: Sending query packet with id 64849 of size 54.
janv. 07 00:46:39 krampoez systemd-resolved[28578]: Cache miss for push.services.mozilla.com IN AAAA
janv. 07 00:46:39 krampoez systemd-resolved[28578]: Transaction 64849 for <push.services.mozilla.com IN AAAA> scope dns on wlp2s0/*.
janv. 07 00:46:39 krampoez systemd-resolved[28578]: Using feature level UDP+EDNS0 for transaction 64849.
janv. 07 00:46:39 krampoez systemd-resolved[28578]: Sending query packet with id 64849 of size 54.
janv. 07 00:46:39 krampoez systemd-resolved[28578]: Cache miss for push.services.mozilla.com IN AAAA
janv. 07 00:46:39 krampoez systemd-resolved[28578]: Transaction 64849 for <push.services.mozilla.com IN AAAA> scope dns on wlp2s0/*.
janv. 07 00:46:39 krampoez systemd-resolved[28578]: Using feature level UDP+EDNS0 for transaction 64849.
janv. 07 00:46:39 krampoez systemd-resolved[28578]: Sending query packet with id 64849 of size 54.
janv. 07 00:46:39 krampoez systemd-resolved[28578]: Cache miss for push.services.mozilla.com IN AAAA
janv. 07 00:46:39 krampoez systemd-resolved[28578]: Transaction 64849 for <push.services.mozilla.com IN AAAA> scope dns on wlp2s0/*.
janv. 07 00:46:39 krampoez systemd-resolved[28578]: Using feature level UDP+EDNS0 for transaction 64849.
janv. 07 00:46:39 krampoez systemd-resolved[28578]: Sending query packet with id 64849 of size 54.
janv. 07 00:46:39 krampoez systemd-resolved[28578]: Cache miss for push.services.mozilla.com IN AAAA
janv. 07 00:46:39 krampoez systemd-resolved[28578]: Transaction 64849 for <push.services.mozilla.com IN AAAA> scope dns on wlp2s0/*.
janv. 07 00:46:39 krampoez systemd-resolved[28578]: Using feature level UDP+EDNS0 for transaction 64849.
janv. 07 00:46:39 krampoez systemd-resolved[28578]: Sending query packet with id 64849 of size 54.
janv. 07 00:46:39 krampoez systemd-resolved[28578]: Cache miss for push.services.mozilla.com IN AAAA
janv. 07 00:46:39 krampoez systemd-resolved[28578]: Transaction 64849 for <push.services.mozilla.com IN AAAA> scope dns on wlp2s0/*.
janv. 07 00:46:39 krampoez systemd-resolved[28578]: Using feature level UDP+EDNS0 for transaction 64849.
janv. 07 00:46:39 krampoez systemd-resolved[28578]: Sending query packet with id 64849 of size 54.
janv. 07 00:46:39 krampoez systemd-resolved[28578]: Cache miss for push.services.mozilla.com IN AAAA
janv. 07 00:46:39 krampoez systemd-resolved[28578]: Transaction 64849 for <push.services.mozilla.com IN AAAA> scope dns on wlp2s0/*.
janv. 07 00:46:39 krampoez systemd-resolved[28578]: Using feature level UDP+EDNS0 for transaction 64849.
janv. 07 00:46:39 krampoez systemd-resolved[28578]: Sending query packet with id 64849 of size 54.
janv. 07 00:46:39 krampoez systemd-resolved[28578]: Cache miss for push.services.mozilla.com IN AAAA
janv. 07 00:46:39 krampoez systemd-resolved[28578]: Transaction 64849 for <push.services.mozilla.com IN AAAA> scope dns on wlp2s0/*.
janv. 07 00:46:39 krampoez systemd-resolved[28578]: Using feature level UDP+EDNS0 for transaction 64849.
janv. 07 00:46:39 krampoez systemd-resolved[28578]: Sending query packet with id 64849 of size 54.
janv. 07 00:46:39 krampoez systemd-resolved[28578]: Cache miss for push.services.mozilla.com IN AAAA
janv. 07 00:46:39 krampoez systemd-resolved[28578]: Transaction 64849 for <push.services.mozilla.com IN AAAA> scope dns on wlp2s0/*.
janv. 07 00:46:39 krampoez systemd-resolved[28578]: Using feature level UDP+EDNS0 for transaction 64849.
janv. 07 00:46:39 krampoez systemd-resolved[28578]: Sending query packet with id 64849 of size 54.
janv. 07 00:46:39 krampoez systemd-resolved[28578]: Cache miss for push.services.mozilla.com IN AAAA
janv. 07 00:46:39 krampoez systemd-resolved[28578]: Transaction 64849 for <push.services.mozilla.com IN AAAA> scope dns on wlp2s0/*.
janv. 07 00:46:39 krampoez systemd-resolved[28578]: Using feature level UDP+EDNS0 for transaction 64849.
janv. 07 00:46:39 krampoez systemd-resolved[28578]: Sending query packet with id 64849 of size 54.
janv. 07 00:46:39 krampoez systemd-resolved[28578]: Cache miss for push.services.mozilla.com IN AAAA
janv. 07 00:46:39 krampoez systemd-resolved[28578]: Transaction 64849 for <push.services.mozilla.com IN AAAA> scope dns on wlp2s0/*.
janv. 07 00:46:39 krampoez systemd-resolved[28578]: Using feature level UDP+EDNS0 for transaction 64849.
janv. 07 00:46:39 krampoez systemd-resolved[28578]: Sending query packet with id 64849 of size 54.
janv. 07 00:46:39 krampoez systemd-resolved[28578]: Transaction 64849 for <push.services.mozilla.com IN AAAA> on scope dns on wlp2s0/* now complete with <attempts-max-reached> from none (unsigned).
janv. 07 00:46:39 krampoez systemd-resolved[28578]: Freeing transaction 64849.
janv. 07 00:46:39 krampoez systemd-resolved[28578]: Processing query...
janv. 07 00:46:40 krampoez systemd-resolved[28578]: Got DNS stub UDP query packet for id 59644
janv. 07 00:46:40 krampoez systemd-resolved[28578]: Looking up RR for irc-ws.chat.twitch.tv IN A.
janv. 07 00:46:40 krampoez systemd-resolved[28578]: Cache miss for irc-ws.chat.twitch.tv IN A
janv. 07 00:46:40 krampoez systemd-resolved[28578]: Transaction 64589 for <irc-ws.chat.twitch.tv IN A> scope dns on wlp2s0/*.
janv. 07 00:46:40 krampoez systemd-resolved[28578]: Using feature level UDP+EDNS0 for transaction 64589.
janv. 07 00:46:40 krampoez systemd-resolved[28578]: Using DNS server ::1 for transaction 64589.
janv. 07 00:46:40 krampoez systemd-resolved[28578]: Sending query packet with id 64589 of size 50.
janv. 07 00:46:40 krampoez systemd-resolved[28578]: Cache miss for irc-ws.chat.twitch.tv IN A
janv. 07 00:46:40 krampoez systemd-resolved[28578]: Transaction 64589 for <irc-ws.chat.twitch.tv IN A> scope dns on wlp2s0/*.
janv. 07 00:46:40 krampoez systemd-resolved[28578]: Using feature level UDP+EDNS0 for transaction 64589.
janv. 07 00:46:40 krampoez systemd-resolved[28578]: Sending query packet with id 64589 of size 50.
janv. 07 00:46:40 krampoez systemd-resolved[28578]: Cache miss for irc-ws.chat.twitch.tv IN A
janv. 07 00:46:40 krampoez systemd-resolved[28578]: Transaction 64589 for <irc-ws.chat.twitch.tv IN A> scope dns on wlp2s0/*.
janv. 07 00:46:40 krampoez systemd-resolved[28578]: Using feature level UDP+EDNS0 for transaction 64589.
janv. 07 00:46:40 krampoez systemd-resolved[28578]: Sending query packet with id 64589 of size 50.
janv. 07 00:46:40 krampoez systemd-resolved[28578]: Cache miss for irc-ws.chat.twitch.tv IN A
janv. 07 00:46:40 krampoez systemd-resolved[28578]: Transaction 64589 for <irc-ws.chat.twitch.tv IN A> scope dns on wlp2s0/*.
janv. 07 00:46:40 krampoez systemd-resolved[28578]: Using feature level UDP+EDNS0 for transaction 64589.
janv. 07 00:46:40 krampoez systemd-resolved[28578]: Sending query packet with id 64589 of size 50.
janv. 07 00:46:40 krampoez systemd-resolved[28578]: Cache miss for irc-ws.chat.twitch.tv IN A
janv. 07 00:46:40 krampoez systemd-resolved[28578]: Transaction 64589 for <irc-ws.chat.twitch.tv IN A> scope dns on wlp2s0/*.
janv. 07 00:46:40 krampoez systemd-resolved[28578]: Using feature level UDP+EDNS0 for transaction 64589.
janv. 07 00:46:40 krampoez systemd-resolved[28578]: Sending query packet with id 64589 of size 50.
janv. 07 00:46:40 krampoez systemd-resolved[28578]: Cache miss for irc-ws.chat.twitch.tv IN A
janv. 07 00:46:40 krampoez systemd-resolved[28578]: Transaction 64589 for <irc-ws.chat.twitch.tv IN A> scope dns on wlp2s0/*.
janv. 07 00:46:40 krampoez systemd-resolved[28578]: Using feature level UDP+EDNS0 for transaction 64589.
janv. 07 00:46:40 krampoez systemd-resolved[28578]: Sending query packet with id 64589 of size 50.
janv. 07 00:46:40 krampoez systemd-resolved[28578]: Cache miss for irc-ws.chat.twitch.tv IN A
janv. 07 00:46:40 krampoez systemd-resolved[28578]: Transaction 64589 for <irc-ws.chat.twitch.tv IN A> scope dns on wlp2s0/*.
janv. 07 00:46:40 krampoez systemd-resolved[28578]: Using feature level UDP+EDNS0 for transaction 64589.
janv. 07 00:46:40 krampoez systemd-resolved[28578]: Sending query packet with id 64589 of size 50.
janv. 07 00:46:40 krampoez systemd-resolved[28578]: Cache miss for irc-ws.chat.twitch.tv IN A
janv. 07 00:46:40 krampoez systemd-resolved[28578]: Transaction 64589 for <irc-ws.chat.twitch.tv IN A> scope dns on wlp2s0/*.
janv. 07 00:46:40 krampoez systemd-resolved[28578]: Using feature level UDP+EDNS0 for transaction 64589.
janv. 07 00:46:40 krampoez systemd-resolved[28578]: Sending query packet with id 64589 of size 50.
janv. 07 00:46:40 krampoez systemd-resolved[28578]: Cache miss for irc-ws.chat.twitch.tv IN A
janv. 07 00:46:40 krampoez systemd-resolved[28578]: Transaction 64589 for <irc-ws.chat.twitch.tv IN A> scope dns on wlp2s0/*.
janv. 07 00:46:40 krampoez systemd-resolved[28578]: Using feature level UDP+EDNS0 for transaction 64589.
janv. 07 00:46:40 krampoez systemd-resolved[28578]: Sending query packet with id 64589 of size 50.
janv. 07 00:46:40 krampoez systemd-resolved[28578]: Cache miss for irc-ws.chat.twitch.tv IN A
janv. 07 00:46:40 krampoez systemd-resolved[28578]: Transaction 64589 for <irc-ws.chat.twitch.tv IN A> scope dns on wlp2s0/*.
janv. 07 00:46:40 krampoez systemd-resolved[28578]: Using feature level UDP+EDNS0 for transaction 64589.
janv. 07 00:46:40 krampoez systemd-resolved[28578]: Sending query packet with id 64589 of size 50.
janv. 07 00:46:40 krampoez systemd-resolved[28578]: Cache miss for irc-ws.chat.twitch.tv IN A
janv. 07 00:46:40 krampoez systemd-resolved[28578]: Transaction 64589 for <irc-ws.chat.twitch.tv IN A> scope dns on wlp2s0/*.
janv. 07 00:46:40 krampoez systemd-resolved[28578]: Using feature level UDP+EDNS0 for transaction 64589.
janv. 07 00:46:40 krampoez systemd-resolved[28578]: Sending query packet with id 64589 of size 50.
janv. 07 00:46:40 krampoez systemd-resolved[28578]: Cache miss for irc-ws.chat.twitch.tv IN A
janv. 07 00:46:40 krampoez systemd-resolved[28578]: Transaction 64589 for <irc-ws.chat.twitch.tv IN A> scope dns on wlp2s0/*.
janv. 07 00:46:40 krampoez systemd-resolved[28578]: Using feature level UDP+EDNS0 for transaction 64589.
janv. 07 00:46:40 krampoez systemd-resolved[28578]: Sending query packet with id 64589 of size 50.
janv. 07 00:46:40 krampoez systemd-resolved[28578]: Cache miss for irc-ws.chat.twitch.tv IN A
janv. 07 00:46:40 krampoez systemd-resolved[28578]: Transaction 64589 for <irc-ws.chat.twitch.tv IN A> scope dns on wlp2s0/*.
janv. 07 00:46:40 krampoez systemd-resolved[28578]: Using feature level UDP+EDNS0 for transaction 64589.
janv. 07 00:46:40 krampoez systemd-resolved[28578]: Sending query packet with id 64589 of size 50.
janv. 07 00:46:40 krampoez systemd-resolved[28578]: Cache miss for irc-ws.chat.twitch.tv IN A
janv. 07 00:46:40 krampoez systemd-resolved[28578]: Transaction 64589 for <irc-ws.chat.twitch.tv IN A> scope dns on wlp2s0/*.
janv. 07 00:46:40 krampoez systemd-resolved[28578]: Using feature level UDP+EDNS0 for transaction 64589.
janv. 07 00:46:40 krampoez systemd-resolved[28578]: Sending query packet with id 64589 of size 50.
janv. 07 00:46:40 krampoez systemd-resolved[28578]: Cache miss for irc-ws.chat.twitch.tv IN A
janv. 07 00:46:40 krampoez systemd-resolved[28578]: Transaction 64589 for <irc-ws.chat.twitch.tv IN A> scope dns on wlp2s0/*.
janv. 07 00:46:40 krampoez systemd-resolved[28578]: Using feature level UDP+EDNS0 for transaction 64589.
janv. 07 00:46:40 krampoez systemd-resolved[28578]: Sending query packet with id 64589 of size 50.
janv. 07 00:46:40 krampoez systemd-resolved[28578]: Cache miss for irc-ws.chat.twitch.tv IN A
janv. 07 00:46:40 krampoez systemd-resolved[28578]: Transaction 64589 for <irc-ws.chat.twitch.tv IN A> scope dns on wlp2s0/*.
janv. 07 00:46:40 krampoez systemd-resolved[28578]: Using feature level UDP+EDNS0 for transaction 64589.
janv. 07 00:46:40 krampoez systemd-resolved[28578]: Sending query packet with id 64589 of size 50.
janv. 07 00:46:40 krampoez systemd-resolved[28578]: Cache miss for irc-ws.chat.twitch.tv IN A
janv. 07 00:46:40 krampoez systemd-resolved[28578]: Transaction 64589 for <irc-ws.chat.twitch.tv IN A> scope dns on wlp2s0/*.
janv. 07 00:46:40 krampoez systemd-resolved[28578]: Using feature level UDP+EDNS0 for transaction 64589.
janv. 07 00:46:40 krampoez systemd-resolved[28578]: Sending query packet with id 64589 of size 50.
janv. 07 00:46:40 krampoez systemd-resolved[28578]: Cache miss for irc-ws.chat.twitch.tv IN A
janv. 07 00:46:40 krampoez systemd-resolved[28578]: Transaction 64589 for <irc-ws.chat.twitch.tv IN A> scope dns on wlp2s0/*.
janv. 07 00:46:40 krampoez systemd-resolved[28578]: Using feature level UDP+EDNS0 for transaction 64589.
janv. 07 00:46:40 krampoez systemd-resolved[28578]: Sending query packet with id 64589 of size 50.
janv. 07 00:46:40 krampoez systemd-resolved[28578]: Cache miss for irc-ws.chat.twitch.tv IN A
janv. 07 00:46:40 krampoez systemd-resolved[28578]: Transaction 64589 for <irc-ws.chat.twitch.tv IN A> scope dns on wlp2s0/*.
janv. 07 00:46:40 krampoez systemd-resolved[28578]: Using feature level UDP+EDNS0 for transaction 64589.
janv. 07 00:46:40 krampoez systemd-resolved[28578]: Sending query packet with id 64589 of size 50.
janv. 07 00:46:40 krampoez systemd-resolved[28578]: Cache miss for irc-ws.chat.twitch.tv IN A
janv. 07 00:46:40 krampoez systemd-resolved[28578]: Transaction 64589 for <irc-ws.chat.twitch.tv IN A> scope dns on wlp2s0/*.
janv. 07 00:46:40 krampoez systemd-resolved[28578]: Using feature level UDP+EDNS0 for transaction 64589.
janv. 07 00:46:40 krampoez systemd-resolved[28578]: Sending query packet with id 64589 of size 50.
janv. 07 00:46:40 krampoez systemd-resolved[28578]: Cache miss for irc-ws.chat.twitch.tv IN A
janv. 07 00:46:40 krampoez systemd-resolved[28578]: Transaction 64589 for <irc-ws.chat.twitch.tv IN A> scope dns on wlp2s0/*.
janv. 07 00:46:40 krampoez systemd-resolved[28578]: Using feature level UDP+EDNS0 for transaction 64589.
janv. 07 00:46:40 krampoez systemd-resolved[28578]: Sending query packet with id 64589 of size 50.
janv. 07 00:46:40 krampoez systemd-resolved[28578]: Cache miss for irc-ws.chat.twitch.tv IN A
janv. 07 00:46:40 krampoez systemd-resolved[28578]: Transaction 64589 for <irc-ws.chat.twitch.tv IN A> scope dns on wlp2s0/*.
janv. 07 00:46:40 krampoez systemd-resolved[28578]: Using feature level UDP+EDNS0 for transaction 64589.
janv. 07 00:46:40 krampoez systemd-resolved[28578]: Sending query packet with id 64589 of size 50.
janv. 07 00:46:40 krampoez systemd-resolved[28578]: Cache miss for irc-ws.chat.twitch.tv IN A
janv. 07 00:46:40 krampoez systemd-resolved[28578]: Transaction 64589 for <irc-ws.chat.twitch.tv IN A> scope dns on wlp2s0/*.
janv. 07 00:46:40 krampoez systemd-resolved[28578]: Using feature level UDP+EDNS0 for transaction 64589.
janv. 07 00:46:40 krampoez systemd-resolved[28578]: Sending query packet with id 64589 of size 50.
janv. 07 00:46:40 krampoez systemd-resolved[28578]: Cache miss for irc-ws.chat.twitch.tv IN A
janv. 07 00:46:40 krampoez systemd-resolved[28578]: Transaction 64589 for <irc-ws.chat.twitch.tv IN A> scope dns on wlp2s0/*.
janv. 07 00:46:40 krampoez systemd-resolved[28578]: Using feature level UDP+EDNS0 for transaction 64589.
janv. 07 00:46:40 krampoez systemd-resolved[28578]: Sending query packet with id 64589 of size 50.
janv. 07 00:46:40 krampoez systemd-resolved[28578]: Transaction 64589 for <irc-ws.chat.twitch.tv IN A> on scope dns on wlp2s0/* now complete with <attempts-max-reached> from none (unsigned).
janv. 07 00:46:40 krampoez systemd-resolved[28578]: Freeing transaction 64589.
janv. 07 00:46:40 krampoez systemd-resolved[28578]: Processing query...
janv. 07 00:46:40 krampoez systemd-resolved[28578]: Got DNS stub UDP query packet for id 61576
janv. 07 00:46:40 krampoez systemd-resolved[28578]: Looking up RR for irc-ws.chat.twitch.tv IN AAAA.
janv. 07 00:46:40 krampoez systemd-resolved[28578]: Cache miss for irc-ws.chat.twitch.tv IN AAAA
janv. 07 00:46:40 krampoez systemd-resolved[28578]: Transaction 16478 for <irc-ws.chat.twitch.tv IN AAAA> scope dns on wlp2s0/*.
janv. 07 00:46:40 krampoez systemd-resolved[28578]: Using feature level UDP+EDNS0 for transaction 16478.
janv. 07 00:46:40 krampoez systemd-resolved[28578]: Using DNS server ::1 for transaction 16478.
janv. 07 00:46:40 krampoez systemd-resolved[28578]: Sending query packet with id 16478 of size 50.
janv. 07 00:46:40 krampoez systemd-resolved[28578]: Cache miss for irc-ws.chat.twitch.tv IN AAAA
janv. 07 00:46:40 krampoez systemd-resolved[28578]: Transaction 16478 for <irc-ws.chat.twitch.tv IN AAAA> scope dns on wlp2s0/*.
janv. 07 00:46:40 krampoez systemd-resolved[28578]: Using feature level UDP+EDNS0 for transaction 16478.
janv. 07 00:46:40 krampoez systemd-resolved[28578]: Sending query packet with id 16478 of size 50.
janv. 07 00:46:40 krampoez systemd-resolved[28578]: Cache miss for irc-ws.chat.twitch.tv IN AAAA
janv. 07 00:46:40 krampoez systemd-resolved[28578]: Transaction 16478 for <irc-ws.chat.twitch.tv IN AAAA> scope dns on wlp2s0/*.
janv. 07 00:46:40 krampoez systemd-resolved[28578]: Using feature level UDP+EDNS0 for transaction 16478.
janv. 07 00:46:40 krampoez systemd-resolved[28578]: Sending query packet with id 16478 of size 50.
janv. 07 00:46:40 krampoez systemd-resolved[28578]: Cache miss for irc-ws.chat.twitch.tv IN AAAA
janv. 07 00:46:40 krampoez systemd-resolved[28578]: Transaction 16478 for <irc-ws.chat.twitch.tv IN AAAA> scope dns on wlp2s0/*.
janv. 07 00:46:40 krampoez systemd-resolved[28578]: Using feature level UDP+EDNS0 for transaction 16478.
janv. 07 00:46:40 krampoez systemd-resolved[28578]: Sending query packet with id 16478 of size 50.
janv. 07 00:46:40 krampoez systemd-resolved[28578]: Cache miss for irc-ws.chat.twitch.tv IN AAAA
janv. 07 00:46:40 krampoez systemd-resolved[28578]: Transaction 16478 for <irc-ws.chat.twitch.tv IN AAAA> scope dns on wlp2s0/*.
janv. 07 00:46:40 krampoez systemd-resolved[28578]: Using feature level UDP+EDNS0 for transaction 16478.
janv. 07 00:46:40 krampoez systemd-resolved[28578]: Sending query packet with id 16478 of size 50.
janv. 07 00:46:40 krampoez systemd-resolved[28578]: Cache miss for irc-ws.chat.twitch.tv IN AAAA
janv. 07 00:46:40 krampoez systemd-resolved[28578]: Transaction 16478 for <irc-ws.chat.twitch.tv IN AAAA> scope dns on wlp2s0/*.
janv. 07 00:46:40 krampoez systemd-resolved[28578]: Using feature level UDP+EDNS0 for transaction 16478.
janv. 07 00:46:40 krampoez systemd-resolved[28578]: Sending query packet with id 16478 of size 50.
janv. 07 00:46:40 krampoez systemd-resolved[28578]: Cache miss for irc-ws.chat.twitch.tv IN AAAA
janv. 07 00:46:40 krampoez systemd-resolved[28578]: Transaction 16478 for <irc-ws.chat.twitch.tv IN AAAA> scope dns on wlp2s0/*.
janv. 07 00:46:40 krampoez systemd-resolved[28578]: Using feature level UDP+EDNS0 for transaction 16478.
janv. 07 00:46:40 krampoez systemd-resolved[28578]: Sending query packet with id 16478 of size 50.
janv. 07 00:46:40 krampoez systemd-resolved[28578]: Cache miss for irc-ws.chat.twitch.tv IN AAAA
janv. 07 00:46:40 krampoez systemd-resolved[28578]: Transaction 16478 for <irc-ws.chat.twitch.tv IN AAAA> scope dns on wlp2s0/*.
janv. 07 00:46:40 krampoez systemd-resolved[28578]: Using feature level UDP+EDNS0 for transaction 16478.
janv. 07 00:46:40 krampoez systemd-resolved[28578]: Sending query packet with id 16478 of size 50.
janv. 07 00:46:40 krampoez systemd-resolved[28578]: Cache miss for irc-ws.chat.twitch.tv IN AAAA
janv. 07 00:46:40 krampoez systemd-resolved[28578]: Transaction 16478 for <irc-ws.chat.twitch.tv IN AAAA> scope dns on wlp2s0/*.
janv. 07 00:46:40 krampoez systemd-resolved[28578]: Using feature level UDP+EDNS0 for transaction 16478.
janv. 07 00:46:40 krampoez systemd-resolved[28578]: Sending query packet with id 16478 of size 50.
janv. 07 00:46:40 krampoez systemd-resolved[28578]: Cache miss for irc-ws.chat.twitch.tv IN AAAA
janv. 07 00:46:40 krampoez systemd-resolved[28578]: Transaction 16478 for <irc-ws.chat.twitch.tv IN AAAA> scope dns on wlp2s0/*.
janv. 07 00:46:40 krampoez systemd-resolved[28578]: Using feature level UDP+EDNS0 for transaction 16478.
janv. 07 00:46:40 krampoez systemd-resolved[28578]: Sending query packet with id 16478 of size 50.
janv. 07 00:46:40 krampoez systemd-resolved[28578]: Cache miss for irc-ws.chat.twitch.tv IN AAAA
janv. 07 00:46:40 krampoez systemd-resolved[28578]: Transaction 16478 for <irc-ws.chat.twitch.tv IN AAAA> scope dns on wlp2s0/*.
janv. 07 00:46:40 krampoez systemd-resolved[28578]: Using feature level UDP+EDNS0 for transaction 16478.
janv. 07 00:46:40 krampoez systemd-resolved[28578]: Sending query packet with id 16478 of size 50.
janv. 07 00:46:40 krampoez systemd-resolved[28578]: Cache miss for irc-ws.chat.twitch.tv IN AAAA
janv. 07 00:46:40 krampoez systemd-resolved[28578]: Transaction 16478 for <irc-ws.chat.twitch.tv IN AAAA> scope dns on wlp2s0/*.
janv. 07 00:46:40 krampoez systemd-resolved[28578]: Using feature level UDP+EDNS0 for transaction 16478.
janv. 07 00:46:40 krampoez systemd-resolved[28578]: Sending query packet with id 16478 of size 50.
janv. 07 00:46:40 krampoez systemd-resolved[28578]: Cache miss for irc-ws.chat.twitch.tv IN AAAA
janv. 07 00:46:40 krampoez systemd-resolved[28578]: Transaction 16478 for <irc-ws.chat.twitch.tv IN AAAA> scope dns on wlp2s0/*.
janv. 07 00:46:40 krampoez systemd-resolved[28578]: Using feature level UDP+EDNS0 for transaction 16478.
janv. 07 00:46:40 krampoez systemd-resolved[28578]: Sending query packet with id 16478 of size 50.
janv. 07 00:46:40 krampoez systemd-resolved[28578]: Cache miss for irc-ws.chat.twitch.tv IN AAAA
janv. 07 00:46:40 krampoez systemd-resolved[28578]: Transaction 16478 for <irc-ws.chat.twitch.tv IN AAAA> scope dns on wlp2s0/*.
janv. 07 00:46:40 krampoez systemd-resolved[28578]: Using feature level UDP+EDNS0 for transaction 16478.
janv. 07 00:46:40 krampoez systemd-resolved[28578]: Sending query packet with id 16478 of size 50.
janv. 07 00:46:40 krampoez systemd-resolved[28578]: Cache miss for irc-ws.chat.twitch.tv IN AAAA
janv. 07 00:46:40 krampoez systemd-resolved[28578]: Transaction 16478 for <irc-ws.chat.twitch.tv IN AAAA> scope dns on wlp2s0/*.
janv. 07 00:46:40 krampoez systemd-resolved[28578]: Using feature level UDP+EDNS0 for transaction 16478.
janv. 07 00:46:40 krampoez systemd-resolved[28578]: Sending query packet with id 16478 of size 50.
janv. 07 00:46:40 krampoez systemd-resolved[28578]: Cache miss for irc-ws.chat.twitch.tv IN AAAA
janv. 07 00:46:40 krampoez systemd-resolved[28578]: Transaction 16478 for <irc-ws.chat.twitch.tv IN AAAA> scope dns on wlp2s0/*.
janv. 07 00:46:40 krampoez systemd-resolved[28578]: Using feature level UDP+EDNS0 for transaction 16478.
janv. 07 00:46:40 krampoez systemd-resolved[28578]: Sending query packet with id 16478 of size 50.
janv. 07 00:46:40 krampoez systemd-resolved[28578]: Cache miss for irc-ws.chat.twitch.tv IN AAAA
janv. 07 00:46:40 krampoez systemd-resolved[28578]: Transaction 16478 for <irc-ws.chat.twitch.tv IN AAAA> scope dns on wlp2s0/*.
janv. 07 00:46:40 krampoez systemd-resolved[28578]: Using feature level UDP+EDNS0 for transaction 16478.
janv. 07 00:46:40 krampoez systemd-resolved[28578]: Sending query packet with id 16478 of size 50.
janv. 07 00:46:40 krampoez systemd-resolved[28578]: Cache miss for irc-ws.chat.twitch.tv IN AAAA
janv. 07 00:46:40 krampoez systemd-resolved[28578]: Transaction 16478 for <irc-ws.chat.twitch.tv IN AAAA> scope dns on wlp2s0/*.
janv. 07 00:46:40 krampoez systemd-resolved[28578]: Using feature level UDP+EDNS0 for transaction 16478.
janv. 07 00:46:40 krampoez systemd-resolved[28578]: Sending query packet with id 16478 of size 50.
janv. 07 00:46:40 krampoez systemd-resolved[28578]: Cache miss for irc-ws.chat.twitch.tv IN AAAA
janv. 07 00:46:40 krampoez systemd-resolved[28578]: Transaction 16478 for <irc-ws.chat.twitch.tv IN AAAA> scope dns on wlp2s0/*.
janv. 07 00:46:40 krampoez systemd-resolved[28578]: Using feature level UDP+EDNS0 for transaction 16478.
janv. 07 00:46:40 krampoez systemd-resolved[28578]: Sending query packet with id 16478 of size 50.
janv. 07 00:46:40 krampoez systemd-resolved[28578]: Cache miss for irc-ws.chat.twitch.tv IN AAAA
janv. 07 00:46:40 krampoez systemd-resolved[28578]: Transaction 16478 for <irc-ws.chat.twitch.tv IN AAAA> scope dns on wlp2s0/*.
janv. 07 00:46:40 krampoez systemd-resolved[28578]: Using feature level UDP+EDNS0 for transaction 16478.
janv. 07 00:46:40 krampoez systemd-resolved[28578]: Sending query packet with id 16478 of size 50.
janv. 07 00:46:40 krampoez systemd-resolved[28578]: Cache miss for irc-ws.chat.twitch.tv IN AAAA
janv. 07 00:46:40 krampoez systemd-resolved[28578]: Transaction 16478 for <irc-ws.chat.twitch.tv IN AAAA> scope dns on wlp2s0/*.
janv. 07 00:46:40 krampoez systemd-resolved[28578]: Using feature level UDP+EDNS0 for transaction 16478.
janv. 07 00:46:40 krampoez systemd-resolved[28578]: Sending query packet with id 16478 of size 50.
janv. 07 00:46:40 krampoez systemd-resolved[28578]: Cache miss for irc-ws.chat.twitch.tv IN AAAA
janv. 07 00:46:40 krampoez systemd-resolved[28578]: Transaction 16478 for <irc-ws.chat.twitch.tv IN AAAA> scope dns on wlp2s0/*.
janv. 07 00:46:40 krampoez systemd-resolved[28578]: Using feature level UDP+EDNS0 for transaction 16478.
janv. 07 00:46:40 krampoez systemd-resolved[28578]: Sending query packet with id 16478 of size 50.
janv. 07 00:46:40 krampoez systemd-resolved[28578]: Cache miss for irc-ws.chat.twitch.tv IN AAAA
janv. 07 00:46:40 krampoez systemd-resolved[28578]: Transaction 16478 for <irc-ws.chat.twitch.tv IN AAAA> scope dns on wlp2s0/*.
janv. 07 00:46:40 krampoez systemd-resolved[28578]: Using feature level UDP+EDNS0 for transaction 16478.
janv. 07 00:46:40 krampoez systemd-resolved[28578]: Sending query packet with id 16478 of size 50.
janv. 07 00:46:40 krampoez systemd-resolved[28578]: Cache miss for irc-ws.chat.twitch.tv IN AAAA
janv. 07 00:46:40 krampoez systemd-resolved[28578]: Transaction 16478 for <irc-ws.chat.twitch.tv IN AAAA> scope dns on wlp2s0/*.
janv. 07 00:46:40 krampoez systemd-resolved[28578]: Using feature level UDP+EDNS0 for transaction 16478.
janv. 07 00:46:40 krampoez systemd-resolved[28578]: Sending query packet with id 16478 of size 50.
janv. 07 00:46:40 krampoez systemd-resolved[28578]: Transaction 16478 for <irc-ws.chat.twitch.tv IN AAAA> on scope dns on wlp2s0/* now complete with <attempts-max-reached> from none (unsigned).
janv. 07 00:46:40 krampoez systemd-resolved[28578]: Freeing transaction 16478.
janv. 07 00:46:40 krampoez systemd-resolved[28578]: Processing query...
```

And the log goes on and on with same result for all dns queries.

**Comment by Anvil** [comment]
Also, out of curiosity, I've ran a `tcpdump -n -i any port 53` and the only thing that appears are packets going to 127.0.0.53 (resolved internal address).

i.e: 
```
18:33:00.777259 IP 127.0.0.1.49033 > 127.0.0.53.domain: 14668+ [1au] A? detectportal.firefox.com. (53)
18:33:00.799027 IP 127.0.0.1.48889 > 127.0.0.53.domain: 46470+ [1au] A? detectportal.firefox.com. (53)
```

Additionally, when using 127.0.0.1 as "Current DNS Server", everything works fine, and I can indeed see outgoing DNS requests being made by powerdns.

**Comment by Anvil** [comment]
Hello. Any news on this one ?

**Comment by Anvil** [comment]
So I havent checked in a while but right now I cant reproduce it with systemd-246.10-1.fc33.x86_64. 

Resolvctl output
```
Global
         Protocols: LLMNR=resolve -mDNS -DNSOverTLS DNSSEC=no/unsupported
  resolv.conf mode: stub                                                 
Current DNS Server: ::1                                                  
       DNS Servers: ::1                                                  

Link 2 (wlp2s0)
    Current Scopes: DNS LLMNR/IPv4 LLMNR/IPv6                                   
         Protocols: +DefaultRoute +LLMNR -mDNS -DNSOverTLS DNSSEC=no/unsupported
Current DNS Server: ::1                                                         
       DNS Servers: ::1
```

tcpdump while running `host livna.org`
```
20:19:02.931692 lo    In  IP 127.0.0.1.38765 > 127.0.0.53.domain: 4409+ A? livna.org. (27)
20:19:02.932293 lo    In  IP6 ::1.37977 > ::1.domain: 15648+ [1au] A? livna.org. (38)
20:19:02.932921 lo    In  IP6 ::1.domain > ::1.37977: 15648 1/0/1 A 37.187.99.179 (54)
```

**Comment by Anvil** [comment]
So, I'll upgrade to fedora 34 beta in a few days. I expect the systemd release will be different. 
If it's still working after the upgrade I'll assume "someone did patch something without updating the issue" and close this bug report.

**Comment by Anvil** [comment]
So, systemd-248-1.fc34.x86_64 *is* working. I'll close that.
