### ISSUE TITLE
DHCPv6 is always on regardless of config set to DHCP="no"

### ISSUE THREAD

**Issue by cvmiller** [systemd/systemd#4624]
### Submission type

  - [x] Bug report
  - [ ] Request for enhancement (RFE)

*NOTE: Do not submit anything other than bug reports or RFEs via the issue tracker!*

### systemd version the issue has been seen with

> systemd 231
+PAM -AUDIT -SELINUX -IMA -APPARMOR +SMACK -SYSVINIT +UTMP +LIBCRYPTSETUP +GCRYPT +GNUTLS +ACL +XZ +LZ4 +SECCOMP +BLKID +ELFUTILS +KMOD +IDN

*NOTE: Do not submit bug reports about anything but the two most recently released systemd versions upstream!*

### Used distribution

> Arch Linux

### In case of bug report: Expected behaviour you didn't see

> DHCPv6 client should not make a request when config file /etc/systemd/network/eth0.network is configured for IPv4 only, or configured as "no"

### In case of bug report: Unexpected behaviour you saw

> DHCPv6 client made requests regardless of configuration file setting

### In case of bug report: Steps to reproduce the problem

1. Ensure router has M-bit enabled in RA
2. Configure /etc/systemd/networkd/eth0.network with line DHCP="no"
3. Restart networkd, or reboot host
4. Observe that host still obtains a DHCPv6 address from server

#### Additional information
If the RA has M-bit set to 0, DHCPv6 Client will **not** make a request (which some interpretate as the correct behaviour of RFC 3315). If this is the desired behaviour, then the documentation should be updated.

**Comment by martinpitt** [comment]
AFAIUI, networkd will and should always respond to RA, as that's IPv6's primary configuration method; you can explicitly disable it with `IPv6AcceptRA=no`, but the default is `yes`. This is _not_ the same as DHCPv6 -- are you sure it gets a DHCPv6 address? Can you please post the journal of networkd in this case?

**Comment by cvmiller** [comment]
Yes, it is requesting a DHCPv6 address (see tcpdump trace).

```
Nov 08 19:58:27 alarm systemd[1]: Stopped Network Service.
Nov 08 19:58:27 alarm systemd-timesyncd[275]: Synchronized to time server [2607:
5300:60:92e7::1]:123 (2.arch.pool.ntp.org).
Nov 08 19:58:27 alarm systemd[1]: Starting Network Service...
Nov 08 19:58:27 alarm systemd-networkd[825]: eth0: Gained IPv6LL
Nov 08 19:58:27 alarm systemd-networkd[825]: Enumeration completed
Nov 08 19:58:27 alarm systemd[1]: Started Network Service.
Nov 08 19:58:27 alarm systemd-timesyncd[275]: Network configuration changed, try
ing to establish connection.
Nov 08 19:58:27 alarm systemd-networkd[825]: eth0: DHCPv4 address 192.168.11.204
/24 via 192.168.11.1
Nov 08 19:58:27 alarm dbus[293]: [system] Activating via systemd: service name='
org.freedesktop.hostname1' unit='dbus-org.freedesktop.hostname1.service'
Nov 08 19:58:27 alarm systemd[1]: Starting Hostname Service...
Nov 08 19:58:28 alarm dbus[293]: [system] Successfully activated service 'org.fr
eedesktop.hostname1'
Nov 08 19:58:28 alarm systemd[1]: Started Hostname Service.
Nov 08 19:58:28 alarm systemd-networkd[825]: eth0: DHCPv6 address 2001:470:ebbd:
8::64a/128 timeout preferred -1 valid -1
Nov 08 19:58:30 alarm systemd-networkd[825]: eth0: Configured
```

And sniffing on my router while restarting networkd, I see:

```
20:02:53.612134 IP6 fe80::285a:f9ff:febb:672a.dhcpv6-client > ff02::1:2.dhcpv6-server: dhcp6 solicit
20:02:53.613882 IP6 fe80::224:a5ff:fed7:3088.dhcpv6-server > fe80::285a:f9ff:febb:672a.dhcpv6-client: dhcp6 advertise
20:02:54.769596 IP6 fe80::285a:f9ff:febb:672a.dhcpv6-client > ff02::1:2.dhcpv6-server: dhcp6 request
20:02:54.771211 IP6 fe80::224:a5ff:fed7:3088.dhcpv6-server > fe80::285a:f9ff:febb:672a.dhcpv6-client: dhcp6 reply
```

**Comment by cvmiller** [comment]
Additional info: It is undesirable to disable reading RAs  `IPv6AcceptRA=no` in a SLAAC environment, as RA also carries default route, and RDNSS info.

**Comment by poettering** [comment]
So the docs say this: 

```
Note that DHCPv6 will by default be triggered by Router Advertisement, if that is enabled,
regardless of this parameter. By enabling DHCPv6 support explicitly, the DHCPv6 client will
be started regardless of the presence of routers on the link, or what flags the routers pass. See 
"IPv6AcceptRouterAdvertisements=".
```

Are you saying that that's not what you are seeing? To me it appears the docs are perfectly in line with the behaviour you saw? Can you elaborate?

**Comment by cvmiller** [comment]
Perhaps I am not looking at the correct document. The networkd man page shows:

https://www.mankier.com/5/systemd.network

The [Network] section accepts the following keys:

Description=
    A description of the device. This is only used for presentation purposes. 
DHCP=
    Enables DHCPv4 and/or DHCPv6 support. Accepts yes, no, ipv4, or ipv6.

```
Please note that by default the domain name specified through DHCP is not used for name resolution. See option UseDomains= below.
```

There is no mention that the client will follow the M-bit in the RA (which I think is the correct behaviour based on RFC 3315).

**Comment by floppym** [comment]
That copy of the man page is out-of-date. A more current version is here.

https://www.freedesktop.org/software/systemd/man/systemd.network.html#DHCP=

**Comment by cvmiller** [comment]
Thanks for the clarification. I suggest we close this issue.
