### ISSUE TITLE
networkd does not acquire DHCPv4 lease in container with PrivateNetworking=yes

### ISSUE THREAD

**Issue by keszybz** [systemd/systemd#17781]
I see the same behaviour on two different installations.

Host config uses our own /usr/lib/systemd/network/80-container-ve.network. This has
```
DHCPServer=yes
```
In networkd logs I see `DHCP SERVER: STARTED`.
<details>

```
Nov 30 11:45:49 krowka systemd-networkd[1686]: rtnl: received non-static neighbor, ignoring.
Nov 30 11:45:49 krowka systemd-networkd[1686]: rtnl: received non-static neighbor, ignoring.
Nov 30 11:45:56 krowka systemd-networkd[1686]: ve-rawhide: New device has no master, continuing without
Nov 30 11:45:56 krowka systemd-networkd[1686]: ve-rawhide: Flags change: +MULTICAST +BROADCAST
Nov 30 11:45:56 krowka systemd-networkd[1686]: Sent message type=signal sender=n/a destination=n/a path=/org/freedesktop/network1/link/_330 interface=org.freedesktop.DBus.Properties member=PropertiesChanged cookie=565 reply_cookie=0 signature=sa{sv}as error-name=n/a error-message=n/a
Nov 30 11:45:56 krowka systemd-networkd[1686]: ve-rawhide: Link 30 added
Nov 30 11:45:56 krowka systemd-networkd[1686]: ve-rawhide: link pending udev initialization...
Nov 30 11:45:56 krowka systemd-networkd[1686]: ve-rawhide: Saved original MTU: 1500
Nov 30 11:45:56 krowka systemd-networkd[1686]: ve-rawhide: udev initialized link
Nov 30 11:45:56 krowka systemd-networkd[1686]: ve-rawhide: State changed: pending -> initialized
Nov 30 11:45:56 krowka systemd-networkd[1686]: Sent message type=signal sender=n/a destination=n/a path=/org/freedesktop/network1/link/_330 interface=org.freedesktop.DBus.Properties member=PropertiesChanged cookie=566 reply_cookie=0 signature=sa{sv}as error-name=n/a error-message=n/a
Nov 30 11:45:56 krowka systemd-networkd[1686]: ve-rawhide: Link state is up-to-date
Nov 30 11:45:56 krowka systemd-networkd[1686]: ve-rawhide: found matching network '/usr/lib/systemd/network/80-container-ve.network'
Nov 30 11:45:56 krowka systemd-networkd[1686]: Setting '/proc/sys/net/ipv6/conf/ve-rawhide/disable_ipv6' to '0'
Nov 30 11:45:56 krowka systemd-networkd[1686]: Setting '/proc/sys/net/ipv4/ip_forward' to '1'
Nov 30 11:45:56 krowka systemd-networkd[1686]: Setting '/proc/sys/net/ipv6/conf/ve-rawhide/use_tempaddr' to '0'
Nov 30 11:45:56 krowka systemd-networkd[1686]: Setting '/proc/sys/net/ipv6/conf/ve-rawhide/accept_ra' to '0'
Nov 30 11:45:56 krowka systemd-networkd[1686]: Setting '/proc/sys/net/ipv6/conf/ve-rawhide/proxy_ndp' to '0'
Nov 30 11:45:56 krowka systemd-networkd[1686]: ve-rawhide: Setting nomaster
Nov 30 11:45:56 krowka systemd-networkd[1686]: ve-rawhide: Using "ve-rawhide" as stable identifying information
Nov 30 11:45:56 krowka systemd-networkd[1686]: ve-rawhide: Setting address genmode for link
Nov 30 11:45:56 krowka systemd-networkd[1686]: ve-rawhide: Failed to read sysctl property stable_secret: Input/output error
Nov 30 11:45:56 krowka systemd-networkd[1686]: ve-rawhide: Setting nomaster done.
Nov 30 11:45:56 krowka systemd-networkd[1686]: ve-rawhide: Setting address genmode done.
Nov 30 11:45:56 krowka systemd-networkd[1686]: ve-rawhide: State changed: initialized -> configuring
Nov 30 11:45:56 krowka systemd-networkd[1686]: Sent message type=signal sender=n/a destination=n/a path=/org/freedesktop/network1/link/_330 interface=org.freedesktop.DBus.Properties member=PropertiesChanged cookie=567 reply_cookie=0 signature=sa{sv}as error-name=n/a error-message=n/a
Nov 30 11:45:56 krowka systemd-networkd[1686]: ve-rawhide: Bringing link up
Nov 30 11:45:56 krowka systemd-networkd[1686]: ve-rawhide: Flags change: +UP
Nov 30 11:45:56 krowka systemd-networkd[1686]: Sent message type=signal sender=n/a destination=n/a path=/org/freedesktop/network1/link/_330 interface=org.freedesktop.DBus.Properties member=PropertiesChanged cookie=568 reply_cookie=0 signature=sa{sv}as error-name=n/a error-message=n/a
Nov 30 11:45:56 krowka systemd-networkd[1686]: ve-rawhide: Link UP
Nov 30 11:45:56 krowka systemd-networkd[1686]: LLDP: Started LLDP client
Nov 30 11:45:56 krowka systemd-networkd[1686]: ve-rawhide: Started LLDP.
Nov 30 11:45:56 krowka systemd-networkd[1686]: ve-rawhide: Remembering route: dst: ff00::/8, src: n/a, gw: n/a, prefsrc: n/a, scope: global, table: local, proto: boot, type: unicast
Nov 30 11:45:56 krowka systemd-networkd[1686]: ve-rawhide: Remembering route: dst: fe80::/64, src: n/a, gw: n/a, prefsrc: n/a, scope: global, table: main, proto: kernel, type: unicast
Nov 30 11:45:56 krowka systemd-networkd[1686]: ve-rawhide: Flags change: +LOWER_UP +RUNNING
Nov 30 11:45:56 krowka systemd-networkd[1686]: Sent message type=signal sender=n/a destination=n/a path=/org/freedesktop/network1/link/_330 interface=org.freedesktop.DBus.Properties member=PropertiesChanged cookie=569 reply_cookie=0 signature=sa{sv}as error-name=n/a error-message=n/a
Nov 30 11:45:56 krowka systemd-networkd[1686]: ve-rawhide: Gained carrier
Nov 30 11:45:56 krowka systemd-networkd[1686]: ve-rawhide: Acquiring IPv4 link-local address
Nov 30 11:45:56 krowka systemd-networkd[1686]: IPV4LL: Picked new IP address 169.254.136.213.
Nov 30 11:45:56 krowka systemd-networkd[1686]: ve-rawhide: link_check_ready(): static addresses are not configured.
Nov 30 11:45:56 krowka systemd-networkd[1686]: ve-rawhide: link_check_ready(): static addresses are not configured.
Nov 30 11:45:56 krowka systemd-networkd[1686]: Found range 192.168.239.112/28
Nov 30 11:45:56 krowka systemd-networkd[1686]: ve-rawhide: Configuring address: 192.168.239.113
Nov 30 11:45:56 krowka systemd-networkd[1686]: ve-rawhide: Setting addresses
Nov 30 11:45:56 krowka systemd-networkd[1686]: ve-rawhide: Not emitting NTP servers on link, couldn't find suitable uplink.
Nov 30 11:45:56 krowka systemd-networkd[1686]: ve-rawhide: Not emitting SIP servers on link, couldn't find suitable uplink.
Nov 30 11:45:56 krowka systemd-networkd[1686]: DHCP SERVER: STARTED
Nov 30 11:45:56 krowka systemd-networkd[1686]: ve-rawhide: Offering DHCPv4 leases
Nov 30 11:45:56 krowka systemd-networkd[1686]: ve-rawhide: Remembering updated address: 192.168.239.113/28 (valid forever)
Nov 30 11:45:56 krowka systemd-networkd[1686]: Sent message type=signal sender=n/a destination=n/a path=/org/freedesktop/network1/link/_330 interface=org.freedesktop.DBus.Properties member=PropertiesChanged cookie=570 reply_cookie=0 signature=sa{sv}as error-name=n/a error-message=n/a
Nov 30 11:45:56 krowka systemd-networkd[1686]: ve-rawhide: link_check_ready(): static addresses are not configured.
Nov 30 11:45:56 krowka systemd-networkd[1686]: ve-rawhide: Remembering route: dst: 192.168.239.113/32, src: n/a, gw: n/a, prefsrc: 192.168.239.113, scope: host, table: local, proto: kernel, type: local
Nov 30 11:45:56 krowka systemd-networkd[1686]: ve-rawhide: Remembering route: dst: 192.168.239.127/32, src: n/a, gw: n/a, prefsrc: 192.168.239.113, scope: link, table: local, proto: kernel, type: broadcast
Nov 30 11:45:56 krowka systemd-networkd[1686]: ve-rawhide: Remembering route: dst: 192.168.239.112/28, src: n/a, gw: n/a, prefsrc: 192.168.239.113, scope: link, table: main, proto: kernel, type: unicast
Nov 30 11:45:56 krowka systemd-networkd[1686]: ve-rawhide: Remembering route: dst: 192.168.239.112/32, src: n/a, gw: n/a, prefsrc: 192.168.239.113, scope: link, table: local, proto: kernel, type: broadcast
Nov 30 11:45:56 krowka systemd-networkd[1686]: ve-rawhide: Addresses set
Nov 30 11:45:56 krowka systemd-networkd[1686]: ve-rawhide: link_check_ready(): IPv4LL is not configured.
Nov 30 11:45:57 krowka systemd-networkd[1686]: IPV4ACD: Probing 169.254.136.213
Nov 30 11:45:58 krowka systemd-networkd[1686]: ve-rawhide: Sending LLDP packet...
Nov 30 11:45:58 krowka systemd-networkd[1686]: LLDP: Invoking callback for 'added' event.
Nov 30 11:45:58 krowka systemd-networkd[1686]: ve-rawhide: Received LLDP datagram from previously unknown neighbor, restarting 'fast' LLDP transmission.
Nov 30 11:45:58 krowka systemd-networkd[1686]: LLDP: Successfully processed LLDP datagram.
Nov 30 11:45:58 krowka systemd-networkd[1686]: ve-rawhide: Remembering foreign address: fe80::8e8:42ff:fe0f:39d8/64 (valid forever)
Nov 30 11:45:58 krowka systemd-networkd[1686]: ve-rawhide: link_check_ready(): IPv4LL is not configured.
Nov 30 11:45:58 krowka systemd-networkd[1686]: ve-rawhide: Gained IPv6LL
Nov 30 11:45:58 krowka systemd-networkd[1686]: ve-rawhide: link_check_ready(): IPv4LL is not configured.
Nov 30 11:45:58 krowka systemd-networkd[1686]: ve-rawhide: Discovering IPv6 routers
Nov 30 11:45:58 krowka systemd-networkd[1686]: NDISC: Started IPv6 Router Solicitation client
Nov 30 11:45:58 krowka systemd-networkd[1686]: ve-rawhide: Remembering route: dst: fe80::8e8:42ff:fe0f:39d8/128, src: n/a, gw: n/a, prefsrc: n/a, scope: global, table: local, proto: kernel, type: local
Nov 30 11:45:59 krowka systemd-networkd[1686]: ve-rawhide: Sending LLDP packet...
Nov 30 11:45:59 krowka systemd-networkd[1686]: LLDP: Invoking callback for 'refreshed' event.
Nov 30 11:45:59 krowka systemd-networkd[1686]: LLDP: Successfully processed LLDP datagram.
Nov 30 11:45:59 krowka systemd-networkd[1686]: NDISC: Sent Router Solicitation, next solicitation in 4s
Nov 30 11:45:59 krowka systemd-networkd[1686]: IPV4ACD: Probing 169.254.136.213
Nov 30 11:46:00 krowka systemd-networkd[1686]: ve-rawhide: Sending LLDP packet...
Nov 30 11:46:00 krowka systemd-networkd[1686]: LLDP: Invoking callback for 'refreshed' event.
Nov 30 11:46:00 krowka systemd-networkd[1686]: LLDP: Successfully processed LLDP datagram.
Nov 30 11:46:01 krowka systemd-networkd[1686]: ve-rawhide: Sending LLDP packet...
Nov 30 11:46:01 krowka systemd-networkd[1686]: LLDP: Invoking callback for 'refreshed' event.
Nov 30 11:46:01 krowka systemd-networkd[1686]: LLDP: Successfully processed LLDP datagram.
Nov 30 11:46:01 krowka systemd-networkd[1686]: IPV4ACD: Probing 169.254.136.213
Nov 30 11:46:02 krowka systemd-networkd[1686]: ve-rawhide: Sending LLDP packet...
Nov 30 11:46:03 krowka systemd-networkd[1686]: NDISC: Sent Router Solicitation, next solicitation in 8s
Nov 30 11:46:03 krowka systemd-networkd[1686]: IPV4ACD: ANNOUNCE
Nov 30 11:46:03 krowka systemd-networkd[1686]: ve-rawhide: IPv4 link-local claim 169.254.136.213
Nov 30 11:46:03 krowka systemd-networkd[1686]: ve-rawhide: Configuring address: 169.254.136.213
Nov 30 11:46:03 krowka systemd-networkd[1686]: ve-rawhide: Remembering updated address: 169.254.136.213/16 (valid forever)
Nov 30 11:46:03 krowka systemd-networkd[1686]: ve-rawhide: link_check_ready(): IPv4LL is not configured.
Nov 30 11:46:03 krowka systemd-networkd[1686]: ve-rawhide: Remembering route: dst: 169.254.136.213/32, src: n/a, gw: n/a, prefsrc: 169.254.136.213, scope: host, table: local, proto: kernel, type: local
Nov 30 11:46:03 krowka systemd-networkd[1686]: ve-rawhide: Remembering route: dst: 169.254.255.255/32, src: n/a, gw: n/a, prefsrc: 169.254.136.213, scope: link, table: local, proto: kernel, type: broadcast
Nov 30 11:46:03 krowka systemd-networkd[1686]: ve-rawhide: Remembering route: dst: 169.254.0.0/16, src: n/a, gw: n/a, prefsrc: 169.254.136.213, scope: link, table: main, proto: kernel, type: unicast
Nov 30 11:46:03 krowka systemd-networkd[1686]: ve-rawhide: Remembering route: dst: 169.254.0.0/32, src: n/a, gw: n/a, prefsrc: 169.254.136.213, scope: link, table: local, proto: kernel, type: broadcast
Nov 30 11:46:03 krowka systemd-networkd[1686]: ve-rawhide: link_check_ready(): dynamic addresses or routes are not configured.
```

</details>

The container has:
```
# /etc/systemd/nspawn/f33.nspawn
[Exec]
PrivateUsers=no

[Network]
Private=yes
VirtualEthernet=yes
```
but it never acquires a DHCPv4 lease:
```console
# ip a
1: lo: <LOOPBACK,UP,LOWER_UP> mtu 65536 qdisc noqueue state UNKNOWN group default qlen 1000
    link/loopback 00:00:00:00:00:00 brd 00:00:00:00:00:00
    inet 127.0.0.1/8 scope host lo
       valid_lft forever preferred_lft forever
    inet6 ::1/128 scope host 
       valid_lft forever preferred_lft forever
2: host0@if5: <BROADCAST,MULTICAST,UP,LOWER_UP> mtu 1500 qdisc noqueue state UP group default qlen 1000
    link/ether e2:c7:00:27:07:76 brd ff:ff:ff:ff:ff:ff link-netnsid 0
    inet 169.254.109.58/16 brd 169.254.255.255 scope link host0
       valid_lft forever preferred_lft forever
    inet6 fe80::e0c7:ff:fe27:776/64 scope link 
       valid_lft forever preferred_lft forever
# networkctl status host0
● 2: host0                                                                                  
                     Link File: n/a                                                         
                  Network File: /usr/lib/systemd/network/80-container-host0.network         
                          Type: ether                                                       
                         State: degraded (configuring)
                    HW Address: e2:c7:00:27:07:76                                           
                           MTU: 1500 (min: 68, max: 65535)                                  
                         QDisc: noqueue                                                     
  IPv6 Address Generation Mode: eui64                                                       
          Queue Length (Tx/Rx): 1/1                                                         
              Auto negotiation: no                                                          
                         Speed: 10Gbps                                                      
                        Duplex: full                                                        
                          Port: tp                                                          
                       Address: 169.254.109.58                                              
                                fe80::e0c7:ff:fe27:776                                      
             DHCP6 Client DUID: DUID-EN/Vendor:0000ab11a0ad207e7b2a95490000                 
                  Connected To: fedora-rawhide-sp on port ve-f33                            

Nov 30 12:46:39 f33 systemd-networkd[14]: host0: IPv6 successfully enabled
Nov 30 12:46:39 f33 systemd-networkd[14]: host0: Link UP
Nov 30 12:46:39 f33 systemd-networkd[14]: host0: Gained carrier
Nov 30 12:46:41 f33 systemd-networkd[14]: host0: Gained IPv6LL
```

Tcpdump:
```
$ sudo tcpdump -i any port bootpc or bootpc or icmp
12:57:43.169152 IP 0.0.0.0.bootpc > 255.255.255.255.bootps: BOOTP/DHCP, Request from e2:c7:00:27:07:76 (oui Unknown), length 286
12:57:45.777388 IP 0.0.0.0.bootpc > 255.255.255.255.bootps: BOOTP/DHCP, Request from e2:c7:00:27:07:76 (oui Unknown), length 286
12:57:47.729406 IP 0.0.0.0.bootpc > 255.255.255.255.bootps: BOOTP/DHCP, Request from e2:c7:00:27:07:76 (oui Unknown), length 286
...
$ $ sudo lsof -p $(systemctl show --value -p MainPID systemd-networkd)|grep boot
systemd-n 44150 systemd-network   18u     IPv4             393509      0t0    UDP fedora-rawhide-sp:bootpc 
systemd-n 44150 systemd-network   25u     IPv4             404267      0t0    UDP *:bootps
```
There are no iptables rules or nft tables. 

/cc @yuwata

**Comment by keszybz** [comment]
So... PEBKAC. It turns out that firewalld on Fedora installs nft rules to deny the traffic. I was confused by the fact that `nft list tables`  happily runs and return no error and no output. `sudo nft list tables` is needed. I *do* feel stupid, but OTOH, the `nft` interface is so insanely hard to use that if somebody tried to design it to make it worse, they could hardly have made a better job.

**Comment by yuwata** [comment]
Oh, I spent a few hours by the exactly same reason. And I confirm that this issue is actually caused by firewalld. Thanks.
