### ISSUE TITLE
Networkd DHCPv4 client keep trying REQUEST even if no response

### ISSUE THREAD

**Issue by fluboi** [systemd/systemd#13737]
**systemd version the issue has been seen with**
> systemd 241 (241)

**Used distribution**
 > Debian 10.1

**Expected behaviour you didn't see**
 >  Expect to have some kind of timeout, and restart a normal exchange with a DISCOVER message. That way it can have a new OFFER from a potential secondary DHCP server.

**Unexpected behaviour you saw**
 > DHCPv4 client keep trying to send DHCP Request even if no response. Tried to wait 2h15, it was still sending REQUEST. (lease time is 2h)

**Steps to reproduce the problem**
>Having a DHCP server that do an OFFER and then stop respond (never ACK) . Might happen if DHCP server crashed or if misconfigured. 

**Logs**
```
Oct 05 17:13:23 router01 systemd-networkd[5518]: DHCP CLIENT (0x73bc0fb2): REBOOT in 0
Oct 05 17:13:23 router01 systemd-networkd[5518]: DHCP CLIENT (0x73bc0fb2): DISCOVER
Oct 05 17:13:23 router01 systemd-networkd[5518]: Ignoring option DHCP option 61 while parsing.
Oct 05 17:13:23 router01 systemd-networkd[5518]: DHCP CLIENT (0x73bc0fb2): OFFER
Oct 05 17:13:23 router01 systemd-networkd[5518]: DHCP CLIENT (0x73bc0fb2): REQUEST (requesting)
Oct 05 17:13:24 router01 systemd-networkd[5518]: Got message type=method_return sender=:1.329 destination=:1.251 path=n/a interface=n/a member=n/a cookie=3 reply_cookie=116 signature=n/a error-name=n/a error-message=n/a
Oct 05 17:13:25 router01 systemd-networkd[5518]: DHCP CLIENT (0x73bc0fb2): REQUEST (requesting)
Oct 05 17:13:30 router01 systemd-networkd[5518]: DHCP CLIENT (0x73bc0fb2): REQUEST (requesting)
Oct 05 17:13:36 router01 systemd-networkd[5518]: NDISC: Sent Router Solicitation, next solicitation in 54min 6s
Oct 05 17:13:38 router01 systemd-networkd[5518]: DHCP CLIENT (0x73bc0fb2): REQUEST (requesting)
Oct 05 17:13:54 router01 systemd-networkd[5518]: DHCP CLIENT (0x73bc0fb2): REQUEST (requesting)
Oct 05 17:14:27 router01 systemd-networkd[5518]: DHCP CLIENT (0x73bc0fb2): REQUEST (requesting)
Oct 05 17:15:30 router01 systemd-networkd[5518]: DHCP CLIENT (0x73bc0fb2): REQUEST (requesting)
Oct 05 17:15:55 router01 systemd-networkd[5518]: RADV: Next Router Advertisement in 6min 30s
Oct 05 17:16:35 router01 systemd-networkd[5518]: DHCP CLIENT (0x73bc0fb2): REQUEST (requesting)
Oct 05 17:17:39 router01 systemd-networkd[5518]: DHCP CLIENT (0x73bc0fb2): REQUEST (requesting)
Oct 05 17:18:43 router01 systemd-networkd[5518]: DHCP CLIENT (0x73bc0fb2): REQUEST (requesting)
Oct 05 17:19:48 router01 systemd-networkd[5518]: DHCP CLIENT (0x73bc0fb2): REQUEST (requesting)

```

**Comment by ssahani** [comment]
Well if you don't have a server then why running the client.

**Comment by fluboi** [comment]
I do have a server. I even have 2 DHCP server.
The first server send an OFFER at `Oct 05 17:13:23` and then crashed. 
When DHCP client then try to REQUEST the offered IP, it get no response. But keep trying indefinitely. 
Instead if if was, after a timeout, re-initiating the DISCOVER sequence, the second DHCP can do an other OFFER.

**Comment by fluboi** [comment]
The expected behaviour is well decribed in [RFC2131](https://tools.ietf.org/html/rfc2131#page-17): 

> 
     The client times out and retransmits the DHCPREQUEST message if the
     client receives neither a DHCPACK or a DHCPNAK message.  The client
     retransmits the DHCPREQUEST according to the retransmission
     algorithm in section 4.1.  The client should choose to retransmit
     the DHCPREQUEST enough times to give adequate probability of
     contacting the server without causing the client (and the user of
     that client) to wait overly long before giving up; e.g., a client
     retransmitting as described in section 4.1 might retransmit the
     DHCPREQUEST message four times, for a total delay of 60 seconds,
     before restarting the initialization procedure.  If the client
     receives neither a DHCPACK or a DHCPNAK message after employing the
     retransmission algorithm, the client reverts to INIT state and
     restarts the initialization process.  The client SHOULD notify the
     user that the initialization process has failed and is restarting.

**Comment by ssahani** [comment]
Seems you have a valid point . We should do it .

**Comment by ssahani** [comment]
How about ```DHCPv4.MaxAttempts=``` ? does it solves your issue ?

**Comment by fluboi** [comment]
If I understand well, `MaxAttempts` define the number of DHCP DISCOVER to do. And it is perfectly fine and recommended to keep the default _infinity_ value for this.

Here we are talking about what to do if stuck in an intermediate (_REQUEST_) state.

**Comment by ssahani** [comment]
not only that also  ```MaxAttempts=``` happens in the REQUEST state too with 3 more states.

**Comment by ssahani** [comment]
@fluboi could you update the test results ?

**Comment by fluboi** [comment]
Sorry for the delay, I need some time to re-create a test environment. Can't test it in production environment.

**Comment by fluboi** [comment]
Here my config file:

```
[Match]
Name=ens18

[Network]
DHCP=yes

[DHCPv4]
MaxAttempts=3
```
```
systemctl daemon-reload
systemctl restart systemd-networkd 
```

Logs:

```
oct. 11 15:38:09 networkd00 systemd-networkd[1260]: DHCP CLIENT (0xbde7472e): DISCOVER
oct. 11 15:38:10 networkd00 systemd-networkd[1260]: DHCP CLIENT (0xbde7472e): DISCOVER
oct. 11 15:38:15 networkd00 systemd-networkd[1260]: DHCP CLIENT (0xbde7472e): DISCOVER
oct. 11 15:38:22 networkd00 systemd-networkd[1260]: DHCP CLIENT (0xbde7472e): DISCOVER
oct. 11 15:38:38 networkd00 systemd-networkd[1260]: DHCP CLIENT (0xbde7472e): DISCOVER
oct. 11 15:39:09 networkd00 systemd-networkd[1260]: DHCP CLIENT (0xbde7472e): DISCOVER
oct. 11 15:40:13 networkd00 systemd-networkd[1260]: DHCP CLIENT (0xbde7472e): DISCOVER
oct. 11 15:41:18 networkd00 systemd-networkd[1260]: DHCP CLIENT (0xbde7472e): DISCOVER
```
Capture:
```
15:38:09.272889 IP 0.0.0.0.68 > 255.255.255.255.67: BOOTP/DHCP, Request from 0a:71:90:07:d2:9b, length 291
15:38:10.537291 IP 0.0.0.0.68 > 255.255.255.255.67: BOOTP/DHCP, Request from 0a:71:90:07:d2:9b, length 291
15:38:15.310654 IP 0.0.0.0.68 > 255.255.255.255.67: BOOTP/DHCP, Request from 0a:71:90:07:d2:9b, length 291
15:38:22.835538 IP 0.0.0.0.68 > 255.255.255.255.67: BOOTP/DHCP, Request from 0a:71:90:07:d2:9b, length 291
15:38:38.331932 IP 0.0.0.0.68 > 255.255.255.255.67: BOOTP/DHCP, Request from 0a:71:90:07:d2:9b, length 291
15:39:09.671226 IP 0.0.0.0.68 > 255.255.255.255.67: BOOTP/DHCP, Request from 0a:71:90:07:d2:9b, length 291

```

Note that in the test setup, networkd logs says that it sends "DISCOVER" packets... but it reality, network capture show that only DHCP REQUEST are sent. 

A very simple way to test that behavior: configure networkd as DHCPv4 client. Check that every thing is OK, IP obtained by client. 
Then stop the DHCP server that assigned the IP, and restart systemd-networkd on the client. Networkd is going to start a loop of DHCP Request. (so if an other DHCP server is present, it will never receive any Discover, and never assign an IP.)

**Comment by ssahani** [comment]
>Note that in the test setup, networkd logs says that it sends "DISCOVER" packets... but it reality, network capture show that only DHCP REQUEST are sent.

I am pretty sure networkd talks how RFC is .  You just need veth interface to test it out . See test/test-network.

**Comment by fluboi** [comment]
I'm saying that **in this specific case**:
 - networkd logs do not retranscribe what it really does. Tcpdump capture do not lie
- `MaxAttemps`have no effect

Even though `MaxAttemps` had worked as described in the man, ("Specifies how many times the DHCPv4 client configuration should be attempted"), it's not the good option to correct this inappropriate behavior on REQUEST retries. By default we should try indefinitely to get an IP, but by default we should also never fall in an endless REQUEST loop.

**Comment by fluboi** [comment]
Hum, by re-reading the tcpdump capture I posted earlier, I see the packets that tcpdump show as "Request" are sent to 255.255.255.255. That quite strange for a real "request". 
Maybe tcpdump is lying ! I need to check.

**Comment by fluboi** [comment]
Ok, so now I can reproduce the behavior in the test environment. 

With or without `MaxAttemps=3`, same result:

```
oct. 12 18:42:32 networkd00 systemd-networkd[846]: DHCP CLIENT (0xb7f86032): DISCOVER
oct. 12 18:42:35 networkd00 systemd-networkd[846]: DHCP CLIENT (0xb7f86032): OFFER
oct. 12 18:42:35 networkd00 systemd-networkd[846]: DHCP CLIENT (0xb7f86032): REQUEST (requesting)
oct. 12 18:42:38 networkd00 systemd-networkd[846]: DHCP CLIENT (0xb7f86032): REQUEST (requesting)
oct. 12 18:42:42 networkd00 systemd-networkd[846]: DHCP CLIENT (0xb7f86032): REQUEST (requesting)
oct. 12 18:42:50 networkd00 systemd-networkd[846]: DHCP CLIENT (0xb7f86032): REQUEST (requesting)
oct. 12 18:43:07 networkd00 systemd-networkd[846]: DHCP CLIENT (0xb7f86032): REQUEST (requesting)
oct. 12 18:43:39 networkd00 systemd-networkd[846]: DHCP CLIENT (0xb7f86032): REQUEST (requesting)
oct. 12 18:44:42 networkd00 systemd-networkd[846]: DHCP CLIENT (0xb7f86032): REQUEST (requesting)
oct. 12 18:45:46 networkd00 systemd-networkd[846]: DHCP CLIENT (0xb7f86032): REQUEST (requesting)
oct. 12 18:46:50 networkd00 systemd-networkd[846]: DHCP CLIENT (0xb7f86032): REQUEST (requesting)
oct. 12 18:47:54 networkd00 systemd-networkd[846]: DHCP CLIENT (0xb7f86032): REQUEST (requesting)
oct. 12 18:48:57 networkd00 systemd-networkd[846]: DHCP CLIENT (0xb7f86032): REQUEST (requesting)
oct. 12 18:50:01 networkd00 systemd-networkd[846]: DHCP CLIENT (0xb7f86032): REQUEST (requesting)
oct. 12 18:51:05 networkd00 systemd-networkd[846]: DHCP CLIENT (0xb7f86032): REQUEST (requesting)
oct. 12 18:52:10 networkd00 systemd-networkd[846]: DHCP CLIENT (0xb7f86032): REQUEST (requesting)
oct. 12 18:53:13 networkd00 systemd-networkd[846]: DHCP CLIENT (0xb7f86032): REQUEST (requesting)
oct. 12 18:54:18 networkd00 systemd-networkd[846]: DHCP CLIENT (0xb7f86032): REQUEST (requesting)
oct. 12 18:55:22 networkd00 systemd-networkd[846]: DHCP CLIENT (0xb7f86032): REQUEST (requesting)
oct. 12 18:56:27 networkd00 systemd-networkd[846]: DHCP CLIENT (0xb7f86032): REQUEST (requesting)
```

Config file: 
```
cat /etc/systemd/network/ens18.network
[Match]
Name=ens18

[Network]
DHCP=yes

[DHCPv4]
MaxAttempts=3
```
