### ISSUE TITLE
resolvectl query hangs during systemd-resolved restart

### ISSUE THREAD

**Issue by elie-delorme** [systemd/systemd#22521]
**systemd version the issue has been seen with**
 > systemd 248 (248.3-1ubuntu8.2)
+PAM +AUDIT +SELINUX +APPARMOR +IMA +SMACK +SECCOMP +GCRYPT +GNUTLS -OPENSSL +ACL +BLKID +CURL +ELFUTILS -FIDO2 +IDN2 -IDN +IPTC +KMOD +LIBCRYPTSETUP -LIBFDISK +PCRE2 -PWQUALITY -P11KIT -QRENCODE +BZIP2 +LZ4 +XZ +ZLIB +ZSTD -XKBCOMMON +UTMP +SYSVINIT default-hierarchy=unified

**Used distribution**
 > Distributor ID:	Ubuntu
> Description:	Ubuntu 21.10
> Release:	21.10
> Codename:	impish

**Linux kernel version used** (`uname -a`)

 > `Linux CH0013-P 5.13.0-28-generic #31-Ubuntu SMP Thu Jan 13 17:41:06 UTC 2022 x86_64 x86_64 x86_64 GNU/Linux`

**CPU architecture issue was seen on**
 > amd64

**Expected behaviour you didn't see**
 > dns resolver should work after systemd-resolved restart

**Unexpected behaviour you saw**
 > dns resolver hung for a duration following systemd-resolved restart, which caused a very slow dns resolution for ~40 seconds

**Steps to reproduce the problem**
 > 1. Connect to a VPN (dns attached to primary interface)
> 2. Query DNS before restart `resolvectl query google.ca`
> 3. Restart systemd-resolved `sudo service systemd-resolved restart` 
> 4. Query DNS after restart `resolvectl query google.ca`

**Additional program output to the terminal or log subsystem illustrating the issue**

The DNS traffic appears to be going through enp11s0 immediately after systemd-d restart instead of vpn for a certain duration, resulting in very slow dns resolution (41.9953s).

test steps:
```
$ date && resolvectl query google.ca
Tue 15 Feb 2022 11:23:04 AM EST
google.ca: 172.217.13.99                       -- link: enp11s0
           2607:f8b0:4020:804::2003            -- link: enp11s0

-- Information acquired via protocol DNS in 73.8ms.
-- Data is authenticated: no; Data was acquired via local or encrypted transport: no
-- Data from: network
$ date && sudo service systemd-resolved restart
Tue 15 Feb 2022 11:23:14 AM EST
$ date && resolvectl query yahoo.ca
Tue 15 Feb 2022 11:23:26 AM EST
yahoo.ca: 74.6.136.150                         -- link: enp11s0
          212.82.100.150                       -- link: enp11s0
          98.136.103.23                        -- link: enp11s0

-- Information acquired via protocol DNS in 41.9953s.
-- Data is authenticated: no; Data was acquired via local or encrypted transport: no
-- Data from: network

```
resolvectl dns configuration
```
$ resolvectl dns
Global:
Link 2 (enp11s0): 192.168.10.33 192.168.10.37
Link 25 (vpn):
```
tcpdump log for enp11s0 interface during test (should not have any DNS traffic):
```
$ sudo tcpdump -i enp11s0 -nv port 53
11:23:26.950730 IP (tos 0x0, ttl 64, id 14783, offset 0, flags [none], proto UDP (17), length 65)
    192.168.2.147.57816 > 192.168.10.33.53: 65518+ [1au] A? yahoo.ca. (37)
11:23:26.950780 IP (tos 0x0, ttl 64, id 14784, offset 0, flags [none], proto UDP (17), length 65)
    192.168.2.147.33521 > 192.168.10.33.53: 32432+ [1au] AAAA? yahoo.ca. (37)
11:23:32.149181 IP (tos 0x0, ttl 64, id 8606, offset 0, flags [none], proto UDP (17), length 65)
    192.168.2.147.47513 > 192.168.10.37.53: 65518+ [1au] A? yahoo.ca. (37)
11:23:32.149384 IP (tos 0x0, ttl 64, id 8607, offset 0, flags [none], proto UDP (17), length 65)
    192.168.2.147.54630 > 192.168.10.37.53: 32432+ [1au] AAAA? yahoo.ca. (37)
11:23:37.399261 IP (tos 0x0, ttl 64, id 14977, offset 0, flags [none], proto UDP (17), length 65)
    192.168.2.147.41105 > 192.168.10.33.53: 65518+ [1au] A? yahoo.ca. (37)
11:23:37.399466 IP (tos 0x0, ttl 64, id 14978, offset 0, flags [none], proto UDP (17), length 65)
    192.168.2.147.57090 > 192.168.10.33.53: 32432+ [1au] AAAA? yahoo.ca. (37)
11:23:42.649210 IP (tos 0x0, ttl 64, id 8987, offset 0, flags [none], proto UDP (17), length 65)
    192.168.2.147.56749 > 192.168.10.37.53: 65518+ [1au] A? yahoo.ca. (37)
11:23:42.649412 IP (tos 0x0, ttl 64, id 8988, offset 0, flags [none], proto UDP (17), length 65)
    192.168.2.147.58966 > 192.168.10.37.53: 32432+ [1au] AAAA? yahoo.ca. (37)
11:23:47.899270 IP (tos 0x0, ttl 64, id 16902, offset 0, flags [none], proto UDP (17), length 54)
    192.168.2.147.59733 > 192.168.10.33.53: 65518+ A? yahoo.ca. (26)
11:23:47.899464 IP (tos 0x0, ttl 64, id 16903, offset 0, flags [none], proto UDP (17), length 54)
    192.168.2.147.33640 > 192.168.10.33.53: 32432+ AAAA? yahoo.ca. (26)
11:23:53.149243 IP (tos 0x0, ttl 64, id 10637, offset 0, flags [none], proto UDP (17), length 54)
    192.168.2.147.41282 > 192.168.10.37.53: 65518+ A? yahoo.ca. (26)
11:23:53.149434 IP (tos 0x0, ttl 64, id 10638, offset 0, flags [none], proto UDP (17), length 54)
    192.168.2.147.50225 > 192.168.10.37.53: 32432+ AAAA? yahoo.ca. (26)
11:23:58.399269 IP (tos 0x0, ttl 64, id 16993, offset 0, flags [none], proto UDP (17), length 54)
    192.168.2.147.41668 > 192.168.10.33.53: 65518+ A? yahoo.ca. (26)
11:23:58.399463 IP (tos 0x0, ttl 64, id 16994, offset 0, flags [none], proto UDP (17), length 54)
    192.168.2.147.51575 > 192.168.10.33.53: 32432+ AAAA? yahoo.ca. (26)
11:24:03.649176 IP (tos 0x0, ttl 64, id 11019, offset 0, flags [none], proto UDP (17), length 54)
    192.168.2.147.47936 > 192.168.10.37.53: 65518+ A? yahoo.ca. (26)
11:24:03.649299 IP (tos 0x0, ttl 64, id 11020, offset 0, flags [none], proto UDP (17), length 54)
    192.168.2.147.46782 > 192.168.10.37.53: 32432+ AAAA? yahoo.ca. (26)
```
tcpdump log for vpn interface during test:
```
$ sudo tcpdump -i vpn -nv port 53
11:22:44.481380 IP (tos 0x0, ttl 64, id 27430, offset 0, flags [DF], proto TCP (6), length 64)
    192.168.14.118.52344 > 192.168.10.37.53: Flags [S], cksum 0xe786 (correct), seq 3396731700, win 65280, options [mss 1360,sackOK,TS val 4267834414 ecr 0,nop,wscale 7,tfo  cookiereq,nop,nop], length 0
11:22:44.491786 IP (tos 0x0, ttl 64, id 57130, offset 0, flags [none], proto TCP (6), length 60)
    192.168.10.37.53 > 192.168.14.118.52344: Flags [S.], cksum 0x24c3 (correct), seq 3258673690, ack 3396731701, win 65535, options [mss 1460,sackOK,TS val 540125129 ecr 4267834414,nop,wscale 13], length 0
11:22:44.491822 IP (tos 0x0, ttl 64, id 27431, offset 0, flags [DF], proto TCP (6), length 52)
    192.168.14.118.52344 > 192.168.10.37.53: Flags [.], cksum 0x518c (correct), ack 1, win 510, options [nop,nop,TS val 4267834425 ecr 540125129], length 0
11:22:44.491922 IP (tos 0x0, ttl 64, id 27432, offset 0, flags [DF], proto TCP (6), length 101)
    192.168.14.118.52344 > 192.168.10.37.53: Flags [P.], cksum 0x188a (correct), seq 1:50, ack 1, win 510, options [nop,nop,TS val 4267834425 ecr 540125129], length 49 36844+ A? connectivity-check.ubuntu.com. (47)
11:22:44.502149 IP (tos 0x0, ttl 64, id 57131, offset 0, flags [none], proto TCP (6), length 52)
    192.168.10.37.53 > 192.168.14.118.52344: Flags [.], cksum 0x5342 (correct), ack 50, win 22, options [nop,nop,TS val 540125130 ecr 4267834425], length 0
11:22:44.510500 IP (tos 0x0, ttl 64, id 57132, offset 0, flags [none], proto TCP (6), length 133)
    192.168.10.37.53 > 192.168.14.118.52344: Flags [P.], cksum 0x6b9a (correct), seq 1:82, ack 50, win 22, options [nop,nop,TS val 540125131 ecr 4267834425], length 81 36844 2/0/0 connectivity-check.ubuntu.com. A 35.232.111.17, connectivity-check.ubuntu.com. A 35.224.170.84 (79)
11:22:44.510519 IP (tos 0x0, ttl 64, id 27433, offset 0, flags [DF], proto TCP (6), length 52)
    192.168.14.118.52344 > 192.168.10.37.53: Flags [.], cksum 0x50f5 (correct), ack 82, win 510, options [nop,nop,TS val 4267834444 ecr 540125131], length 0
11:22:50.496282 IP (tos 0x0, ttl 64, id 57133, offset 0, flags [none], proto TCP (6), length 52)
    192.168.10.37.53 > 192.168.14.118.52344: Flags [F.], cksum 0x5085 (correct), seq 82, ack 50, win 22, options [nop,nop,TS val 540125730 ecr 4267834444], length 0
11:22:50.496446 IP (tos 0x0, ttl 64, id 27434, offset 0, flags [DF], proto TCP (6), length 52)
    192.168.14.118.52344 > 192.168.10.37.53: Flags [F.], cksum 0x373a (correct), seq 50, ack 83, win 510, options [nop,nop,TS val 4267840430 ecr 540125730], length 0
11:22:50.506853 IP (tos 0x0, ttl 64, id 57134, offset 0, flags [none], proto TCP (6), length 52)
    192.168.10.37.53 > 192.168.14.118.52344: Flags [.], cksum 0x3921 (correct), ack 51, win 22, options [nop,nop,TS val 540125731 ecr 4267840430], length 0
11:22:54.481528 IP (tos 0x0, ttl 64, id 43077, offset 0, flags [DF], proto UDP (17), length 61)
    192.168.14.118.53485 > 192.168.10.33.53: 30644+ A? play.google.com. (33)
11:22:54.492098 IP (tos 0x0, ttl 64, id 57135, offset 0, flags [none], proto UDP (17), length 77)
    192.168.10.33.53 > 192.168.14.118.53485: 30644 1/0/0 play.google.com. A 172.217.13.110 (49)
11:23:04.400162 IP (tos 0x0, ttl 64, id 27964, offset 0, flags [DF], proto TCP (6), length 64)
    192.168.14.118.52348 > 192.168.10.37.53: Flags [S], cksum 0x0801 (correct), seq 44195003, win 65280, options [mss 1360,sackOK,TS val 4267854333 ecr 0,nop,wscale 7,tfo  cookiereq,nop,nop], length 0
11:23:04.411337 IP (tos 0x0, ttl 64, id 57136, offset 0, flags [none], proto TCP (6), length 60)
    192.168.10.37.53 > 192.168.14.118.52348: Flags [S.], cksum 0x92cc (correct), seq 1532197802, ack 44195004, win 65535, options [mss 1460,sackOK,TS val 540127122 ecr 4267854333,nop,wscale 13], length 0
11:23:04.411384 IP (tos 0x0, ttl 64, id 27965, offset 0, flags [DF], proto TCP (6), length 52)
    192.168.14.118.52348 > 192.168.10.37.53: Flags [.], cksum 0xbf95 (correct), ack 1, win 510, options [nop,nop,TS val 4267854344 ecr 540127122], length 0
11:23:04.411460 IP (tos 0x0, ttl 64, id 27966, offset 0, flags [DF], proto TCP (6), length 81)
    192.168.14.118.52348 > 192.168.10.37.53: Flags [P.], cksum 0x0eaa (correct), seq 1:30, ack 1, win 510, options [nop,nop,TS val 4267854345 ecr 540127122], length 29 2051+ A? google.ca. (27)
11:23:04.411500 IP (tos 0x0, ttl 64, id 27967, offset 0, flags [DF], proto TCP (6), length 81)
    192.168.14.118.52348 > 192.168.10.37.53: Flags [P.], cksum 0x80b9 (correct), seq 30:59, ack 1, win 510, options [nop,nop,TS val 4267854345 ecr 540127122], length 29 31446+ AAAA? google.ca. (27)
11:23:04.421691 IP (tos 0x0, ttl 64, id 57137, offset 0, flags [none], proto TCP (6), length 52)
    192.168.10.37.53 > 192.168.14.118.52348: Flags [.], cksum 0xc15e (correct), ack 30, win 22, options [nop,nop,TS val 540127123 ecr 4267854345], length 0
11:23:04.421735 IP (tos 0x0, ttl 64, id 57138, offset 0, flags [none], proto TCP (6), length 52)
    192.168.10.37.53 > 192.168.14.118.52348: Flags [.], cksum 0xc141 (correct), ack 59, win 22, options [nop,nop,TS val 540127123 ecr 4267854345], length 0
11:23:04.442484 IP (tos 0x0, ttl 64, id 57139, offset 0, flags [none], proto TCP (6), length 97)
    192.168.10.37.53 > 192.168.14.118.52348: Flags [P.], cksum 0x1438 (correct), seq 1:46, ack 59, win 22, options [nop,nop,TS val 540127125 ecr 4267854345], length 45 2051 1/0/0 google.ca. A 172.217.13.99 (43)
11:23:04.442520 IP (tos 0x0, ttl 64, id 27968, offset 0, flags [DF], proto TCP (6), length 52)
    192.168.14.118.52348 > 192.168.10.37.53: Flags [.], cksum 0xbf0b (correct), ack 46, win 510, options [nop,nop,TS val 4267854376 ecr 540127125], length 0
11:23:04.470558 IP (tos 0x0, ttl 64, id 57140, offset 0, flags [none], proto TCP (6), length 109)
    192.168.10.37.53 > 192.168.14.118.52348: Flags [P.], cksum 0xbc31 (correct), seq 46:103, ack 59, win 22, options [nop,nop,TS val 540127127 ecr 4267854376], length 57 31446 1/0/0 google.ca. AAAA 2607:f8b0:4020:804::2003 (55)
11:23:04.470594 IP (tos 0x0, ttl 64, id 27969, offset 0, flags [DF], proto TCP (6), length 52)
    192.168.14.118.52348 > 192.168.10.37.53: Flags [.], cksum 0xbeb4 (correct), ack 103, win 510, options [nop,nop,TS val 4267854404 ecr 540127127], length 0
11:23:10.420985 IP (tos 0x0, ttl 64, id 57141, offset 0, flags [none], proto TCP (6), length 52)
    192.168.10.37.53 > 192.168.14.118.52348: Flags [F.], cksum 0xbe47 (correct), seq 103, ack 59, win 22, options [nop,nop,TS val 540127723 ecr 4267854404], length 0
11:23:10.421124 IP (tos 0x0, ttl 64, id 27970, offset 0, flags [DF], proto TCP (6), length 52)
    192.168.14.118.52348 > 192.168.10.37.53: Flags [F.], cksum 0xa520 (correct), seq 59, ack 104, win 510, options [nop,nop,TS val 4267860354 ecr 540127723], length 0
11:23:10.431504 IP (tos 0x0, ttl 64, id 57142, offset 0, flags [none], proto TCP (6), length 52)
    192.168.10.37.53 > 192.168.14.118.52348: Flags [.], cksum 0xa707 (correct), ack 60, win 22, options [nop,nop,TS val 540127724 ecr 4267860354], length 0
11:23:10.977691 IP (tos 0x0, ttl 64, id 43442, offset 0, flags [DF], proto UDP (17), length 77)
    192.168.14.118.51626 > 192.168.10.33.53: 30192+ A? signaler-pa.clients6.google.com. (49)
11:23:10.988257 IP (tos 0x0, ttl 64, id 57143, offset 0, flags [none], proto UDP (17), length 93)
    192.168.10.33.53 > 192.168.14.118.51626: 30192 1/0/0 signaler-pa.clients6.google.com. A 172.217.13.106 (65)
11:23:51.486703 IP (tos 0x0, ttl 64, id 48815, offset 0, flags [DF], proto UDP (17), length 61)
    192.168.14.118.37195 > 192.168.10.33.53: 47715+ A? ssl.gstatic.com. (33)
11:23:51.497830 IP (tos 0x0, ttl 64, id 57145, offset 0, flags [none], proto UDP (17), length 77)
    192.168.10.33.53 > 192.168.14.118.37195: 47715 1/0/0 ssl.gstatic.com. A 172.217.13.131 (49)
11:24:08.899307 IP (tos 0x0, ttl 64, id 27586, offset 0, flags [DF], proto TCP (6), length 64)
    192.168.14.118.39330 > 192.168.10.33.53: Flags [S], cksum 0x0a67 (correct), seq 2177383169, win 65280, options [mss 1360,sackOK,TS val 902096295 ecr 0,nop,wscale 7,tfo  cookiereq,nop,nop], length 0
11:24:08.909754 IP (tos 0x0, ttl 64, id 57146, offset 0, flags [none], proto TCP (6), length 60)
    192.168.10.33.53 > 192.168.14.118.39330: Flags [S.], cksum 0x8bfe (correct), seq 1274706693, ack 2177383170, win 65535, options [mss 1460,sackOK,TS val 540133572 ecr 902096295,nop,wscale 13], length 0
11:24:08.909806 IP (tos 0x0, ttl 64, id 27587, offset 0, flags [DF], proto TCP (6), length 52)
    192.168.14.118.39330 > 192.168.10.33.53: Flags [.], cksum 0xb8c7 (correct), ack 1, win 510, options [nop,nop,TS val 902096306 ecr 540133572], length 0
11:24:08.909891 IP (tos 0x0, ttl 64, id 27588, offset 0, flags [DF], proto TCP (6), length 80)
    192.168.14.118.39330 > 192.168.10.33.53: Flags [P.], cksum 0x7de3 (correct), seq 1:29, ack 1, win 510, options [nop,nop,TS val 902096306 ecr 540133572], length 28 65518+ A? yahoo.ca. (26)
11:24:08.909938 IP (tos 0x0, ttl 64, id 27589, offset 0, flags [DF], proto TCP (6), length 80)
    192.168.14.118.39330 > 192.168.10.33.53: Flags [P.], cksum 0xfeea (correct), seq 29:57, ack 1, win 510, options [nop,nop,TS val 902096306 ecr 540133572], length 28 32432+ AAAA? yahoo.ca. (26)
11:24:08.920101 IP (tos 0x0, ttl 64, id 57147, offset 0, flags [none], proto TCP (6), length 52)
    192.168.10.33.53 > 192.168.14.118.39330: Flags [.], cksum 0xba92 (correct), ack 29, win 22, options [nop,nop,TS val 540133573 ecr 902096306], length 0
11:24:08.921074 IP (tos 0x0, ttl 64, id 57148, offset 0, flags [none], proto TCP (6), length 52)
    192.168.10.33.53 > 192.168.14.118.39330: Flags [.], cksum 0xba76 (correct), ack 57, win 22, options [nop,nop,TS val 540133573 ecr 902096306], length 0
11:24:08.927761 IP (tos 0x0, ttl 64, id 57149, offset 0, flags [none], proto TCP (6), length 128)
    192.168.10.33.53 > 192.168.14.118.39330: Flags [P.], cksum 0xabf9 (correct), seq 1:77, ack 57, win 22, options [nop,nop,TS val 540133574 ecr 902096306], length 76 65518 3/0/0 yahoo.ca. A 74.6.136.150, yahoo.ca. A 212.82.100.150, yahoo.ca. A 98.136.103.23 (74)
11:24:08.927794 IP (tos 0x0, ttl 64, id 27590, offset 0, flags [DF], proto TCP (6), length 52)
    192.168.14.118.39330 > 192.168.10.33.53: Flags [.], cksum 0xb82f (correct), ack 77, win 510, options [nop,nop,TS val 902096324 ecr 540133574], length 0
11:24:08.944093 IP (tos 0x0, ttl 64, id 57150, offset 0, flags [none], proto TCP (6), length 160)
    192.168.10.33.53 > 192.168.14.118.39330: Flags [P.], cksum 0x55ad (correct), seq 77:185, ack 57, win 22, options [nop,nop,TS val 540133575 ecr 902096324], length 108 32432 0/1/0 (106)
11:24:08.944129 IP (tos 0x0, ttl 64, id 27591, offset 0, flags [DF], proto TCP (6), length 52)
    192.168.14.118.39330 > 192.168.10.33.53: Flags [.], cksum 0xb7b2 (correct), ack 185, win 510, options [nop,nop,TS val 902096340 ecr 540133575], length 0
```
journal logs:
[journal.txt](https://github.com/systemd/systemd/files/8072844/journal.txt)

**Comment by elie-delorme** [comment]
Interestingly, if I manually configure dns servers directly on the vpn interface through resolvectl (instead of having them on the wired connection), I avoid this problem entirely.

For example:
```
$ resolvectl dns 25 192.168.10.33 192.168.10.37
$ date && resolvectl dns
Tue 15 Feb 2022 11:37:24 AM EST
Global:
Link 2 (enp11s0): 192.168.10.33 192.168.10.37
Link 25 (vpn): 192.168.10.33 192.168.10.37
$ date && resolvectl query google.ca
Tue 15 Feb 2022 11:36:33 AM EST
google.ca: 172.217.13.99                       -- link: enp11s0
           2607:f8b0:4020:804::2003            -- link: enp11s0

-- Information acquired via protocol DNS in 51.8ms.
-- Data is authenticated: no; Data was acquired via local or encrypted transport: no
-- Data from: network
$ date && sudo service systemd-resolved restart
Tue 15 Feb 2022 11:36:56 AM EST
$ date && resolvectl query yahoo.ca
Tue 15 Feb 2022 11:37:02 AM EST
yahoo.ca: 212.82.100.150                       -- link: vpn
          98.136.103.23                        -- link: vpn
          74.6.136.150                         -- link: vpn

-- Information acquired via protocol DNS in 19.9ms.
-- Data is authenticated: no; Data was acquired via local or encrypted transport: no
-- Data from: network
```

**Comment by elie-delorme** [comment]
Not sure if that's related, but network manager has the dns configured on both connections but resolvectl only shows it on enp11s0.
```
$ nmcli conn show vpn | grep IP4.DNS
IP4.DNS[1]:                             192.168.10.33
IP4.DNS[2]:                             192.168.10.37
$ nmcli conn show "Wired connection 1" | grep IP4.DNS
IP4.DNS[1]:                             192.168.10.33
IP4.DNS[2]:                             192.168.10.37
$ resolvectl dns
Global:
Link 2 (enp11s0): 192.168.10.33 192.168.10.37
Link 25 (vpn):
```
