### ISSUE TITLE
systemd-resolved using wrong interface to reach DNS servers

### ISSUE THREAD

**Issue by mboehm21** [systemd/systemd#23655]
**systemd version the issue has been seen with**

```
249.11-0ubuntu3.1
```


**Used distribution**

```
Ubuntu 22.04 LTS
```

**Linux kernel version used (uname -a)**

```
Linux dws-mboehm21 5.15.0-35-generic #36-Ubuntu SMP Sat May 21 02:24:07 UTC 2022 x86_64 x86_64 x86_64 GNU/Linux
```

**CPU architecture issue was seen on**

```
x86_64
```

**Expected behaviour you didn't see**

systemd-resolved _always_ uses the correct interface vpn0067314c67 to reach the DNS servers 10.1.131.22 and .32

```
[13:12:28] root :: dws-mboehm21  ➜  ~ » ip a
...
3: enx64c901b541d3: <BROADCAST,MULTICAST,UP,LOWER_UP> mtu 1500 qdisc fq_codel state UP group default qlen 1000
    link/ether 64:c9:01:b5:41:d3 brd ff:ff:ff:ff:ff:ff
    inet 192.168.121.74/24 brd 192.168.121.255 scope global dynamic noprefixroute enx64c901b541d3
...
7: vpn0067314c67: <POINTOPOINT,MULTICAST,NOARP,UP,LOWER_UP> mtu 1400 qdisc fq_codel state UNKNOWN group default qlen 500
    link/none 
    inet 10.1.244.10/32 scope global vpn0067314c67



[13:12:29] root :: dws-mboehm21  ➜  ~ » ip route
default via 192.168.121.254 dev enx64c901b541d3 proto dhcp metric 100 
10.0.0.0/8 via 10.1.244.10 dev vpn0067314c67 scope link 
...



[13:14:52] root :: dws-mboehm21  ➜  ~ » resolvectl status                                                                                                                                                                                                               127 ↵
Global
       Protocols: -LLMNR -mDNS -DNSOverTLS DNSSEC=no/unsupported
resolv.conf mode: stub

Link 2 (enp0s31f6)
Current Scopes: none
     Protocols: -DefaultRoute +LLMNR -mDNS -DNSOverTLS DNSSEC=no/unsupported

Link 3 (enx64c901b541d3)
    Current Scopes: DNS
         Protocols: +DefaultRoute +LLMNR -mDNS -DNSOverTLS DNSSEC=no/unsupported
Current DNS Server: 10.1.131.32
       DNS Servers: 10.1.131.22 10.1.131.32

Link 4 (wlp2s0)
Current Scopes: none
     Protocols: -DefaultRoute +LLMNR -mDNS -DNSOverTLS DNSSEC=no/unsupported

Link 7 (vpn0067314c67)
Current Scopes: none
     Protocols: -DefaultRoute +LLMNR -mDNS -DNSOverTLS DNSSEC=no/unsupported
```

**Unexpected behaviour you saw**

systemd-resolved sometimes uses the LAN interface enx64c901b541d3 to send the requests to DNS servers while the routing table points to the VPN.

**Steps to reproduce the problem**

Using `watch -n 1 "resolvectl flush-caches && ping -c1 amazon.com"` in one terminal and `tcpdump -ni any port 53` in another.

Correct:

```
13:20:08.274513 vpn0067314c67 Out IP 10.1.244.10.44932 > 10.1.131.22.53: Flags [P.], seq 1817:1847, ack 30188, win 502, options [nop,nop,TS val 3012555365 ecr 2731914043], length 30 31429+ A? amazon.com. (28)
13:20:08.274540 vpn0067314c67 Out IP 10.1.244.10.44932 > 10.1.131.22.53: Flags [P.], seq 1847:1877, ack 30188, win 502, options [nop,nop,TS val 3012555365 ecr 2731914043], length 30 35125+ AAAA? amazon.com. (28)
13:20:08.284271 vpn0067314c67 In  IP 10.1.131.22.53 > 10.1.244.10.44932: Flags [P.], seq 30188:31049, ack 1877, win 453, options [nop,nop,TS val 2731914304 ecr 3012555365], length 861 31429 3/13/26 A 54.239.28.85, A 176.32.103.205, A 205.251.242.103 (859)
```

Wrong:

```
13:20:09.614021 enx64c901b541d3 Out IP 192.168.121.74.37771 > 10.1.131.32.53: 20941+ A? amazon.com. (28)
13:20:09.614258 enx64c901b541d3 Out IP 192.168.121.74.51978 > 10.1.131.32.53: 20017+ AAAA? amazon.com. (28)
13:20:14.703972 enx64c901b541d3 Out IP 192.168.121.74.48478 > 10.1.131.22.53: 20941+ A? amazon.com. (28)
13:20:14.704172 enx64c901b541d3 Out IP 192.168.121.74.58327 > 10.1.131.22.53: 20017+ AAAA? amazon.com. (28)
```

Is this a problem regarding systemd, Ubuntu or the VPN client?

**Comment by diegomontoya** [comment]
Exact same issue as @mboehm21 except my system is Fedora Rawhide (37 alpha)

```
名称         : systemd-resolved
版本         : 251.2
发布         : 1.fc37
架构         : x86_64
```

Kernel: 5.19.0-0.rc3.20220624git92f20ff72066.30.fc37.x86_64

ip addr

```
1: lo: <LOOPBACK,UP,LOWER_UP> mtu 65536 qdisc noqueue state UNKNOWN group default qlen 1000
    link/loopback 00:00:00:00:00:00 brd 00:00:00:00:00:00
    inet 127.0.0.1/8 scope host lo
       valid_lft forever preferred_lft forever
    inet6 ::1/128 scope host 
       valid_lft forever preferred_lft forever
2: wlp1s0: <BROADCAST,MULTICAST,UP,LOWER_UP> mtu 1500 qdisc noqueue state UP group default qlen 1000
    link/ether f8:b5:4d:70:9f:9a brd ff:ff:ff:ff:ff:ff
    inet 192.168.31.252/24 brd 192.168.31.255 scope global dynamic noprefixroute wlp1s0
       valid_lft 43000sec preferred_lft 43000sec
5: zteb4pu4gr: <BROADCAST,MULTICAST,UP,LOWER_UP> mtu 2800 qdisc pfifo_fast state UNKNOWN group default qlen 1000
    link/ether fe:f2:ab:ee:4d:04 brd ff:ff:ff:ff:ff:ff
    inet 172.25.29.132/16 brd 172.25.255.255 scope global zteb4pu4gr
       valid_lft forever preferred_lft forever
    inet6 fe80::fcf2:abff:feee:4d04/64 scope link 
       valid_lft forever preferred_lft forever
```

ip route
```
0.0.0.0/1 via 172.25.204.155 dev zteb4pu4gr proto static metric 5000 
default via 192.168.31.1 dev wlp1s0 proto dhcp src 192.168.31.252 metric 600 
128.0.0.0/1 via 172.25.204.155 dev zteb4pu4gr proto static metric 5000 
172.25.0.0/16 dev zteb4pu4gr proto kernel scope link src 172.25.29.132 
192.168.31.0/24 dev wlp1s0 proto kernel scope link src 192.168.31.252 metric 600 
```

resolvectl
```
Global
       Protocols: LLMNR=resolve -mDNS -DNSOverTLS DNSSEC=no/unsupported
resolv.conf mode: uplink

Link 2 (wlp1s0)
    Current Scopes: DNS LLMNR/IPv4
         Protocols: +DefaultRoute +LLMNR -mDNS -DNSOverTLS DNSSEC=no/unsupported
Current DNS Server: 8.8.8.8
       DNS Servers: 8.8.8.8

Link 5 (zteb4pu4gr)
    Current Scopes: DNS LLMNR/IPv4 LLMNR/IPv6
         Protocols: -DefaultRoute +LLMNR -mDNS -DNSOverTLS DNSSEC=no/unsupported
Current DNS Server: 8.8.8.8
       DNS Servers: 8.8.8.8 8.8.4.4
        DNS Domain: ~29.25.172.in-addr.arpa ~home.arpa
```

**Steps to reproduce the problem**

Using watch -n 1 "resolvectl flush-caches && ping -c1 amazon.com" in one terminal and tcpdump -ni any port 53 in another.

Correct:
```
21:51:00.917096 zteb4pu4gr Out IP 192.168.31.252.34058 > 8.8.8.8.domain: 5746+ A? amazon.com. (28)
21:51:00.917380 zteb4pu4gr Out IP 192.168.31.252.56118 > 8.8.8.8.domain: 730+ AAAA? amazon.com. (28)
21:51:00.991532 zteb4pu4gr In  IP 8.8.8.8.domain > 192.168.31.252.34058: 5746 3/0/0 A 54.239.28.85, A 176.32.103.205, A 205.251.242.103 (76)

```
Observed:

```
21:51:00.917096 wlp1s0 Out IP 192.168.31.252.34058 > 8.8.8.8.domain: 5746+ A? amazon.com. (28)
21:51:00.917380 wlp1s0 Out IP 192.168.31.252.56118 > 8.8.8.8.domain: 730+ AAAA? amazon.com. (28)
21:51:00.991532 wlp1s0 In  IP 8.8.8.8.domain > 192.168.31.252.34058: 5746 3/0/0 A 54.239.28.85, A 176.32.103.205, A 205.251.242.103 (76)

```

**Comment by mboehm21** [comment]
I've updated Ubuntu 22.04 to the most recent packages (systemd `249.11-0ubuntu3.3`, Kernel `5.15.0-40-generic`) and can confirm that the DNS requests are still sent via the wrong interface occasionally:

```
12:12:06.839695 enx64c901b541d3 Out IP 192.168.121.74.58401 > 10.1.131.22.53: 50278+ [1au] A? connectivity-check.ubuntu.com. (58)
12:12:06.849235 enx64c901b541d3 Out IP 192.168.121.74.40021 > 10.1.131.32.53: 50278+ [1au] A? connectivity-check.ubuntu.com. (58)
12:12:06.860727 enx64c901b541d3 Out IP 192.168.121.74.44757 > 10.1.131.32.53: 59194+ [1au] A? connectivity-check.ubuntu.com. (58)
12:12:06.861045 enx64c901b541d3 Out IP 192.168.121.74.40679 > 10.1.131.32.53: 28569+ [1au] AAAA? connectivity-check.ubuntu.com. (58)
12:12:06.870467 enx64c901b541d3 Out IP 192.168.121.74.33454 > 10.1.131.22.53: 59194+ [1au] A? connectivity-check.ubuntu.com. (58)
12:12:06.871215 enx64c901b541d3 Out IP 192.168.121.74.58687 > 10.1.131.22.53: 28569+ [1au] AAAA? connectivity-check.ubuntu.com. (58)
12:12:06.881603 enx64c901b541d3 Out IP 192.168.121.74.59409 > 10.1.131.22.53: 35120+ A? connectivity-check.ubuntu.com. (47)
12:12:06.882025 enx64c901b541d3 Out IP 192.168.121.74.35934 > 10.1.131.22.53: 62705+ AAAA? connectivity-check.ubuntu.com. (47)
12:12:06.892082 enx64c901b541d3 Out IP 192.168.121.74.45232 > 10.1.131.32.53: 35120+ A? connectivity-check.ubuntu.com. (47)
12:12:06.892682 enx64c901b541d3 Out IP 192.168.121.74.59134 > 10.1.131.32.53: 62705+ AAAA? connectivity-check.ubuntu.com. (47)
12:12:07.229165 enx64c901b541d3 Out IP 192.168.121.74.59780 > 10.1.131.32.53: 7915+ A? amazon.com. (28)
12:12:07.229451 enx64c901b541d3 Out IP 192.168.121.74.51464 > 10.1.131.32.53: 17357+ AAAA? amazon.com. (28)
12:12:07.238869 enx64c901b541d3 Out IP 192.168.121.74.43605 > 10.1.131.22.53: 7915+ A? amazon.com. (28)
12:12:07.239041 enx64c901b541d3 Out IP 192.168.121.74.34746 > 10.1.131.22.53: 17357+ AAAA? amazon.com. (28)
12:12:07.839610 enx64c901b541d3 Out IP 192.168.121.74.56156 > 10.1.131.22.53: 51489+ A? connectivity-check.ubuntu.com. (47)
12:12:09.269616 enx64c901b541d3 Out IP 192.168.121.74.42295 > 10.1.131.22.53: 56921+ A? incoming.telemetry.mozilla.org. (48)
12:12:09.269724 enx64c901b541d3 Out IP 192.168.121.74.54894 > 10.1.131.22.53: 14212+ AAAA? incoming.telemetry.mozilla.org. (48)
12:12:10.085360 enx64c901b541d3 Out IP 192.168.121.74.33760 > 10.1.131.22.53: 42413+ A? detectportal.firefox.com. (42)
12:12:10.085801 enx64c901b541d3 Out IP 192.168.121.74.53884 > 10.1.131.22.53: 7943+ AAAA? detectportal.firefox.com. (42)
12:12:10.101014 enx64c901b541d3 Out IP 192.168.121.74.34519 > 10.1.131.22.53: 5548+ A? ipv4only.arpa. (31)
12:12:10.101485 enx64c901b541d3 Out IP 192.168.121.74.59072 > 10.1.131.22.53: 21709+ AAAA? ipv4only.arpa. (31)
```

**Comment by poettering** [comment]
I hid @diegomontoya's comment, since it's about quite a different configuration.

**Comment by poettering** [comment]
> Link 3 (enx64c901b541d3)
>     Current Scopes: DNS
>          Protocols: +DefaultRoute +LLMNR -mDNS -DNSOverTLS DNSSEC=no/unsupported
> Current DNS Server: 10.1.131.32
>        DNS Servers: 10.1.131.22 10.1.131.32

Your only DNS server is associated with this link. But you want to communicate with the DNS server over another interface? 

Associate the DNS server with the link you want it to use *and* set the routes to it.

**Comment by mboehm21** [comment]
The DNS configuration is done by the VPN client (forticlientvpn) while establishing the VPN by injecting DNS information it gets from the gateway.

There seem to be others who have the same issue with this setup: https://community.fortinet.com/t5/Fortinet-Forum/DNS-settings-on-Ubuntu-22-04-and-FortiClient-VPN-7-0-0-0018/m-p/209901

I also realized that systemd-resolved is restarting periodically while the VPN is established which is not the case when just ethernet or wifi is on but no VPN:

```
[07:30:39] root :: dws-mboehm21  ➜  ~ » journalctl -f -u systemd-resolved.service
Jul 05 07:30:01 dws-mboehm21 systemd-resolved[3517]: Using system hostname 'dws-mboehm21'.
Jul 05 07:30:01 dws-mboehm21 systemd[1]: Started Network Name Resolution.
Jul 05 07:30:01 dws-mboehm21 systemd-resolved[3517]: wlp2s0: Bus client set default route setting: yes
Jul 05 07:30:01 dws-mboehm21 systemd-resolved[3517]: wlp2s0: Bus client set DNS server list to: 10.1.131.22, 10.1.131.32
Jul 05 07:30:01 dws-mboehm21 systemd-resolved[3517]: vpn00a5a81825: Bus client set default route setting: no
Jul 05 07:30:01 dws-mboehm21 systemd-resolved[3517]: vpn00a5a81825: Bus client reset DNS server list.
Jul 05 07:30:07 dws-mboehm21 systemd-resolved[3517]: Using degraded feature set UDP instead of UDP+EDNS0 for DNS server 10.1.131.22.
Jul 05 07:30:07 dws-mboehm21 systemd-resolved[3517]: Using degraded feature set UDP instead of UDP+EDNS0 for DNS server 10.1.131.32.
Jul 05 07:30:16 dws-mboehm21 systemd-resolved[3517]: Using degraded feature set TCP instead of UDP for DNS server 10.1.131.22.
Jul 05 07:30:17 dws-mboehm21 systemd-resolved[3517]: Using degraded feature set TCP instead of UDP for DNS server 10.1.131.32.
Jul 05 07:32:01 dws-mboehm21 systemd[1]: Stopping Network Name Resolution...
Jul 05 07:32:01 dws-mboehm21 systemd[1]: systemd-resolved.service: Deactivated successfully.
Jul 05 07:32:01 dws-mboehm21 systemd[1]: Stopped Network Name Resolution.
Jul 05 07:32:01 dws-mboehm21 systemd[1]: Starting Network Name Resolution...
Jul 05 07:32:01 dws-mboehm21 systemd-resolved[3664]: Positive Trust Anchors:
Jul 05 07:32:01 dws-mboehm21 systemd-resolved[3664]: . IN DS 20326 8 2 e06d44b80b8f1d39a95c0b0d7c65d08458e880409bbc683457104237c7f8ec8d
Jul 05 07:32:01 dws-mboehm21 systemd-resolved[3664]: Negative trust anchors: home.arpa 10.in-addr.arpa 16.172.in-addr.arpa 17.172.in-addr.arpa 18.172.in-addr.arpa 19.172.in-addr.arpa 20.172.in-addr.arpa 21.172.in-addr.arpa 22.172.in-addr.arpa 23.172.in-addr.arpa 24.172.in-addr.arpa 25.172.in-addr.arpa 26.172.in-addr.arpa 27.172.in-addr.arpa 28.172.in-addr.arpa 29.172.in-addr.arpa 30.172.in-addr.arpa 31.172.in-addr.arpa 168.192.in-addr.arpa d.f.ip6.arpa corp home internal intranet lan local private test
Jul 05 07:32:01 dws-mboehm21 systemd-resolved[3664]: Using system hostname 'dws-mboehm21'.
Jul 05 07:32:01 dws-mboehm21 systemd[1]: Started Network Name Resolution.
Jul 05 07:32:28 dws-mboehm21 systemd-resolved[3664]: Using degraded feature set UDP instead of UDP+EDNS0 for DNS server 10.1.131.22.
Jul 05 07:32:28 dws-mboehm21 systemd-resolved[3664]: Using degraded feature set UDP instead of UDP+EDNS0 for DNS server 10.1.131.32.
Jul 05 07:32:28 dws-mboehm21 systemd-resolved[3664]: Using degraded feature set TCP instead of UDP for DNS server 10.1.131.22.
Jul 05 07:34:01 dws-mboehm21 systemd[1]: Stopping Network Name Resolution...
Jul 05 07:34:01 dws-mboehm21 systemd[1]: systemd-resolved.service: Deactivated successfully.
Jul 05 07:34:01 dws-mboehm21 systemd[1]: Stopped Network Name Resolution.
Jul 05 07:34:01 dws-mboehm21 systemd[1]: Starting Network Name Resolution...
Jul 05 07:34:01 dws-mboehm21 systemd-resolved[3705]: Positive Trust Anchors:
Jul 05 07:34:01 dws-mboehm21 systemd-resolved[3705]: . IN DS 20326 8 2 e06d44b80b8f1d39a95c0b0d7c65d08458e880409bbc683457104237c7f8ec8d
Jul 05 07:34:01 dws-mboehm21 systemd-resolved[3705]: Negative trust anchors: home.arpa 10.in-addr.arpa 16.172.in-addr.arpa 17.172.in-addr.arpa 18.172.in-addr.arpa 19.172.in-addr.arpa 20.172.in-addr.arpa 21.172.in-addr.arpa 22.172.in-addr.arpa 23.172.in-addr.arpa 24.172.in-addr.arpa 25.172.in-addr.arpa 26.172.in-addr.arpa 27.172.in-addr.arpa 28.172.in-addr.arpa 29.172.in-addr.arpa 30.172.in-addr.arpa 31.172.in-addr.arpa 168.192.in-addr.arpa d.f.ip6.arpa corp home internal intranet lan local private test
Jul 05 07:34:01 dws-mboehm21 systemd-resolved[3705]: Using system hostname 'dws-mboehm21'.
Jul 05 07:34:01 dws-mboehm21 systemd[1]: Started Network Name Resolution.
Jul 05 07:35:31 dws-mboehm21 systemd-resolved[3705]: Using degraded feature set UDP instead of UDP+EDNS0 for DNS server 10.1.131.22.
Jul 05 07:35:31 dws-mboehm21 systemd-resolved[3705]: Using degraded feature set UDP instead of UDP+EDNS0 for DNS server 10.1.131.32.
Jul 05 07:35:31 dws-mboehm21 systemd-resolved[3705]: Using degraded feature set TCP instead of UDP for DNS server 10.1.131.22.
Jul 05 07:36:01 dws-mboehm21 systemd[1]: Stopping Network Name Resolution...
Jul 05 07:36:01 dws-mboehm21 systemd[1]: systemd-resolved.service: Deactivated successfully.
Jul 05 07:36:01 dws-mboehm21 systemd[1]: Stopped Network Name Resolution.
Jul 05 07:36:01 dws-mboehm21 systemd[1]: Starting Network Name Resolution...
Jul 05 07:36:01 dws-mboehm21 systemd-resolved[6358]: Positive Trust Anchors:
Jul 05 07:36:01 dws-mboehm21 systemd-resolved[6358]: . IN DS 20326 8 2 e06d44b80b8f1d39a95c0b0d7c65d08458e880409bbc683457104237c7f8ec8d
Jul 05 07:36:01 dws-mboehm21 systemd-resolved[6358]: Negative trust anchors: home.arpa 10.in-addr.arpa 16.172.in-addr.arpa 17.172.in-addr.arpa 18.172.in-addr.arpa 19.172.in-addr.arpa 20.172.in-addr.arpa 21.172.in-addr.arpa 22.172.in-addr.arpa 23.172.in-addr.arpa 24.172.in-addr.arpa 25.172.in-addr.arpa 26.172.in-addr.arpa 27.172.in-addr.arpa 28.172.in-addr.arpa 29.172.in-addr.arpa 30.172.in-addr.arpa 31.172.in-addr.arpa 168.192.in-addr.arpa d.f.ip6.arpa corp home internal intranet lan local private test
Jul 05 07:36:01 dws-mboehm21 systemd-resolved[6358]: Using system hostname 'dws-mboehm21'.
Jul 05 07:36:01 dws-mboehm21 systemd[1]: Started Network Name Resolution.
Jul 05 07:37:07 dws-mboehm21 systemd-resolved[6358]: Using degraded feature set UDP instead of UDP+EDNS0 for DNS server 10.1.131.32.
Jul 05 07:37:12 dws-mboehm21 systemd-resolved[6358]: Using degraded feature set UDP instead of UDP+EDNS0 for DNS server 10.1.131.22.
Jul 05 07:37:17 dws-mboehm21 systemd-resolved[6358]: Using degraded feature set TCP instead of UDP for DNS server 10.1.131.32.
Jul 05 07:38:01 dws-mboehm21 systemd[1]: Stopping Network Name Resolution...
Jul 05 07:38:01 dws-mboehm21 systemd[1]: systemd-resolved.service: Deactivated successfully.
Jul 05 07:38:01 dws-mboehm21 systemd[1]: Stopped Network Name Resolution.
Jul 05 07:38:01 dws-mboehm21 systemd[1]: Starting Network Name Resolution...
Jul 05 07:38:01 dws-mboehm21 systemd-resolved[6596]: Positive Trust Anchors:
Jul 05 07:38:01 dws-mboehm21 systemd-resolved[6596]: . IN DS 20326 8 2 e06d44b80b8f1d39a95c0b0d7c65d08458e880409bbc683457104237c7f8ec8d
Jul 05 07:38:01 dws-mboehm21 systemd-resolved[6596]: Negative trust anchors: home.arpa 10.in-addr.arpa 16.172.in-addr.arpa 17.172.in-addr.arpa 18.172.in-addr.arpa 19.172.in-addr.arpa 20.172.in-addr.arpa 21.172.in-addr.arpa 22.172.in-addr.arpa 23.172.in-addr.arpa 24.172.in-addr.arpa 25.172.in-addr.arpa 26.172.in-addr.arpa 27.172.in-addr.arpa 28.172.in-addr.arpa 29.172.in-addr.arpa 30.172.in-addr.arpa 31.172.in-addr.arpa 168.192.in-addr.arpa d.f.ip6.arpa corp home internal intranet lan local private test
Jul 05 07:38:01 dws-mboehm21 systemd-resolved[6596]: Using system hostname 'dws-mboehm21'.
Jul 05 07:38:01 dws-mboehm21 systemd[1]: Started Network Name Resolution.
```
I changed settings manually using:

```
[07:42:09] root :: dws-mboehm21  ➜  ~ » resolvectl default-route wlp2s0 no && resolvectl default-route vpn00a5a81825 yes && resolvectl dns wlp2s0 "" && resolvectl dns vpn00a5a81825 10.1.131.22 10.1.131.32
```
Then it works until systemd-resolved is restarted again as the configuration is reverted back than. Which hint can I give the developers of forticlientvpn to work properly with systemd-resolved?

**Comment by mboehm21** [comment]
Some lazy workaround to set the correct DNS config manually until this is fixed:

```
#/etc/systemd/system/systemd-resolved.service.d/workaround.conf 

[Service]
ExecStartPost=+/usr/local/bin/workaround_vpn_dns.sh
```

```
#/usr/local/bin/workaround_vpn_dns.sh

#!/bin/bash

# Check whether or not the VPN is active
if [ -z "$(ip a | grep vpn)" ]; then
  echo "VPN is not connected."
  exit 0
fi

# Get local network interface name
NET_IF=$(ip route get 9.9.9.9 | grep dev | awk '{print $5}')
echo "Local interface is ${NET_IF}."

# Wait until route is installed and get VPN interface name
while true; do
  VPN_IF=$(ip route get 10.1.131.1 | grep dev | awk '{print $3}')
  echo "${VPN_IF}"
  if [[ ${VPN_IF} =~ "vpn" ]]; then
    break
  fi
  sleep 0.5
done

echo "VPN interface is ${VPN_IF}."

# Reset systemd-resolved for local interface
resolvectl revert ${NET_IF}

# Configure systemd-resolved for VPN interface
resolvectl default-route ${VPN_IF} yes
resolvectl dns ${VPN_IF} 10.1.131.22 10.1.131.32

echo "DNS has been fixed."

exit 0
```

**Comment by diegomontoya** [comment]
> I hid @diegomontoya's comment, since it's about quite a different configuration.

@poettering Should I file a different bug report or is my config unrelated to an actual bug but working as intended?

My issue appears to be resolved not adhering to ip routing table when access 8.8.8.8 for dns if both wifi and another virtual/vpn interface both advertise 8.8.8.8 as dns source.  It will use wifi interface even when ip routing table has the vpn interface as a more specific route. Thanks.

**Comment by diegomontoya** [comment]
@mboehm21 To simpliy your work-around, you don't need to touch the resolvectl config for the non-vpn interfaces. Just set the wildcard domain for the vpn and queries will run through vpn interface even if they both have same dns set. Tested on my Fedora Rawhide.

```
# Configure systemd-resolved for VPN interface
resolvectl domain ${VPN_IF} '~.'  <--- add this
resolvectl default-route ${VPN_IF} yes
resolvectl dns ${VPN_IF} 10.1.131.22 10.1.131.32
```

**Comment by renegrob** [comment]
@diegomontoya I had to do a `resolvectl revert ${NET_IF}`first, else the commands seemed to be ignored.

**Comment by andy108369** [comment]
FWIW, there is a similar (probably same) issue, here are some highlights:

https://github.com/systemd/systemd/issues/6076#issuecomment-433367514
https://github.com/systemd/systemd/issues/6076#issuecomment-451139752
https://github.com/systemd/systemd/issues/6076#issuecomment-729515097
https://github.com/systemd/systemd/issues/6076#issuecomment-1383188699

**Comment by poettering** [comment]
Anyway, this is a local problem. There's no indication resolved was doing anything wrong based on the given configuration. We tell the kernel via IP_UNICAST_IF to send out UDP requested via the interface a DNS server is attached to. In your case that's the unencrypted interface. Assign it to the encrypted one and it should just work.

This i hence really a local config issue.
