### ISSUE TITLE
systemd-networkd removes kernel-created mcast route when reconfiguring

### ISSUE THREAD

**Issue by Tragetaschen** [systemd/systemd#6088]
### Submission type

 - Bug report

### systemd version the issue has been seen with
```
systemd 232
-PAM -AUDIT -SELINUX +IMA -APPARMOR +SMACK +SYSVINIT +UTMP -LIBCRYPTSETUP -GCRYPT -GNUTLS +ACL +XZ -LZ4 -SECCOMP +BLKID -ELFUTILS +KMOD -IDN
```

### Used distribution
Yocto Linux 2.3 "Pyro"

### In case of bug report: Expected behaviour you didn't see

I have an embedded instrument (kernel 4.9) with an USB OTG port that's configured with the gadget driver to provide RNDIS amongst other things. When I boot my instrument and connect the USB for the first time (doesn't matter if it's connected already during boot) everything works fine and the instrument resolves its own name via LLMNR for my Windows PC. I'd like this to also work when I disconnect and reconnect the USB.

### In case of bug report: Unexpected behaviour you saw

Once I disconnect and reconnect the USB, LLMNR resolution doesn't work anymore.

### In case of bug report: Steps to reproduce the problem

Here's the log from systemd-resolved with `SYSTEMD_LOG_LEVEL=debug` when connecting:
```
Jun 06 09:18:40 f500sx kernel: configfs-gadget gadget: high-speed config #1: c
Jun 06 09:18:40 f500sx systemd-networkd[270]: usb0: Gained carrier
Jun 06 09:18:40 f500sx kernel: IPv6: ADDRCONF(NETDEV_CHANGE): usb0: link becomes ready
Jun 06 09:18:42 f500sx systemd-networkd[270]: usb0: Gained IPv6LL
Jun 06 09:18:42 f500sx systemd-timesyncd[206]: Network configuration changed, trying to establish connection.
Jun 06 09:18:42 f500sx systemd-resolved[291]: New scope on link usb0, protocol llmnr, family AF_INET6
Jun 06 09:18:42 f500sx systemd-resolved[291]: Transaction 64896 for <f500sx IN ANY> scope llmnr on usb0/INET6.
Jun 06 09:18:42 f500sx systemd-resolved[291]: Delaying llmnr transaction for 31370us.
Jun 06 09:18:42 f500sx systemd-resolved[291]: Timeout reached on transaction 64896.
Jun 06 09:18:42 f500sx systemd-resolved[291]: Retrying transaction 64896.
Jun 06 09:18:42 f500sx systemd-resolved[291]: Transaction 64896 for <f500sx IN ANY> scope llmnr on usb0/INET6.
Jun 06 09:18:42 f500sx systemd-resolved[291]: Sending query packet with id 64896 on interface 4/AF_INET6.
Jun 06 09:18:42 f500sx systemd-resolved[291]: Got LLMNR UDP query packet for id 64896
Jun 06 09:18:42 f500sx systemd-resolved[291]: Sending response packet with id 64896 on interface 4/AF_INET6.
Jun 06 09:18:42 f500sx systemd-resolved[291]: Got LLMNR UDP reply packet for id 64896
Jun 06 09:18:42 f500sx systemd-resolved[291]: Processing incoming packet on transaction 64896.
Jun 06 09:18:42 f500sx systemd-resolved[291]: Timeout reached on transaction 64896.
Jun 06 09:18:42 f500sx systemd-resolved[291]: Retrying transaction 64896.
Jun 06 09:18:42 f500sx systemd-resolved[291]: Transaction 64896 for <f500sx IN ANY> scope llmnr on usb0/INET6.
Jun 06 09:18:42 f500sx systemd-resolved[291]: Sending query packet with id 64896 on interface 4/AF_INET6.
Jun 06 09:18:42 f500sx systemd-resolved[291]: Got LLMNR UDP query packet for id 64896
Jun 06 09:18:42 f500sx systemd-resolved[291]: Sending response packet with id 64896 on interface 4/AF_INET6.
Jun 06 09:18:42 f500sx systemd-resolved[291]: Got LLMNR UDP reply packet for id 64896
Jun 06 09:18:42 f500sx systemd-resolved[291]: Processing incoming packet on transaction 64896.
Jun 06 09:18:42 f500sx systemd-resolved[291]: Timeout reached on transaction 64896.
Jun 06 09:18:42 f500sx systemd-resolved[291]: Retrying transaction 64896.
Jun 06 09:18:42 f500sx systemd-resolved[291]: Transaction 64896 for <f500sx IN ANY> scope llmnr on usb0/INET6.
Jun 06 09:18:42 f500sx systemd-resolved[291]: Sending query packet with id 64896 on interface 4/AF_INET6.
Jun 06 09:18:42 f500sx systemd-resolved[291]: Got LLMNR UDP query packet for id 64896
Jun 06 09:18:42 f500sx systemd-resolved[291]: Sending response packet with id 64896 on interface 4/AF_INET6.
Jun 06 09:18:42 f500sx systemd-resolved[291]: Got LLMNR UDP reply packet for id 64896
Jun 06 09:18:42 f500sx systemd-resolved[291]: Processing incoming packet on transaction 64896.
Jun 06 09:18:43 f500sx systemd-resolved[291]: Timeout reached on transaction 64896.
Jun 06 09:18:43 f500sx systemd-resolved[291]: Retrying transaction 64896.
Jun 06 09:18:43 f500sx systemd-resolved[291]: Transaction 64896 for <f500sx IN ANY> on scope llmnr on usb0/INET6 now complete with <attempts-max-reached> from none (unsigned).
Jun 06 09:18:43 f500sx systemd-resolved[291]: Record f500sx IN AAAA fe80::20d2:41ff:fe02:7f4a successfully probed.
Jun 06 09:18:43 f500sx systemd-resolved[291]: Freeing transaction 64896.
Jun 06 09:18:50 f500sx systemd-resolved[291]: Got LLMNR UDP query packet for id 10886
Jun 06 09:18:51 f500sx systemd-resolved[291]: Got LLMNR UDP query packet for id 10886
Jun 06 09:18:54 f500sx systemd-networkd[270]: usb0: Configured
Jun 06 09:18:54 f500sx systemd-timesyncd[206]: Network configuration changed, trying to establish connection.
```
This is the log from a request from my Windows PC:
```
Jun 06 09:19:05 f500sx systemd-resolved[291]: Got LLMNR UDP query packet for id 3518
Jun 06 09:19:05 f500sx systemd-resolved[291]: Sending response packet with id 3518 on interface 4/AF_INET6.
Jun 06 09:19:05 f500sx systemd-resolved[291]: Got LLMNR UDP query packet for id 37010
Jun 06 09:19:05 f500sx systemd-resolved[291]: Sending response packet with id 37010 on interface 4/AF_INET6.
```
This is the log from reconnecting the USB
```
Jun 06 09:19:12 f500sx systemd-resolved[291]: Removing scope on link usb0, protocol llmnr, family AF_INET6
Jun 06 09:19:12 f500sx systemd-networkd[270]: usb0: Lost carrier
Jun 06 09:19:19 f500sx kernel: configfs-gadget gadget: high-speed config #1: c
Jun 06 09:19:19 f500sx systemd-networkd[270]: usb0: Gained carrier
Jun 06 09:19:19 f500sx systemd-networkd[270]: usb0: Configured
Jun 06 09:19:19 f500sx systemd-timesyncd[206]: Network configuration changed, trying to establish connection.
Jun 06 09:19:19 f500sx systemd-resolved[291]: New scope on link usb0, protocol llmnr, family AF_INET6
Jun 06 09:19:19 f500sx systemd-resolved[291]: Transaction 31827 for <f500sx IN ANY> scope llmnr on usb0/INET6.
Jun 06 09:19:19 f500sx systemd-resolved[291]: Delaying llmnr transaction for 56962us.
Jun 06 09:19:19 f500sx systemd-resolved[291]: Timeout reached on transaction 31827.
Jun 06 09:19:19 f500sx systemd-resolved[291]: Retrying transaction 31827.
Jun 06 09:19:19 f500sx systemd-resolved[291]: Transaction 31827 for <f500sx IN ANY> scope llmnr on usb0/INET6.
Jun 06 09:19:19 f500sx systemd-resolved[291]: Sending query packet with id 31827 on interface 4/AF_INET6.
Jun 06 09:19:19 f500sx systemd-resolved[291]: Transaction 31827 for <f500sx IN ANY> on scope llmnr on usb0/INET6 now complete with <not-found> from none (unsigned).
Jun 06 09:19:19 f500sx systemd-resolved[291]: Record f500sx IN AAAA fe80::20d2:41ff:fe02:7f4a successfully probed.
Jun 06 09:19:19 f500sx systemd-resolved[291]: Freeing transaction 31827.
```
This is the log for a LLMNR request after reconnecting the USB
```
```
(yes, empty)

The same setup used to work with 230 (Yocto 2.2)

**Comment by yuwata** [comment]
~~It may be fixed by 2c7ef56459bf6fe7761595585aa4eed5cd183f27.~~

**Comment by poettering** [comment]
@Tragetaschen any chance you can use wireshark on the iface and see what the actual llmnr traffic is seen on the device when you reconnect? the logs actually suggest all works correctly, and resolved correctly notices the changed carrier, and reprobes its own hostname looking for conflicts and finding none.

(This might be a driver issue btw, i.e. that the mcast group memberships are not passed on correctly to the hw)

**Comment by Tragetaschen** [comment]
I have just applied 007ef0a224e01d9c6e3499da2bba14a2988a8a9d from #5531 against 232. The other three commits work with mDNS and that responder was only introduced in 233. I cannot see a difference in the behavior: After reconnecting the USB, there is still no LLMNR query message in the journal. Also, none of the new `log_error_errno` messages in `resolved-llmnr.c` from the above commit appear in the log.

I'll check if I can convince Yocto to compile / use 233.

**Comment by Tragetaschen** [comment]
@poettering As mentioned, the same kernel / driver worked well with 230.
With Wireshark on Windows and tcpdump on my device, I can see the LLMNR packets (8 packets in total) leaving Windows and see them entering Linux, but there is no response sent after reconnecting.

Here are the logs from `tcpdump -i usb0 port hostmon`:
Connecting USB for the first time:
```
13:41:46.464089 IP6 fe80::6509:7a09:1522:ba69.50325 > ff02::1:3.hostmon: UDP, length 33
13:41:46.862291 IP6 f500sx.local.hostmon > ff02::1:3.hostmon: UDP, length 24
13:41:46.875093 IP6 fe80::6509:7a09:1522:ba69.50325 > ff02::1:3.hostmon: UDP, length 33
13:41:47.158243 IP6 f500sx.local.hostmon > ff02::1:3.hostmon: UDP, length 24
13:41:47.408040 IP6 f500sx.local.hostmon > ff02::1:3.hostmon: UDP, length 24
13:41:54.966551 IP6 fe80::6509:7a09:1522:ba69.59910 > ff02::1:3.hostmon: UDP, length 33
13:41:54.966706 IP 169.254.186.105.59910 > 224.0.0.252.hostmon: UDP, length 33
```

Querying:
```
13:42:27.993980 IP6 fe80::6509:7a09:1522:ba69.49275 > ff02::1:3.hostmon: UDP, length 24
13:42:27.994089 IP 169.254.186.105.49275 > 224.0.0.252.hostmon: UDP, length 24
13:42:27.994627 IP6 fe80::6509:7a09:1522:ba69.49881 > ff02::1:3.hostmon: UDP, length 24
13:42:27.994738 IP 169.254.186.105.49881 > 224.0.0.252.hostmon: UDP, length 24
13:42:27.999004 IP6 f500sx.local.hostmon > fe80::6509:7a09:1522:ba69.49275: UDP, length 65
13:42:27.999979 IP6 f500sx.local.hostmon > fe80::6509:7a09:1522:ba69.49881: UDP, length 52
```

Connecting USB for the second time:
```
```
(empty). Shouldn't there be something here? Like again making sure the hostname isn't already taken?

Querying then:
```
13:44:20.690344 IP6 fe80::6509:7a09:1522:ba69.59231 > ff02::1:3.hostmon: UDP, length 24
13:44:20.690551 IP 169.254.186.105.59231 > 224.0.0.252.hostmon: UDP, length 24
13:44:20.691014 IP6 fe80::6509:7a09:1522:ba69.57340 > ff02::1:3.hostmon: UDP, length 24
13:44:20.691131 IP 169.254.186.105.57340 > 224.0.0.252.hostmon: UDP, length 24
13:44:21.103195 IP6 fe80::6509:7a09:1522:ba69.57340 > ff02::1:3.hostmon: UDP, length 24
13:44:21.103503 IP 169.254.186.105.57340 > 224.0.0.252.hostmon: UDP, length 24
13:44:21.103806 IP6 fe80::6509:7a09:1522:ba69.59231 > ff02::1:3.hostmon: UDP, length 24
13:44:21.104179 IP 169.254.186.105.59231 > 224.0.0.252.hostmon: UDP, length 24
```

**Comment by Tragetaschen** [comment]
When I restart systemd-resolved after reconnecting USB, things remain broken.
When I `ifconfig usb0 down` and `up` the network interface, LLMNR starts responding again.

**Comment by Tragetaschen** [comment]
v233 shows the same behavior

**Comment by Tragetaschen** [comment]
LLMNR works in v231 after reconnecting USB, so something broke between 231 and 232. I'll try to bisect...

**Comment by Tragetaschen** [comment]
3104883ddc2452ae210de3c70576c03023250a51 is the culprit @ssahani

**Comment by Tragetaschen** [comment]
That code removes the multicast address from the IPv6 routing table:
Before:
```
root@f500sx:~# route -6
Kernel IPv6 routing table
Destination                    Next Hop                   Flag Met Ref Use If
::1/128                        ::                         Un   0   1     0 lo
fe80::20d2:41ff:fe02:7f4a/128  ::                         Un   0   2     3 lo
fe80::/64                      ::                         U    256 0     0 usb0
ff00::/8                       ::                         U    256 1    23 usb0
::/0                           ::                         !n   -1  1    45 lo
```
After reconnecting USB:
```
root@f500sx:~# route -6
Kernel IPv6 routing table
Destination                    Next Hop                   Flag Met Ref Use If
::1/128                        ::                         Un   0   1     0 lo
fe80::20d2:41ff:fe02:7f4a/128  ::                         Un   0   2     3 lo
fe80::/64                      ::                         U    256 0     0 usb0
::/0                           ::                         !n   -1  1    57 lo
```

**Comment by poettering** [comment]
ah, thanks a ton for tracking this down... Humpf, question is how to fix this best now... i am tempted to say we should always implicitly add the mcast route back on interfaces when the carrier returns.

@ssahani something for you?

**Comment by ssahani** [comment]
Looking into .

**Comment by ssahani** [comment]
@Tragetaschen How these multicast routes got added ?

**Comment by Tragetaschen** [comment]
I didn't do anything by myself. I just booted my Linux image without any of my code being active.
Maybe by systemd-resolved?

**Comment by ssahani** [comment]
No  systemd-resolved does not do that . Because if not configured by anyone how it got set ?

**Comment by poettering** [comment]
hmm, i have no such route locally, @Tragetaschen any idea where that route comes from precisely?

**Comment by Tragetaschen** [comment]
I have disabled systemd-networkd, systemd-resolved and any of my code. After rebooting, I'm configuring the gadget driver [like that](https://github.com/ev3dev/ev3-systemd/blob/ev3dev-jessie/scripts/ev3-usb.sh) and end up with the two network interfaces `usb0` and `usb1`.

Now, there are two things necessary before that route shows up. The order doesn't matter:
* `ifconfig usb0 up`
* Attaching a USB cable

**Comment by Tragetaschen** [comment]
The same behavior occurs when I use a USB-Ethernet-Adapter on the USB OTG port, so it's not USB gadget / RNDIS specific:

When I `ifconfig eth0 up` and attach at network cable, I have that multicast route in the list.
```
::1/128                        ::                         Un   0   1     0 lo
2003:***/128                   ::                         Un   0   1     0 lo
2003:***/64                    ::                         UAe  256 0     0 eth0
fe80::*:*ff:fe*:*/128          ::                         Un   0   1     0 lo
fe80::/64                      ::                         U    256 0     0 eth0
ff00::/8                       ::                         U    256 1    18 eth0
::/0                           fe80::*:*ff:fe*:*        UGDAe 1024 0     0 eth0
::/0                           ::                         !n   -1  1     1 lo
```

**Comment by Tragetaschen** [comment]
Also, I have reduced the number of running services on my box to a bare minimum:
```
# pstree
systemd-+-atd
        |-crond
        |-dbus-daemon
        |-2*[klogd]
        |-sh---pstree
        |-2*[syslogd]
        |-systemd-journal
        |-systemd-logind
        `-systemd-udevd
```

**Comment by Tragetaschen** [comment]
My Ubuntu 16.04 box also has that route on its Ethernet interface, as do newly created Ubuntu 16.04 and SLES 12 SP2 virtual machines in Microsoft Azure. @poettering @ssahani are you sure you don't see this when you call `route -6` / `route -A inet6`?

**Comment by poettering** [comment]
Ah, indeed, I actually do see it, and yeah, networkd should really not have removed that route:

```
$ ip -6 route 
fd00::/64 via fe80::3a10:d5ff:fe78:6bbe dev wlp4s0 proto ra metric 600  pref medium
fe80::/64 dev wlp4s0 proto kernel metric 256  pref medium
```

The "proto kernel" should really be reason enough for networkd to leave the route around. @ssahani can you look into that?

**Comment by ssahani** [comment]
@poettering  This could be happening as the protocol is RTPROT_RA.

```
define RTPROT_RA       9       /* RDISC/ND router advertisements *
```

 It seems to me that this interface is not configured via networkd. So when link is coming up we are not processing the RA.  After the link up we should again process the RA `link_carrier_gained`

@Tragetaschen could you paste the conf of the interface please.

**Comment by Tragetaschen** [comment]
```
[Match]
Name=usb0

[Network]
DHCP=no
```

I'm using  an IPv6-link-local-only connection to Windows

**Comment by ssahani** [comment]
Apparently networkd is only used to up the interface nothing more.

Also @Tragetaschen Is this set by the kernel ? if so we actually don't touch anything set by the kernel.

ip -6 route
~~~ 
2401:4900:1880:b539::/64 dev eth0 proto kernel metric 202 mtu 1500 pref medium
2401:4900:1880:b539::/64 dev eth1 proto kernel metric 203 mtu 1500 pref medium
fe80::/64 dev eth0 proto kernel metric 256 pref medium
fe80::/64 dev eth1 proto kernel metric 256 pref medium
default via fe80::aecf:85ff:fe4e:dcd4 dev eth0 metric 202 mtu 1500 pref medium
default via fe80::aecf:85ff:fe4e:dcd4 dev eth1 metric 203 mtu 1500 pref medium
~~~
I don;t have those routes you specified.   My guess is when the link is down those routes are gone but when it comes up it should set(configure) those routes too.

**Comment by Tragetaschen** [comment]
Right now, I'm really confused about the command's various outputs, what they omit and when.

On my local Ubuntu 16.04 box, I can run both `ip -6 route` and `route -6`. The former outputs exactly what you are showing:
```
$ ip -6 route
2003:c5:13c3:b800::/64 dev enp2s0  proto kernel  metric 256  expires 7061sec pref medium
fe80::/64 dev enp2s0  proto kernel  metric 256  mtu 1492 pref medium
default via fe80::ca0e:14ff:fe19:aa20 dev enp2s0  proto ra  metric 1024  expires 1661sec hoplimit 255 pref medium
```
The latter on the other hand also includes the `ff00::/8` entry:
```
$ route -6
Kernel IPv6 routing table
Destination                    Next Hop                   Flag Met Ref Use If
2003:c5:13c3:b800::/64         ::                         UAe  256 1    69 enp2s0
fe80::/64                      ::                         U    256 1    14 enp2s0
::/0                           fe80::ca0e:14ff:fe19:aa20  UGDAe 1024 2    16 enp2s0
::/0                           ::                         !n   -1  1 24929 lo
::1/128                        ::                         Un   0   8    95 lo
2003:c5:13c3:b800:dacb:8aff:fe11:1ff8/128 ::                         Un   0   2    76 lo
fe80::dacb:8aff:fe11:1ff8/128  ::                         Un   0   3 14711 lo
ff00::/8                       ::                         U    256 5203858 enp2s0
::/0                           ::                         !n   -1  1 24929 lo
```

On my Yocto instrument on the other hand, the `ip -6 route` command also outputs the multicast route:
```
# ip -6 route
fe80::/64 dev usb0  proto kernel  metric 256  pref medium
ff00::/8 dev usb0  metric 256  pref medium
```

**Comment by ssahani** [comment]
right if we see https://github.com/systemd/systemd/blob/master/src/network/networkd-link.c#L2478 then it's pretty clear that networkd wont touch `proto kernel`.

**Comment by poettering** [comment]
never use "route -6", it's obsolete and often misleading or wrong. Only use "ip -6 route".

**Comment by poettering** [comment]
I just moved this to v235, since I don't think this should delay the release longer, since we apparently have no clue what's actually going on...

**Comment by Tragetaschen** [comment]
`ip -6 route ls table all` shows the multicast route on my Ubuntu 16.04 box. Also, the output is consistent with my Yocto instrument. Ubuntu uses iproute2 v4.3.0 while my Yocto embedded distribution already has v4.10.0

**Comment by Tragetaschen** [comment]
The kernel sets the multicast route:
https://git.kernel.org/pub/scm/linux/kernel/git/torvalds/linux.git/tree/net/ipv6/addrconf.c?h=v4.12#n2325

**Comment by smurfix** [comment]
Umm, this problem just bit me too. Could you try fixing it in v238 please?

**Comment by Tragetaschen** [comment]
Is the ever going to be fixed?
I've ported reverting 3104883ddc2452ae210de3c70576c03023250a51 through the last couple of Yocto releases and now run v241 without this commit on kernel 4.19. The `ff00::/8` route is created by the kernel without `proto kernel` and is then happily removed by networkd.

**Comment by ssahani** [comment]
What proto it uses then?

**Comment by Tragetaschen** [comment]
Before de/attaching the USB cable:
```
# ip -6 route ls table all
local ::1 dev lo proto kernel metric 0 pref medium
::1 dev lo proto kernel metric 256 pref medium
local fe80::20d2:41ff:fe04:2702 dev usb1 proto kernel metric 0 pref medium
fe80::/64 dev usb1 proto kernel metric 256 pref medium
ff00::/8 dev usb1 metric 256 pref medium
```
and after
```
# ip -6 route ls table all
local ::1 dev lo proto kernel metric 0 pref medium
::1 dev lo proto kernel metric 256 pref medium
local fe80::20d2:41ff:fe04:2702 dev usb1 proto kernel metric 0 pref medium
fe80::/64 dev usb1 proto kernel metric 256 pref medium
```

**Comment by ssahani** [comment]
> ff00::/8 dev usb1 metric 256 pref medium

How you can confirm that kernel is doing it ? And what part of the kernel is doing this? I would post a patch to kernel for the same .

For workaround I would just add that address to networkd's conf.

**Comment by Tragetaschen** [comment]
@ssahani

Huh? See the link in the above https://github.com/systemd/systemd/issues/6088#issuecomment-317369353

**Comment by ssahani** [comment]
That does not make any sense you are pointing to to a generic add

**Comment by Tragetaschen** [comment]
Well, I'm sorry for not being the expert here. There's a route entry that gets deleted by networkd, there's kernel code that's creating the entry (somehow) and there's broken functionality due to the removal--hence the bug.

If I knew more, I'd say so or even provide a fix by myself.

**Comment by ssahani** [comment]
Like I said I would post a patch to kernel until you say that hold good.

**Comment by ssahani** [comment]
BTW for workaround see https://github.com/systemd/systemd/issues/12050

**Comment by yuwata** [comment]
So, how to reproduce this issue?

**Comment by Tragetaschen** [comment]
@yuwata Exactly ask outlined in the above comments?
Just to make sure, I have rebuilt my Yocto image based on v241 without reverting 3104883ddc2452ae210de3c70576c03023250a51 and rechecked everything using an USB/Ethernet adapter.

TLDR: Pulling an Ethernet cable and plugging it back in should reproduce the issue.

Attaching the adapter and cable:
```
# ip -6 route ls table all
local ::1 dev lo proto kernel metric 0 pref medium
::1 dev lo proto kernel metric 256 pref medium
local 2003:*** dev eth0 proto kernel metric 0 pref medium
2003:***::/64 dev eth0 proto ra metric 1024 expires 7197sec pref medium
2003:***::/56 via fe80::ca0e:14ff:fe19:aa20 dev eth0 proto ra metric 1024 expires 1797sec pref medium
local fe80::2fe:c8ff:fef7:108e dev eth0 proto kernel metric 0 pref medium
fe80::/64 dev eth0 proto kernel metric 256 pref medium
ff00::/8 dev eth0 metric 256 pref medium
```

After detaching and reattaching the network cable. You can see that all global IPv6 routes are missing for eth0. The adapter is also missing the globally routable IPv6 addresses.

```
# ip -6 route ls table all
local ::1 dev lo proto kernel metric 0 pref medium
::1 dev lo proto kernel metric 256 pref medium
local fe80::2fe:c8ff:fef7:108e dev eth0 proto kernel metric 0 pref medium
fe80::/64 dev eth0 proto kernel metric 256 pref medium
```

After detaching and reattaching the entire USB/Ethernet adapter.
```
# ip -6 route ls table all
local ::1 dev lo proto kernel metric 0 pref medium
::1 dev lo proto kernel metric 256 pref medium
local 2003:*** dev eth0 proto kernel metric 0 pref medium
2003:***::/64 dev eth0 proto ra metric 1024 expires 7198sec pref medium
2003:***::/56 via fe80::ca0e:14ff:fe19:aa20 dev eth0 proto ra metric 1024 expires 1798sec pref medium
local fe80::2fe:c8ff:fef7:108e dev eth0 proto kernel metric 0 pref medium
fe80::/64 dev eth0 proto kernel metric 256 pref medium
ff00::/8 dev eth0 metric 256 pref medium
default via fe80::ca0e:14ff:fe19:aa20 dev eth0 proto ra metric 1024 expires 1798sec mtu 1492 pref medium
```

The thing that's broken is the missing `ff00::/8` route entry that gets deleted by systemd-networkd.

**Comment by yuwata** [comment]
@Tragetaschen My laptop has only wireless LAN, so I tried to reproduce the issue with bridge interface, but it the current git master works fine. If possible, could you test with the current git master and provide debugging logs of networkd? The debugging logs can be generated by createing, e.g. the following drop-in config:
```
# /etc/systemd/system/systemd-networkd.service.d/override.conf
[Service]
Environment=SYSTEMD_LOG_LEVEL=debug
```

**Comment by Tragetaschen** [comment]
Done:

Attaching the USB/Ethernet adapter without cable:
```
Jul 09 08:22:00 f000sx systemd-networkd[270]: eth0: New device has no master, continuing without
Jul 09 08:22:00 f000sx systemd-networkd[270]: eth0: Flags change: +MULTICAST +BROADCAST
Jul 09 08:22:00 f000sx systemd-networkd[270]: eth0: Link 4 added
Jul 09 08:22:00 f000sx systemd-networkd[270]: eth0: link pending udev initialization...
Jul 09 08:22:00 f000sx systemd-networkd[270]: eth0: Saved original MTU: 1500
Jul 09 08:22:00 f000sx systemd-networkd[270]: eth0: udev initialized link
Jul 09 08:22:00 f000sx systemd-networkd[270]: eth0: State changed: pending -> initialized
Jul 09 08:22:00 f000sx systemd-networkd[270]: Sent message type=signal sender=n/a destination=n/a path=/org/freedesktop/network1/link/_34 interface=org.freedesktop.DBus.Properties member=PropertiesChanged cookie=13 reply_cookie=0 signature=sa{sv}as error-name=n/a error-message=n/a
Jul 09 08:22:00 f000sx systemd-networkd[270]: eth0: Link state is up-to-date
Jul 09 08:22:00 f000sx systemd-networkd[270]: eth0: found matching network '/lib/systemd/network/wired.network'
Jul 09 08:22:00 f000sx systemd-networkd[270]: Setting '/proc/sys/net/ipv6/conf/eth0/proxy_ndp' to '0'
Jul 09 08:22:00 f000sx systemd-networkd[270]: Setting '/proc/sys/net/ipv6/conf/eth0/use_tempaddr' to '0'
Jul 09 08:22:00 f000sx systemd-networkd[270]: Setting '/proc/sys/net/ipv6/conf/eth0/accept_ra' to '0'
Jul 09 08:22:00 f000sx systemd-networkd[270]: eth0: Setting address genmode for link
Jul 09 08:22:00 f000sx systemd-networkd[270]: eth0: State changed: initialized -> configuring
Jul 09 08:22:00 f000sx systemd-networkd[270]: Sent message type=signal sender=n/a destination=n/a path=/org/freedesktop/network1/link/_34 interface=org.freedesktop.DBus.Properties member=PropertiesChanged cookie=14 reply_cookie=0 signature=sa{sv}as error-name=n/a error-message=n/a
Jul 09 08:22:00 f000sx systemd-networkd[270]: eth0: Bringing link up
Jul 09 08:22:00 f000sx systemd-networkd[270]: eth0: Flags change: +UP
Jul 09 08:22:00 f000sx systemd-networkd[270]: Sent message type=signal sender=n/a destination=n/a path=/org/freedesktop/network1/link/_34 interface=org.freedesktop.DBus.Properties member=PropertiesChanged cookie=15 reply_cookie=0 signature=sa{sv}as error-name=n/a error-message=n/a
Jul 09 08:22:00 f000sx systemd-networkd[270]: LLDP: Started LLDP client
Jul 09 08:22:00 f000sx systemd-networkd[270]: eth0: Started LLDP.
```

Attaching the cable for the first time. Note the first log entry mentions the important route

```
Jul 09 08:22:09 f000sx systemd-networkd[270]: eth0: Remembering route: dst: ff00::/8, src: n/a, gw: n/a, prefsrc: n/a
Jul 09 08:22:09 f000sx systemd-networkd[270]: eth0: Remembering route: dst: fe80::/64, src: n/a, gw: n/a, prefsrc: n/a
Jul 09 08:22:09 f000sx systemd-networkd[270]: eth0: Flags change: +LOWER_UP +RUNNING
Jul 09 08:22:09 f000sx systemd-networkd[270]: Sent message type=signal sender=n/a destination=n/a path=/org/freedesktop/network1/link/_34 interface=org.freedesktop.DBus.Properties member=PropertiesChanged cookie=16 reply_cookie=0 signature=sa{sv}as error-name=n/a error-message=n/a
Jul 09 08:22:09 f000sx systemd-networkd[270]: eth0: Gained carrier
Jul 09 08:22:09 f000sx systemd-networkd[270]: eth0: Acquiring DHCPv4 lease
Jul 09 08:22:09 f000sx systemd-networkd[270]: DHCP CLIENT (0x2ed82781): STARTED on ifindex 4
Jul 09 08:22:09 f000sx systemd-networkd[270]: Sent message type=signal sender=n/a destination=n/a path=/org/freedesktop/network1 interface=org.freedesktop.DBus.Properties member=PropertiesChanged cookie=17 reply_cookie=0 signature=sa{sv}as error-name=n/a error-message=n/a
Jul 09 08:22:09 f000sx systemd-networkd[270]: DHCP CLIENT (0x2ed82781): DISCOVER
Jul 09 08:22:09 f000sx systemd-networkd[270]: DHCP CLIENT (0x2ed82781): OFFER
Jul 09 08:22:09 f000sx systemd-networkd[270]: DHCP CLIENT (0x2ed82781): REQUEST (requesting)
Jul 09 08:22:09 f000sx systemd-networkd[270]: DHCP CLIENT (0x2ed82781): ACK
Jul 09 08:22:09 f000sx systemd-networkd[270]: DHCP CLIENT (0x2ed82781): lease expires in 1w 2d 23h 59min 58s
Jul 09 08:22:09 f000sx systemd-networkd[270]: DHCP CLIENT (0x2ed82781): T2 expires in 1w 1d 17h 59min 57s
Jul 09 08:22:09 f000sx systemd-networkd[270]: DHCP CLIENT (0x2ed82781): T1 expires in 4d 23h 59min 57s
Jul 09 08:22:09 f000sx systemd-networkd[270]: eth0: DHCPv4 address 192.168.1.191/23 via 192.168.1.1
Jul 09 08:22:09 f000sx systemd-networkd[270]: eth0: Remembering updated address: 192.168.1.191/23 (valid for 1w 3d)
Jul 09 08:22:09 f000sx systemd-networkd[270]: Sent message type=signal sender=n/a destination=n/a path=/org/freedesktop/network1/link/_34 interface=org.freedesktop.DBus.Properties member=PropertiesChanged cookie=18 reply_cookie=0 signature=sa{sv}as error-name=n/a error-message=n/a
Jul 09 08:22:09 f000sx systemd-networkd[270]: Sent message type=signal sender=n/a destination=n/a path=/org/freedesktop/network1 interface=org.freedesktop.DBus.Properties member=PropertiesChanged cookie=19 reply_cookie=0 signature=sa{sv}as error-name=n/a error-message=n/a
Jul 09 08:22:09 f000sx systemd-networkd[270]: eth0: Remembering route: dst: 192.168.1.191/32, src: n/a, gw: n/a, prefsrc: 192.168.1.191
Jul 09 08:22:09 f000sx systemd-networkd[270]: eth0: Remembering route: dst: 192.168.1.255/32, src: n/a, gw: n/a, prefsrc: 192.168.1.191
Jul 09 08:22:09 f000sx systemd-networkd[270]: eth0: Remembering route: dst: 192.168.0.0/23, src: n/a, gw: n/a, prefsrc: 192.168.1.191
Jul 09 08:22:09 f000sx systemd-networkd[270]: eth0: Remembering route: dst: 192.168.0.0/32, src: n/a, gw: n/a, prefsrc: 192.168.1.191
Jul 09 08:22:09 f000sx systemd-networkd[270]: eth0: DHCP: No routes received from DHCP server: No data available
Jul 09 08:22:09 f000sx systemd-networkd[270]: eth0: Configuring route: dst: 192.168.1.1/32, src: n/a, gw: n/a, prefsrc: 192.168.1.191
Jul 09 08:22:09 f000sx systemd-networkd[270]: eth0: Configuring route: dst: n/a, src: n/a, gw: 192.168.1.1, prefsrc: 192.168.1.191
Jul 09 08:22:09 f000sx systemd-networkd[270]: eth0: Updating remembered route: dst: 192.168.1.1/32, src: n/a, gw: n/a, prefsrc: 192.168.1.191
Jul 09 08:22:09 f000sx systemd-networkd[270]: eth0: Updating remembered route: dst: n/a, src: n/a, gw: 192.168.1.1, prefsrc: 192.168.1.191
Jul 09 08:22:11 f000sx systemd-networkd[270]: eth0: Remembering foreign address: fe80::2fe:c8ff:fef7:108e/64 (valid forever)
Jul 09 08:22:11 f000sx systemd-networkd[270]: eth0: Gained IPv6LL
Jul 09 08:22:11 f000sx systemd-networkd[270]: eth0: Discovering IPv6 routers
Jul 09 08:22:11 f000sx systemd-networkd[270]: NDISC: Started IPv6 Router Solicitation client
Jul 09 08:22:11 f000sx systemd-networkd[270]: NDISC: Sent Router Solicitation, next solicitation in 4s
Jul 09 08:22:11 f000sx systemd-networkd[270]: eth0: Remembering route: dst: fe80::2fe:c8ff:fef7:108e/128, src: n/a, gw: n/a, prefsrc: n/a
Jul 09 08:22:11 f000sx systemd-networkd[270]: NDISC: Received Router Advertisement: flags OTHER preference medium lifetime 1800 sec
Jul 09 08:22:11 f000sx systemd-networkd[270]: NDISC: Invoking callback for 'router' event.
Jul 09 08:22:11 f000sx systemd-networkd[270]: DHCPv6 CLIENT: Started in Information request mode
Jul 09 08:22:11 f000sx systemd-networkd[270]: eth0: Acquiring DHCPv6 lease on NDisc request
Jul 09 08:22:11 f000sx systemd-networkd[270]: eth0: Configuring route: dst: n/a, src: n/a, gw: fe80::ca0e:14ff:fe19:aa20, prefsrc: n/a
Jul 09 08:22:11 f000sx systemd-networkd[270]: eth0: Configuring route: dst: 2003:***::/64, src: n/a, gw: n/a, prefsrc: n/a
Jul 09 08:22:11 f000sx systemd-networkd[270]: eth0: Configuring route: dst: n/a, src: n/a, gw: fe80::ca0e:14ff:fe19:aa20, prefsrc: n/a
Jul 09 08:22:11 f000sx systemd-networkd[270]: eth0: Configuring route: dst: 2003:***::/56, src: n/a, gw: fe80::ca0e:14ff:fe19:aa20, prefsrc: n/a
Jul 09 08:22:11 f000sx systemd-networkd[270]: DHCPv6 CLIENT: Sent INFORMATION-REQUEST
Jul 09 08:22:11 f000sx systemd-networkd[270]: DHCPv6 CLIENT: Next retransmission in 975ms
Jul 09 08:22:11 f000sx systemd-networkd[270]: eth0: Updating remembered route: dst: n/a, src: n/a, gw: fe80::ca0e:14ff:fe19:aa20, prefsrc: n/a
Jul 09 08:22:11 f000sx systemd-networkd[270]: DHCPv6 CLIENT: Recv REPLY
Jul 09 08:22:11 f000sx systemd-networkd[270]: eth0: Updating remembered route: dst: 2003:***::/64, src: n/a, gw: n/a, prefsrc: n/a
Jul 09 08:22:11 f000sx systemd-networkd[270]: eth0: Remembering updated address: 2003:***/64 (valid for 2h)
Jul 09 08:22:11 f000sx systemd-networkd[270]: eth0: Remembering route: dst: 2003:***::/56, src: n/a, gw: fe80::ca0e:14ff:fe19:aa20, prefsrc: n/a
Jul 09 08:22:13 f000sx systemd-networkd[270]: eth0: Remembering updated address: 2003:***/64 (valid for 1h 59min 59s)
Jul 09 08:22:13 f000sx systemd-networkd[270]: eth0: Configured
Jul 09 08:22:13 f000sx systemd-networkd[270]: eth0: State changed: configuring -> configured
Jul 09 08:22:13 f000sx systemd-networkd[270]: Sent message type=signal sender=n/a destination=n/a path=/org/freedesktop/network1/link/_34 interface=org.freedesktop.DBus.Properties member=PropertiesChanged cookie=20 reply_cookie=0 signature=sa{sv}as error-name=n/a error-message=n/a
Jul 09 08:22:13 f000sx systemd-networkd[270]: eth0: Remembering route: dst: 2003:***/128, src: n/a, gw: n/a, prefsrc: n/a
Jul 09 08:22:23 f000sx systemd-networkd[270]: NDISC: No RA received before link confirmation timeout
Jul 09 08:22:23 f000sx systemd-networkd[270]: NDISC: Invoking callback for 'timeout' event.
```

Detaching the cable. Note that `ff00::/8` is removed.
```
Jul 09 08:22:25 f000sx systemd-networkd[270]: eth0: Flags change: -LOWER_UP -RUNNING
Jul 09 08:22:25 f000sx systemd-networkd[270]: Sent message type=signal sender=n/a destination=n/a path=/org/freedesktop/network1/link/_34 interface=org.freedesktop.DBus.Properties member=PropertiesChanged cookie=21 reply_cookie=0 signature=sa{sv}as error-name=n/a error-message=n/a
Jul 09 08:22:25 f000sx systemd-networkd[270]: eth0: Lost carrier
Jul 09 08:22:25 f000sx systemd-networkd[270]: DHCP CLIENT (0x2ed82781): STOPPED
Jul 09 08:22:25 f000sx systemd-networkd[270]: eth0: DHCP lease lost
Jul 09 08:22:25 f000sx systemd-networkd[270]: eth0: Removing address 192.168.1.191
Jul 09 08:22:25 f000sx systemd-networkd[270]: eth0: DHCPv6 lease lost
Jul 09 08:22:25 f000sx systemd-networkd[270]: NDISC: Stopping IPv6 Router Solicitation client
Jul 09 08:22:25 f000sx systemd-networkd[270]: eth0: Removing address 192.168.1.191
Jul 09 08:22:25 f000sx systemd-networkd[270]: eth0: Removing address 2003:***
Jul 09 08:22:25 f000sx systemd-networkd[270]: eth0: State is configured, dropping config
Jul 09 08:22:25 f000sx systemd-networkd[270]: Sent message type=signal sender=n/a destination=n/a path=/org/freedesktop/network1 interface=org.freedesktop.DBus.Properties member=PropertiesChanged cookie=22 reply_cookie=0 signature=sa{sv}as error-name=n/a error-message=n/a
Jul 09 08:22:25 f000sx systemd-networkd[270]: eth0: Forgetting route: dst: 192.168.1.1/32, src: n/a, gw: n/a, prefsrc: 192.168.1.191
Jul 09 08:22:25 f000sx systemd-networkd[270]: eth0: Forgetting route: dst: n/a, src: n/a, gw: 192.168.1.1, prefsrc: 192.168.1.191
Jul 09 08:22:25 f000sx systemd-networkd[270]: eth0: Forgetting address: 192.168.1.191/23 (valid for 1w 2d 23h 59min 45s)
Jul 09 08:22:25 f000sx systemd-networkd[270]: eth0: Forgetting route: dst: 192.168.0.0/23, src: n/a, gw: n/a, prefsrc: 192.168.1.191
Jul 09 08:22:25 f000sx systemd-networkd[270]: eth0: Forgetting route: dst: 192.168.1.255/32, src: n/a, gw: n/a, prefsrc: 192.168.1.191
Jul 09 08:22:25 f000sx systemd-networkd[270]: eth0: Forgetting route: dst: 192.168.0.0/32, src: n/a, gw: n/a, prefsrc: 192.168.1.191
Jul 09 08:22:25 f000sx systemd-networkd[270]: eth0: Forgetting route: dst: 192.168.1.191/32, src: n/a, gw: n/a, prefsrc: 192.168.1.191
Jul 09 08:22:25 f000sx systemd-networkd[270]: eth0: Forgetting address: 2003:***/64 (valid for 1h 59min 47s)
Jul 09 08:22:25 f000sx systemd-networkd[270]: Sent message type=signal sender=n/a destination=n/a path=/org/freedesktop/network1/link/_34 interface=org.freedesktop.DBus.Properties member=PropertiesChanged cookie=23 reply_cookie=0 signature=sa{sv}as error-name=n/a error-message=n/a
Jul 09 08:22:25 f000sx systemd-networkd[270]: Sent message type=signal sender=n/a destination=n/a path=/org/freedesktop/network1 interface=org.freedesktop.DBus.Properties member=PropertiesChanged cookie=24 reply_cookie=0 signature=sa{sv}as error-name=n/a error-message=n/a
Jul 09 08:22:25 f000sx systemd-networkd[270]: eth0: Forgetting route: dst: 2003:***/128, src: n/a, gw: n/a, prefsrc: n/a
Jul 09 08:22:25 f000sx systemd-networkd[270]: eth0: Forgetting route: dst: 2003:***::/56, src: n/a, gw: fe80::ca0e:14ff:fe19:aa20, prefsrc: n/a
Jul 09 08:22:25 f000sx systemd-networkd[270]: eth0: Forgetting route: dst: n/a, src: n/a, gw: fe80::ca0e:14ff:fe19:aa20, prefsrc: n/a
Jul 09 08:22:25 f000sx systemd-networkd[270]: eth0: Forgetting route: dst: 2003:***::/64, src: n/a, gw: n/a, prefsrc: n/a
Jul 09 08:22:25 f000sx systemd-networkd[270]: eth0: Forgetting route: dst: ff00::/8, src: n/a, gw: n/a, prefsrc: n/a
```

Attaching for the second time. Note that nothing IPv6 / DHCPv6 related is happening this time.
```
Jul 09 08:22:40 f000sx systemd-networkd[270]: eth0: Flags change: +LOWER_UP +RUNNING
Jul 09 08:22:40 f000sx systemd-networkd[270]: Sent message type=signal sender=n/a destination=n/a path=/org/freedesktop/network1/link/_34 interface=org.freedesktop.DBus.Properties member=PropertiesChanged cookie=25 reply_cookie=0 signature=sa{sv}as error-name=n/a error-message=n/a
Jul 09 08:22:40 f000sx systemd-networkd[270]: eth0: Gained carrier
Jul 09 08:22:40 f000sx systemd-networkd[270]: eth0: Acquiring DHCPv4 lease
Jul 09 08:22:40 f000sx systemd-networkd[270]: DHCP CLIENT (0x8ea67424): STARTED on ifindex 4
Jul 09 08:22:40 f000sx systemd-networkd[270]: eth0: Discovering IPv6 routers
Jul 09 08:22:40 f000sx systemd-networkd[270]: NDISC: Started IPv6 Router Solicitation client
Jul 09 08:22:40 f000sx systemd-networkd[270]: eth0: State changed: configured -> configuring
Jul 09 08:22:40 f000sx systemd-networkd[270]: Sent message type=signal sender=n/a destination=n/a path=/org/freedesktop/network1/link/_34 interface=org.freedesktop.DBus.Properties member=PropertiesChanged cookie=26 reply_cookie=0 signature=sa{sv}as error-name=n/a error-message=n/a
Jul 09 08:22:40 f000sx systemd-networkd[270]: Sent message type=signal sender=n/a destination=n/a path=/org/freedesktop/network1 interface=org.freedesktop.DBus.Properties member=PropertiesChanged cookie=27 reply_cookie=0 signature=sa{sv}as error-name=n/a error-message=n/a
Jul 09 08:22:40 f000sx systemd-networkd[270]: NDISC: Error sending Router Solicitation: Network is unreachable
Jul 09 08:22:40 f000sx systemd-networkd[270]: NDISC: Stopping IPv6 Router Solicitation client
Jul 09 08:22:40 f000sx systemd-networkd[270]: DHCP CLIENT (0x8ea67424): REQUEST (init-reboot)
Jul 09 08:22:40 f000sx systemd-networkd[270]: DHCP CLIENT (0x8ea67424): ACK
Jul 09 08:22:40 f000sx systemd-networkd[270]: DHCP CLIENT (0x8ea67424): lease expires in 1w 2d 23h 59min 58s
Jul 09 08:22:40 f000sx systemd-networkd[270]: DHCP CLIENT (0x8ea67424): T2 expires in 1w 1d 17h 59min 58s
Jul 09 08:22:40 f000sx systemd-networkd[270]: DHCP CLIENT (0x8ea67424): T1 expires in 4d 23h 59min 57s
Jul 09 08:22:40 f000sx systemd-networkd[270]: eth0: DHCPv4 address 192.168.1.191/23 via 192.168.1.1
Jul 09 08:22:40 f000sx systemd-networkd[270]: eth0: Remembering updated address: 192.168.1.191/23 (valid for 1w 3d)
Jul 09 08:22:40 f000sx systemd-networkd[270]: Sent message type=signal sender=n/a destination=n/a path=/org/freedesktop/network1/link/_34 interface=org.freedesktop.DBus.Properties member=PropertiesChanged cookie=28 reply_cookie=0 signature=sa{sv}as error-name=n/a error-message=n/a
Jul 09 08:22:40 f000sx systemd-networkd[270]: Sent message type=signal sender=n/a destination=n/a path=/org/freedesktop/network1 interface=org.freedesktop.DBus.Properties member=PropertiesChanged cookie=29 reply_cookie=0 signature=sa{sv}as error-name=n/a error-message=n/a
Jul 09 08:22:40 f000sx systemd-networkd[270]: eth0: Remembering route: dst: 192.168.1.191/32, src: n/a, gw: n/a, prefsrc: 192.168.1.191
Jul 09 08:22:40 f000sx systemd-networkd[270]: eth0: Remembering route: dst: 192.168.1.255/32, src: n/a, gw: n/a, prefsrc: 192.168.1.191
Jul 09 08:22:40 f000sx systemd-networkd[270]: eth0: Remembering route: dst: 192.168.0.0/23, src: n/a, gw: n/a, prefsrc: 192.168.1.191
Jul 09 08:22:40 f000sx systemd-networkd[270]: eth0: Remembering route: dst: 192.168.0.0/32, src: n/a, gw: n/a, prefsrc: 192.168.1.191
Jul 09 08:22:40 f000sx systemd-networkd[270]: eth0: DHCP: No routes received from DHCP server: No data available
Jul 09 08:22:40 f000sx systemd-networkd[270]: eth0: Configuring route: dst: 192.168.1.1/32, src: n/a, gw: n/a, prefsrc: 192.168.1.191
Jul 09 08:22:40 f000sx systemd-networkd[270]: eth0: Configuring route: dst: n/a, src: n/a, gw: 192.168.1.1, prefsrc: 192.168.1.191
Jul 09 08:22:40 f000sx systemd-networkd[270]: eth0: Updating remembered route: dst: 192.168.1.1/32, src: n/a, gw: n/a, prefsrc: 192.168.1.191
Jul 09 08:22:40 f000sx systemd-networkd[270]: eth0: Updating remembered route: dst: n/a, src: n/a, gw: 192.168.1.1, prefsrc: 192.168.1.191
Jul 09 08:22:40 f000sx systemd-networkd[270]: eth0: Configured
Jul 09 08:22:40 f000sx systemd-networkd[270]: eth0: State changed: configuring -> configured
Jul 09 08:22:40 f000sx systemd-networkd[270]: Sent message type=signal sender=n/a destination=n/a path=/org/freedesktop/network1/link/_34 interface=org.freedesktop.DBus.Properties member=PropertiesChanged cookie=30 reply_cookie=0 signature=sa{sv}as error-name=n/a error-message=n/a
```

Detaching for the second time
```
Jul 09 08:22:59 f000sx systemd-networkd[270]: eth0: Flags change: -LOWER_UP -RUNNING
Jul 09 08:22:59 f000sx systemd-networkd[270]: Sent message type=signal sender=n/a destination=n/a path=/org/freedesktop/network1/link/_34 interface=org.freedesktop.DBus.Properties member=PropertiesChanged cookie=31 reply_cookie=0 signature=sa{sv}as error-name=n/a error-message=n/a
Jul 09 08:22:59 f000sx systemd-networkd[270]: eth0: Lost carrier
Jul 09 08:22:59 f000sx systemd-networkd[270]: DHCP CLIENT (0x8ea67424): STOPPED
Jul 09 08:22:59 f000sx systemd-networkd[270]: eth0: DHCP lease lost
Jul 09 08:22:59 f000sx systemd-networkd[270]: eth0: Removing address 192.168.1.191
Jul 09 08:22:59 f000sx systemd-networkd[270]: eth0: Removing address 192.168.1.191
Jul 09 08:22:59 f000sx systemd-networkd[270]: eth0: State is configured, dropping config
Jul 09 08:22:59 f000sx systemd-networkd[270]: Sent message type=signal sender=n/a destination=n/a path=/org/freedesktop/network1 interface=org.freedesktop.DBus.Properties member=PropertiesChanged cookie=32 reply_cookie=0 signature=sa{sv}as error-name=n/a error-message=n/a
Jul 09 08:22:59 f000sx systemd-networkd[270]: eth0: Forgetting route: dst: 192.168.1.1/32, src: n/a, gw: n/a, prefsrc: 192.168.1.191
Jul 09 08:22:59 f000sx systemd-networkd[270]: eth0: Forgetting route: dst: n/a, src: n/a, gw: 192.168.1.1, prefsrc: 192.168.1.191
Jul 09 08:22:59 f000sx systemd-networkd[270]: eth0: Forgetting address: 192.168.1.191/23 (valid for 1w 2d 23h 59min 41s)
Jul 09 08:22:59 f000sx systemd-networkd[270]: Sent message type=signal sender=n/a destination=n/a path=/org/freedesktop/network1/link/_34 interface=org.freedesktop.DBus.Properties member=PropertiesChanged cookie=33 reply_cookie=0 signature=sa{sv}as error-name=n/a error-message=n/a
Jul 09 08:22:59 f000sx systemd-networkd[270]: Sent message type=signal sender=n/a destination=n/a path=/org/freedesktop/network1 interface=org.freedesktop.DBus.Properties member=PropertiesChanged cookie=34 reply_cookie=0 signature=sa{sv}as error-name=n/a error-message=n/a
Jul 09 08:22:59 f000sx systemd-networkd[270]: eth0: Forgetting route: dst: 192.168.0.0/23, src: n/a, gw: n/a, prefsrc: 192.168.1.191
Jul 09 08:22:59 f000sx systemd-networkd[270]: eth0: Forgetting route: dst: 192.168.1.255/32, src: n/a, gw: n/a, prefsrc: 192.168.1.191
Jul 09 08:22:59 f000sx systemd-networkd[270]: eth0: Forgetting route: dst: 192.168.0.0/32, src: n/a, gw: n/a, prefsrc: 192.168.1.191
Jul 09 08:22:59 f000sx systemd-networkd[270]: eth0: Forgetting route: dst: 192.168.1.191/32, src: n/a, gw: n/a, prefsrc: 192.168.1.191
```

Removing the adapter
```
Jul 09 08:23:19 f000sx systemd-networkd[270]: eth0: Flags change: -UP
Jul 09 08:23:19 f000sx systemd-networkd[270]: Sent message type=signal sender=n/a destination=n/a path=/org/freedesktop/network1/link/_34 interface=org.freedesktop.DBus.Properties member=PropertiesChanged cookie=35 reply_cookie=0 signature=sa{sv}as error-name=n/a error-message=n/a
Jul 09 08:23:19 f000sx systemd-networkd[270]: LLDP: Stopping LLDP client
Jul 09 08:23:19 f000sx systemd-networkd[270]: eth0: Stopped LLDP.
Jul 09 08:23:19 f000sx systemd-networkd[270]: eth0: Forgetting route: dst: fe80::2fe:c8ff:fef7:108e/128, src: n/a, gw: n/a, prefsrc: n/a
Jul 09 08:23:19 f000sx systemd-networkd[270]: eth0: Forgetting route: dst: fe80::/64, src: n/a, gw: n/a, prefsrc: n/a
Jul 09 08:23:19 f000sx systemd-networkd[270]: eth0: Forgetting address: fe80::2fe:c8ff:fef7:108e/64 (valid forever)
Jul 09 08:23:19 f000sx systemd-networkd[270]: Sent message type=signal sender=n/a destination=n/a path=/org/freedesktop/network1/link/_34 interface=org.freedesktop.DBus.Properties member=PropertiesChanged cookie=36 reply_cookie=0 signature=sa{sv}as error-name=n/a error-message=n/a
Jul 09 08:23:19 f000sx systemd-networkd[270]: Sent message type=signal sender=n/a destination=n/a path=/org/freedesktop/network1 interface=org.freedesktop.DBus.Properties member=PropertiesChanged cookie=37 reply_cookie=0 signature=sa{sv}as error-name=n/a error-message=n/a
Jul 09 08:23:19 f000sx systemd-networkd[270]: eth0: State changed: configured -> linger
Jul 09 08:23:19 f000sx systemd-networkd[270]: Sent message type=signal sender=n/a destination=n/a path=/org/freedesktop/network1/link/_34 interface=org.freedesktop.DBus.Properties member=PropertiesChanged cookie=38 reply_cookie=0 signature=sa{sv}as error-name=n/a error-message=n/a
Jul 09 08:23:19 f000sx systemd-networkd[270]: eth0: Link removed
Jul 09 08:23:19 f000sx systemd-networkd[270]: DHCP CLIENT (0x0): FREE
Jul 09 08:23:19 f000sx systemd-networkd[270]: eth0: Ignoring udev remove event for device.
```

**Comment by yuwata** [comment]
Thanks.
```
Jul 09 08:22:25 f000sx systemd-networkd[270]: eth0: Forgetting route: dst: ff00::/8, src: n/a, gw: n/a, prefsrc: n/a
```
This line does not remove the route, just 'forget' it. That means the route entry in networkd's memory is dropped. And, if it is dropped from the memory, networkd cannot removes the route, I hope so.

If possible, could you test PR #12977? The PR adds debugging logs when removing route. So, networkd really removes the route, then it is logged.

Also, could you provide the kernel version you use? Thank you.

**Comment by Tragetaschen** [comment]
Done. With the patch from #12977, there's no change in behavior.

> networkd cannot removes the route, I hope so.

As mentioned a couple of times, the code that removes the `ff00::/8` from the routing table was introduced here: https://github.com/systemd/systemd/commit/3104883ddc2452ae210de3c70576c03023250a51#diff-12a3ecdf5af7aa9f8583c27ac442ca43R2338

> Also, could you provide the kernel version you use?

Nowadays, it's 4.19.53, this one specifically: https://github.com/Tragetaschen/linux-stable-pconxs/tree/linux-p868-4.19.y

**Comment by yuwata** [comment]
Could you provide the debugging log when running with PR #12977? Then I may understand why the commit introduced this issue.

**Comment by Tragetaschen** [comment]
Same procedure as above. The log is continuous and only broken up for readability.

Attaching the adapter
```
Jul 09 13:00:47 f000sx systemd-networkd[271]: eth0: New device has no master, continuing without
Jul 09 13:00:47 f000sx systemd-networkd[271]: eth0: Flags change: +MULTICAST +BROADCAST
Jul 09 13:00:47 f000sx systemd-networkd[271]: eth0: Link 6 added
Jul 09 13:00:47 f000sx systemd-networkd[271]: eth0: link pending udev initialization...
Jul 09 13:00:47 f000sx systemd-networkd[271]: eth0: Saved original MTU: 1500
Jul 09 13:00:47 f000sx systemd-networkd[271]: eth0: udev initialized link
Jul 09 13:00:47 f000sx systemd-networkd[271]: eth0: State changed: pending -> initialized
Jul 09 13:00:47 f000sx systemd-networkd[271]: Sent message type=signal sender=n/a destination=n/a path=/org/freedesktop/network1/link/_36 interface=org.freedesktop.DBus.Properties member=PropertiesChanged cookie=24 reply_cookie=0 signature=sa{sv}as error-name=n/a error-message=n/a
Jul 09 13:00:47 f000sx systemd-networkd[271]: eth0: Link state is up-to-date
Jul 09 13:00:47 f000sx systemd-networkd[271]: eth0: found matching network '/lib/systemd/network/wired.network'
Jul 09 13:00:47 f000sx systemd-networkd[271]: Setting '/proc/sys/net/ipv6/conf/eth0/proxy_ndp' to '0'
Jul 09 13:00:47 f000sx systemd-networkd[271]: Setting '/proc/sys/net/ipv6/conf/eth0/use_tempaddr' to '0'
Jul 09 13:00:47 f000sx systemd-networkd[271]: Setting '/proc/sys/net/ipv6/conf/eth0/accept_ra' to '0'
Jul 09 13:00:47 f000sx systemd-networkd[271]: eth0: Setting address genmode for link
Jul 09 13:00:47 f000sx systemd-networkd[271]: eth0: State changed: initialized -> configuring
Jul 09 13:00:47 f000sx systemd-networkd[271]: Sent message type=signal sender=n/a destination=n/a path=/org/freedesktop/network1/link/_36 interface=org.freedesktop.DBus.Properties member=PropertiesChanged cookie=25 reply_cookie=0 signature=sa{sv}as error-name=n/a error-message=n/a
Jul 09 13:00:47 f000sx systemd-networkd[271]: eth0: Bringing link up
Jul 09 13:00:48 f000sx systemd-networkd[271]: eth0: Flags change: +UP
Jul 09 13:00:48 f000sx systemd-networkd[271]: Sent message type=signal sender=n/a destination=n/a path=/org/freedesktop/network1/link/_36 interface=org.freedesktop.DBus.Properties member=PropertiesChanged cookie=26 reply_cookie=0 signature=sa{sv}as error-name=n/a error-message=n/a
Jul 09 13:00:48 f000sx systemd-networkd[271]: LLDP: Started LLDP client
Jul 09 13:00:48 f000sx systemd-networkd[271]: eth0: Started LLDP.
```
Attaching the cable:
```
Jul 09 13:01:01 f000sx systemd-networkd[271]: eth0: Remembering route: dst: ff00::/8, src: n/a, gw: n/a, prefsrc: n/a, scope: global, table: main, type: unicast
Jul 09 13:01:01 f000sx systemd-networkd[271]: eth0: Remembering route: dst: fe80::/64, src: n/a, gw: n/a, prefsrc: n/a, scope: global, table: main, type: unicast
Jul 09 13:01:01 f000sx systemd-networkd[271]: eth0: Flags change: +LOWER_UP +RUNNING
Jul 09 13:01:01 f000sx systemd-networkd[271]: Sent message type=signal sender=n/a destination=n/a path=/org/freedesktop/network1/link/_36 interface=org.freedesktop.DBus.Properties member=PropertiesChanged cookie=27 reply_cookie=0 signature=sa{sv}as error-name=n/a error-message=n/a
Jul 09 13:01:01 f000sx systemd-networkd[271]: eth0: Gained carrier
Jul 09 13:01:01 f000sx systemd-networkd[271]: eth0: Acquiring DHCPv4 lease
Jul 09 13:01:01 f000sx systemd-networkd[271]: DHCP CLIENT (0xfcd17a41): STARTED on ifindex 6
Jul 09 13:01:01 f000sx systemd-networkd[271]: DHCP CLIENT (0xfcd17a41): DISCOVER
Jul 09 13:01:01 f000sx systemd-networkd[271]: DHCP CLIENT (0xfcd17a41): OFFER
Jul 09 13:01:01 f000sx systemd-networkd[271]: DHCP CLIENT (0xfcd17a41): REQUEST (requesting)
Jul 09 13:01:01 f000sx systemd-networkd[271]: DHCP CLIENT (0xfcd17a41): ACK
Jul 09 13:01:01 f000sx systemd-networkd[271]: DHCP CLIENT (0xfcd17a41): lease expires in 1w 2d 23h 59min 57s
Jul 09 13:01:01 f000sx systemd-networkd[271]: DHCP CLIENT (0xfcd17a41): T2 expires in 1w 1d 17h 59min 57s
Jul 09 13:01:01 f000sx systemd-networkd[271]: DHCP CLIENT (0xfcd17a41): T1 expires in 4d 23h 59min 57s
Jul 09 13:01:01 f000sx systemd-networkd[271]: eth0: DHCPv4 address 192.168.1.211/23 via 192.168.1.1
Jul 09 13:01:01 f000sx systemd-networkd[271]: eth0: Remembering updated address: 192.168.1.211/23 (valid for 1w 3d)
Jul 09 13:01:01 f000sx systemd-networkd[271]: Sent message type=signal sender=n/a destination=n/a path=/org/freedesktop/network1/link/_36 interface=org.freedesktop.DBus.Properties member=PropertiesChanged cookie=28 reply_cookie=0 signature=sa{sv}as error-name=n/a error-message=n/a
Jul 09 13:01:01 f000sx systemd-networkd[271]: Sent message type=signal sender=n/a destination=n/a path=/org/freedesktop/network1 interface=org.freedesktop.DBus.Properties member=PropertiesChanged cookie=29 reply_cookie=0 signature=sa{sv}as error-name=n/a error-message=n/a
Jul 09 13:01:01 f000sx systemd-networkd[271]: eth0: Remembering route: dst: 192.168.1.211/32, src: n/a, gw: n/a, prefsrc: 192.168.1.211, scope: host, table: local, type: local
Jul 09 13:01:01 f000sx systemd-networkd[271]: eth0: Remembering route: dst: 192.168.1.255/32, src: n/a, gw: n/a, prefsrc: 192.168.1.211, scope: link, table: local, type: broadcast
Jul 09 13:01:01 f000sx systemd-networkd[271]: eth0: Remembering route: dst: 192.168.0.0/23, src: n/a, gw: n/a, prefsrc: 192.168.1.211, scope: link, table: main, type: unicast
Jul 09 13:01:01 f000sx systemd-networkd[271]: eth0: Remembering route: dst: 192.168.0.0/32, src: n/a, gw: n/a, prefsrc: 192.168.1.211, scope: link, table: local, type: broadcast
Jul 09 13:01:01 f000sx systemd-networkd[271]: eth0: DHCP: No routes received from DHCP server: No data available
Jul 09 13:01:01 f000sx systemd-networkd[271]: eth0: Configuring route: dst: 192.168.1.1/32, src: n/a, gw: n/a, prefsrc: 192.168.1.211, scope: link, table: main, type: unicast
Jul 09 13:01:01 f000sx systemd-networkd[271]: eth0: Configuring route: dst: n/a, src: n/a, gw: 192.168.1.1, prefsrc: 192.168.1.211, scope: global, table: main, type: unicast
Jul 09 13:01:01 f000sx systemd-networkd[271]: eth0: Updating remembered route: dst: 192.168.1.1/32, src: n/a, gw: n/a, prefsrc: 192.168.1.211, scope: link, table: main, type: unicast
Jul 09 13:01:01 f000sx systemd-networkd[271]: eth0: Updating remembered route: dst: n/a, src: n/a, gw: 192.168.1.1, prefsrc: 192.168.1.211, scope: global, table: main, type: unicast
Jul 09 13:01:02 f000sx systemd-networkd[271]: eth0: Remembering foreign address: fe80::2fe:c8ff:fef7:108e/64 (valid forever)
Jul 09 13:01:02 f000sx systemd-networkd[271]: eth0: Gained IPv6LL
Jul 09 13:01:02 f000sx systemd-networkd[271]: eth0: Discovering IPv6 routers
Jul 09 13:01:02 f000sx systemd-networkd[271]: NDISC: Started IPv6 Router Solicitation client
Jul 09 13:01:02 f000sx systemd-networkd[271]: NDISC: Sent Router Solicitation, next solicitation in 4s
Jul 09 13:01:02 f000sx systemd-networkd[271]: eth0: Remembering route: dst: fe80::2fe:c8ff:fef7:108e/128, src: n/a, gw: n/a, prefsrc: n/a, scope: global, table: main, type: local
Jul 09 13:01:02 f000sx systemd-networkd[271]: NDISC: Received Router Advertisement: flags OTHER preference medium lifetime 1800 sec
Jul 09 13:01:02 f000sx systemd-networkd[271]: NDISC: Invoking callback for 'router' event.
Jul 09 13:01:02 f000sx systemd-networkd[271]: DHCPv6 CLIENT: Started in Information request mode
Jul 09 13:01:02 f000sx systemd-networkd[271]: eth0: Acquiring DHCPv6 lease on NDisc request
Jul 09 13:01:02 f000sx systemd-networkd[271]: eth0: Configuring route: dst: n/a, src: n/a, gw: fe80::ca0e:14ff:fe19:aa20, prefsrc: n/a, scope: global, table: main, type: unicast
Jul 09 13:01:02 f000sx systemd-networkd[271]: eth0: Configuring route: dst: 2003:***::/64, src: n/a, gw: n/a, prefsrc: n/a, scope: global, table: main, type: unicast
Jul 09 13:01:02 f000sx systemd-networkd[271]: eth0: Configuring route: dst: n/a, src: n/a, gw: fe80::ca0e:14ff:fe19:aa20, prefsrc: n/a, scope: global, table: main, type: unicast
Jul 09 13:01:02 f000sx systemd-networkd[271]: eth0: Configuring route: dst: 2003:***::/56, src: n/a, gw: fe80::ca0e:14ff:fe19:aa20, prefsrc: n/a, scope: global, table: main, type: unicast
Jul 09 13:01:02 f000sx systemd-networkd[271]: DHCPv6 CLIENT: Sent INFORMATION-REQUEST
Jul 09 13:01:02 f000sx systemd-networkd[271]: DHCPv6 CLIENT: Next retransmission in 1s
Jul 09 13:01:02 f000sx systemd-networkd[271]: eth0: Updating remembered route: dst: n/a, src: n/a, gw: fe80::ca0e:14ff:fe19:aa20, prefsrc: n/a, scope: global, table: main, type: unicast
Jul 09 13:01:02 f000sx systemd-networkd[271]: eth0: Updating remembered route: dst: 2003:***::/64, src: n/a, gw: n/a, prefsrc: n/a, scope: global, table: main, type: unicast
Jul 09 13:01:02 f000sx systemd-networkd[271]: DHCPv6 CLIENT: Recv REPLY
Jul 09 13:01:02 f000sx systemd-networkd[271]: eth0: Remembering updated address: 2003:***/64 (valid for 2h)
Jul 09 13:01:02 f000sx systemd-networkd[271]: eth0: Remembering route: dst: 2003:***::/56, src: n/a, gw: fe80::ca0e:14ff:fe19:aa20, prefsrc: n/a, scope: global, table: main, type: unicast
Jul 09 13:01:04 f000sx systemd-networkd[271]: eth0: Remembering updated address: 2003:***/64 (valid for 1h 59min 59s)
Jul 09 13:01:04 f000sx systemd-networkd[271]: eth0: Configured
Jul 09 13:01:04 f000sx systemd-networkd[271]: eth0: State changed: configuring -> configured
Jul 09 13:01:04 f000sx systemd-networkd[271]: Sent message type=signal sender=n/a destination=n/a path=/org/freedesktop/network1/link/_36 interface=org.freedesktop.DBus.Properties member=PropertiesChanged cookie=30 reply_cookie=0 signature=sa{sv}as error-name=n/a error-message=n/a
Jul 09 13:01:04 f000sx systemd-networkd[271]: eth0: Remembering route: dst: 2003:***/128, src: n/a, gw: n/a, prefsrc: n/a, scope: global, table: main, type: local
Jul 09 13:01:05 f000sx systemd-networkd[271]: LLDP: Invoking callback for 'added' event.
Jul 09 13:01:05 f000sx systemd-networkd[271]: LLDP: Successfully processed LLDP datagram.
Jul 09 13:01:14 f000sx systemd-networkd[271]: NDISC: No RA received before link confirmation timeout
Jul 09 13:01:14 f000sx systemd-networkd[271]: NDISC: Invoking callback for 'timeout' event.
Jul 09 13:01:18 f000sx systemd-networkd[271]: NDISC: Sent Router Solicitation, next solicitation in 1min 2s
```
Detaching the cable
```
Jul 09 13:01:29 f000sx systemd-networkd[271]: eth0: Flags change: -LOWER_UP -RUNNING
Jul 09 13:01:29 f000sx systemd-networkd[271]: Sent message type=signal sender=n/a destination=n/a path=/org/freedesktop/network1/link/_36 interface=org.freedesktop.DBus.Properties member=PropertiesChanged cookie=31 reply_cookie=0 signature=sa{sv}as error-name=n/a error-message=n/a
Jul 09 13:01:29 f000sx systemd-networkd[271]: eth0: Lost carrier
Jul 09 13:01:29 f000sx systemd-networkd[271]: DHCP CLIENT (0xfcd17a41): STOPPED
Jul 09 13:01:29 f000sx systemd-networkd[271]: eth0: DHCP lease lost
Jul 09 13:01:29 f000sx systemd-networkd[271]: eth0: Removing route: dst: 192.168.1.1/32, src: n/a, gw: n/a, prefsrc: 192.168.1.211, scope: link, table: main, type: unicast
Jul 09 13:01:29 f000sx systemd-networkd[271]: eth0: Removing route: dst: n/a, src: n/a, gw: 192.168.1.1, prefsrc: 192.168.1.211, scope: global, table: main, type: unicast
Jul 09 13:01:29 f000sx systemd-networkd[271]: eth0: Removing address 192.168.1.211
Jul 09 13:01:29 f000sx systemd-networkd[271]: eth0: DHCPv6 lease lost
Jul 09 13:01:29 f000sx systemd-networkd[271]: NDISC: Stopping IPv6 Router Solicitation client
Jul 09 13:01:29 f000sx systemd-networkd[271]: eth0: Removing address 2003:***
Jul 09 13:01:29 f000sx systemd-networkd[271]: eth0: Removing address 192.168.1.211
Jul 09 13:01:29 f000sx systemd-networkd[271]: eth0: Removing route: dst: 2003:***::/56, src: n/a, gw: n/a, prefsrc: n/a, scope: global, table: main, type: unicast
Jul 09 13:01:29 f000sx systemd-networkd[271]: eth0: Removing route: dst: n/a, src: n/a, gw: fe80::ca0e:14ff:fe19:aa20, prefsrc: n/a, scope: global, table: main, type: unicast
Jul 09 13:01:29 f000sx systemd-networkd[271]: eth0: Removing route: dst: n/a, src: n/a, gw: n/a, prefsrc: n/a, scope: global, table: main, type: unicast
Jul 09 13:01:29 f000sx systemd-networkd[271]: eth0: Removing route: dst: 192.168.1.1/32, src: n/a, gw: n/a, prefsrc: 192.168.1.211, scope: link, table: main, type: unicast
Jul 09 13:01:29 f000sx systemd-networkd[271]: eth0: Removing route: dst: n/a, src: n/a, gw: 192.168.1.1, prefsrc: 192.168.1.211, scope: global, table: main, type: unicast
Jul 09 13:01:29 f000sx systemd-networkd[271]: eth0: Removing route: dst: 2003:***::/64, src: n/a, gw: n/a, prefsrc: n/a, scope: global, table: main, type: unicast
Jul 09 13:01:29 f000sx systemd-networkd[271]: eth0: State is configured, dropping config
Jul 09 13:01:29 f000sx systemd-networkd[271]: eth0: Removing route: dst: 2003:***::/56, src: n/a, gw: fe80::ca0e:14ff:fe19:aa20, prefsrc: n/a, scope: global, table: main, type: unicast
Jul 09 13:01:29 f000sx systemd-networkd[271]: eth0: Removing route: dst: ff00::/8, src: n/a, gw: n/a, prefsrc: n/a, scope: global, table: main, type: unicast
Jul 09 13:01:29 f000sx systemd-networkd[271]: Sent message type=signal sender=n/a destination=n/a path=/org/freedesktop/network1 interface=org.freedesktop.DBus.Properties member=PropertiesChanged cookie=32 reply_cookie=0 signature=sa{sv}as error-name=n/a error-message=n/a
Jul 09 13:01:29 f000sx systemd-networkd[271]: eth0: Forgetting route: dst: 192.168.1.1/32, src: n/a, gw: n/a, prefsrc: 192.168.1.211, scope: link, table: main, type: unicast
Jul 09 13:01:29 f000sx systemd-networkd[271]: eth0: Forgetting route: dst: n/a, src: n/a, gw: 192.168.1.1, prefsrc: 192.168.1.211, scope: global, table: main, type: unicast
Jul 09 13:01:29 f000sx systemd-networkd[271]: eth0: Forgetting address: 192.168.1.211/23 (valid for 1w 2d 23h 59min 33s)
Jul 09 13:01:29 f000sx systemd-networkd[271]: eth0: Forgetting route: dst: 192.168.0.0/23, src: n/a, gw: n/a, prefsrc: 192.168.1.211, scope: link, table: main, type: unicast
Jul 09 13:01:29 f000sx systemd-networkd[271]: eth0: Forgetting route: dst: 192.168.1.255/32, src: n/a, gw: n/a, prefsrc: 192.168.1.211, scope: link, table: local, type: broadcast
Jul 09 13:01:29 f000sx systemd-networkd[271]: eth0: Forgetting route: dst: 192.168.0.0/32, src: n/a, gw: n/a, prefsrc: 192.168.1.211, scope: link, table: local, type: broadcast
Jul 09 13:01:29 f000sx systemd-networkd[271]: eth0: Forgetting route: dst: 192.168.1.211/32, src: n/a, gw: n/a, prefsrc: 192.168.1.211, scope: host, table: local, type: local
Jul 09 13:01:29 f000sx systemd-networkd[271]: eth0: Forgetting address: 2003:***/64 (valid for 1h 59min 34s)
Jul 09 13:01:29 f000sx systemd-networkd[271]: Sent message type=signal sender=n/a destination=n/a path=/org/freedesktop/network1/link/_36 interface=org.freedesktop.DBus.Properties member=PropertiesChanged cookie=33 reply_cookie=0 signature=sa{sv}as error-name=n/a error-message=n/a
Jul 09 13:01:29 f000sx systemd-networkd[271]: Sent message type=signal sender=n/a destination=n/a path=/org/freedesktop/network1 interface=org.freedesktop.DBus.Properties member=PropertiesChanged cookie=34 reply_cookie=0 signature=sa{sv}as error-name=n/a error-message=n/a
Jul 09 13:01:29 f000sx systemd-networkd[271]: eth0: Forgetting route: dst: 2003:***/128, src: n/a, gw: n/a, prefsrc: n/a, scope: global, table: main, type: local
Jul 09 13:01:29 f000sx systemd-networkd[271]: eth0: Forgetting route: dst: 2003:***::/56, src: n/a, gw: fe80::ca0e:14ff:fe19:aa20, prefsrc: n/a, scope: global, table: main, type: unicast
Jul 09 13:01:29 f000sx systemd-networkd[271]: eth0: Forgetting route: dst: n/a, src: n/a, gw: fe80::ca0e:14ff:fe19:aa20, prefsrc: n/a, scope: global, table: main, type: unicast
Jul 09 13:01:29 f000sx systemd-networkd[271]: eth0: Forgetting route: dst: 2003:***::/64, src: n/a, gw: n/a, prefsrc: n/a, scope: global, table: main, type: unicast
Jul 09 13:01:29 f000sx systemd-networkd[271]: eth0: Forgetting route: dst: ff00::/8, src: n/a, gw: n/a, prefsrc: n/a, scope: global, table: main, type: unicast
```
Attaching the second time
```
Jul 09 13:01:48 f000sx systemd-networkd[271]: eth0: Flags change: +LOWER_UP +RUNNING
Jul 09 13:01:48 f000sx systemd-networkd[271]: Sent message type=signal sender=n/a destination=n/a path=/org/freedesktop/network1/link/_36 interface=org.freedesktop.DBus.Properties member=PropertiesChanged cookie=35 reply_cookie=0 signature=sa{sv}as error-name=n/a error-message=n/a
Jul 09 13:01:48 f000sx systemd-networkd[271]: eth0: Gained carrier
Jul 09 13:01:48 f000sx systemd-networkd[271]: eth0: Acquiring DHCPv4 lease
Jul 09 13:01:48 f000sx systemd-networkd[271]: DHCP CLIENT (0xd96afc8e): STARTED on ifindex 6
Jul 09 13:01:48 f000sx systemd-networkd[271]: eth0: Discovering IPv6 routers
Jul 09 13:01:48 f000sx systemd-networkd[271]: NDISC: Started IPv6 Router Solicitation client
Jul 09 13:01:48 f000sx systemd-networkd[271]: eth0: State changed: configured -> configuring
Jul 09 13:01:48 f000sx systemd-networkd[271]: Sent message type=signal sender=n/a destination=n/a path=/org/freedesktop/network1/link/_36 interface=org.freedesktop.DBus.Properties member=PropertiesChanged cookie=36 reply_cookie=0 signature=sa{sv}as error-name=n/a error-message=n/a
Jul 09 13:01:48 f000sx systemd-networkd[271]: NDISC: Error sending Router Solicitation: Network is unreachable
Jul 09 13:01:48 f000sx systemd-networkd[271]: NDISC: Stopping IPv6 Router Solicitation client
Jul 09 13:01:48 f000sx systemd-networkd[271]: DHCP CLIENT (0xd96afc8e): REQUEST (init-reboot)
Jul 09 13:01:48 f000sx systemd-networkd[271]: DHCP CLIENT (0xd96afc8e): ACK
Jul 09 13:01:48 f000sx systemd-networkd[271]: DHCP CLIENT (0xd96afc8e): lease expires in 1w 2d 23h 59min 57s
Jul 09 13:01:48 f000sx systemd-networkd[271]: DHCP CLIENT (0xd96afc8e): T2 expires in 1w 1d 17h 59min 58s
Jul 09 13:01:48 f000sx systemd-networkd[271]: DHCP CLIENT (0xd96afc8e): T1 expires in 4d 23h 59min 58s
Jul 09 13:01:48 f000sx systemd-networkd[271]: eth0: DHCPv4 address 192.168.1.211/23 via 192.168.1.1
Jul 09 13:01:48 f000sx systemd-networkd[271]: eth0: Remembering updated address: 192.168.1.211/23 (valid for 1w 3d)
Jul 09 13:01:48 f000sx systemd-networkd[271]: Sent message type=signal sender=n/a destination=n/a path=/org/freedesktop/network1/link/_36 interface=org.freedesktop.DBus.Properties member=PropertiesChanged cookie=37 reply_cookie=0 signature=sa{sv}as error-name=n/a error-message=n/a
Jul 09 13:01:48 f000sx systemd-networkd[271]: Sent message type=signal sender=n/a destination=n/a path=/org/freedesktop/network1 interface=org.freedesktop.DBus.Properties member=PropertiesChanged cookie=38 reply_cookie=0 signature=sa{sv}as error-name=n/a error-message=n/a
Jul 09 13:01:48 f000sx systemd-networkd[271]: eth0: Remembering route: dst: 192.168.1.211/32, src: n/a, gw: n/a, prefsrc: 192.168.1.211, scope: host, table: local, type: local
Jul 09 13:01:48 f000sx systemd-networkd[271]: eth0: Remembering route: dst: 192.168.1.255/32, src: n/a, gw: n/a, prefsrc: 192.168.1.211, scope: link, table: local, type: broadcast
Jul 09 13:01:48 f000sx systemd-networkd[271]: eth0: Remembering route: dst: 192.168.0.0/23, src: n/a, gw: n/a, prefsrc: 192.168.1.211, scope: link, table: main, type: unicast
Jul 09 13:01:48 f000sx systemd-networkd[271]: eth0: Remembering route: dst: 192.168.0.0/32, src: n/a, gw: n/a, prefsrc: 192.168.1.211, scope: link, table: local, type: broadcast
Jul 09 13:01:48 f000sx systemd-networkd[271]: eth0: DHCP: No routes received from DHCP server: No data available
Jul 09 13:01:48 f000sx systemd-networkd[271]: eth0: Configuring route: dst: 192.168.1.1/32, src: n/a, gw: n/a, prefsrc: 192.168.1.211, scope: link, table: main, type: unicast
Jul 09 13:01:48 f000sx systemd-networkd[271]: eth0: Configuring route: dst: n/a, src: n/a, gw: 192.168.1.1, prefsrc: 192.168.1.211, scope: global, table: main, type: unicast
Jul 09 13:01:48 f000sx systemd-networkd[271]: eth0: Updating remembered route: dst: 192.168.1.1/32, src: n/a, gw: n/a, prefsrc: 192.168.1.211, scope: link, table: main, type: unicast
Jul 09 13:01:48 f000sx systemd-networkd[271]: eth0: Updating remembered route: dst: n/a, src: n/a, gw: 192.168.1.1, prefsrc: 192.168.1.211, scope: global, table: main, type: unicast
Jul 09 13:01:48 f000sx systemd-networkd[271]: eth0: Configured
Jul 09 13:01:48 f000sx systemd-networkd[271]: eth0: State changed: configuring -> configured
Jul 09 13:01:48 f000sx systemd-networkd[271]: Sent message type=signal sender=n/a destination=n/a path=/org/freedesktop/network1/link/_36 interface=org.freedesktop.DBus.Properties member=PropertiesChanged cookie=39 reply_cookie=0 signature=sa{sv}as error-name=n/a error-message=n/a
Jul 09 13:02:05 f000sx systemd-networkd[271]: LLDP: Invoking callback for 'refreshed' event.
Jul 09 13:02:05 f000sx systemd-networkd[271]: LLDP: Successfully processed LLDP datagram.
```
Detaching cable
```
Jul 09 13:02:13 f000sx systemd-networkd[271]: eth0: Flags change: -LOWER_UP -RUNNING
Jul 09 13:02:13 f000sx systemd-networkd[271]: Sent message type=signal sender=n/a destination=n/a path=/org/freedesktop/network1/link/_36 interface=org.freedesktop.DBus.Properties member=PropertiesChanged cookie=40 reply_cookie=0 signature=sa{sv}as error-name=n/a error-message=n/a
Jul 09 13:02:13 f000sx systemd-networkd[271]: eth0: Lost carrier
Jul 09 13:02:13 f000sx systemd-networkd[271]: DHCP CLIENT (0xd96afc8e): STOPPED
Jul 09 13:02:13 f000sx systemd-networkd[271]: eth0: DHCP lease lost
Jul 09 13:02:13 f000sx systemd-networkd[271]: eth0: Removing route: dst: 192.168.1.1/32, src: n/a, gw: n/a, prefsrc: 192.168.1.211, scope: link, table: main, type: unicast
Jul 09 13:02:13 f000sx systemd-networkd[271]: eth0: Removing route: dst: n/a, src: n/a, gw: 192.168.1.1, prefsrc: 192.168.1.211, scope: global, table: main, type: unicast
Jul 09 13:02:13 f000sx systemd-networkd[271]: eth0: Removing address 192.168.1.211
Jul 09 13:02:13 f000sx systemd-networkd[271]: eth0: Removing address 192.168.1.211
Jul 09 13:02:13 f000sx systemd-networkd[271]: eth0: Removing route: dst: n/a, src: n/a, gw: n/a, prefsrc: n/a, scope: global, table: main, type: unicast
Jul 09 13:02:13 f000sx systemd-networkd[271]: eth0: Removing route: dst: 192.168.1.1/32, src: n/a, gw: n/a, prefsrc: 192.168.1.211, scope: link, table: main, type: unicast
Jul 09 13:02:13 f000sx systemd-networkd[271]: eth0: Removing route: dst: n/a, src: n/a, gw: 192.168.1.1, prefsrc: 192.168.1.211, scope: global, table: main, type: unicast
Jul 09 13:02:13 f000sx systemd-networkd[271]: eth0: Removing route: dst: 2003:***::/56, src: n/a, gw: n/a, prefsrc: n/a, scope: global, table: main, type: unicast
Jul 09 13:02:13 f000sx systemd-networkd[271]: eth0: State is configured, dropping config
Jul 09 13:02:13 f000sx systemd-networkd[271]: Sent message type=signal sender=n/a destination=n/a path=/org/freedesktop/network1 interface=org.freedesktop.DBus.Properties member=PropertiesChanged cookie=41 reply_cookie=0 signature=sa{sv}as error-name=n/a error-message=n/a
Jul 09 13:02:13 f000sx systemd-networkd[271]: eth0: Forgetting route: dst: 192.168.1.1/32, src: n/a, gw: n/a, prefsrc: 192.168.1.211, scope: link, table: main, type: unicast
Jul 09 13:02:13 f000sx systemd-networkd[271]: eth0: Forgetting route: dst: n/a, src: n/a, gw: 192.168.1.1, prefsrc: 192.168.1.211, scope: global, table: main, type: unicast
Jul 09 13:02:13 f000sx systemd-networkd[271]: eth0: Forgetting address: 192.168.1.211/23 (valid for 1w 2d 23h 59min 36s)
Jul 09 13:02:13 f000sx systemd-networkd[271]: Sent message type=signal sender=n/a destination=n/a path=/org/freedesktop/network1/link/_36 interface=org.freedesktop.DBus.Properties member=PropertiesChanged cookie=42 reply_cookie=0 signature=sa{sv}as error-name=n/a error-message=n/a
Jul 09 13:02:13 f000sx systemd-networkd[271]: Sent message type=signal sender=n/a destination=n/a path=/org/freedesktop/network1 interface=org.freedesktop.DBus.Properties member=PropertiesChanged cookie=43 reply_cookie=0 signature=sa{sv}as error-name=n/a error-message=n/a
Jul 09 13:02:13 f000sx systemd-networkd[271]: eth0: Forgetting route: dst: 192.168.0.0/23, src: n/a, gw: n/a, prefsrc: 192.168.1.211, scope: link, table: main, type: unicast
Jul 09 13:02:13 f000sx systemd-networkd[271]: eth0: Forgetting route: dst: 192.168.1.255/32, src: n/a, gw: n/a, prefsrc: 192.168.1.211, scope: link, table: local, type: broadcast
Jul 09 13:02:13 f000sx systemd-networkd[271]: eth0: Forgetting route: dst: 192.168.0.0/32, src: n/a, gw: n/a, prefsrc: 192.168.1.211, scope: link, table: local, type: broadcast
Jul 09 13:02:13 f000sx systemd-networkd[271]: eth0: Forgetting route: dst: 192.168.1.211/32, src: n/a, gw: n/a, prefsrc: 192.168.1.211, scope: host, table: local, type: local
Jul 09 13:02:20 f000sx systemd-networkd[271]: NDISC: Sent Router Solicitation, next solicitation in 2min 6s
```
Removing adapter
```
Jul 09 13:02:25 f000sx systemd-networkd[271]: eth0: Flags change: -UP
Jul 09 13:02:25 f000sx systemd-networkd[271]: Sent message type=signal sender=n/a destination=n/a path=/org/freedesktop/network1/link/_36 interface=org.freedesktop.DBus.Properties member=PropertiesChanged cookie=44 reply_cookie=0 signature=sa{sv}as error-name=n/a error-message=n/a
Jul 09 13:02:25 f000sx systemd-networkd[271]: LLDP: Stopping LLDP client
Jul 09 13:02:25 f000sx systemd-networkd[271]: eth0: Stopped LLDP.
Jul 09 13:02:25 f000sx systemd-networkd[271]: eth0: Forgetting route: dst: fe80::2fe:c8ff:fef7:108e/128, src: n/a, gw: n/a, prefsrc: n/a, scope: global, table: main, type: local
Jul 09 13:02:25 f000sx systemd-networkd[271]: eth0: Forgetting route: dst: fe80::/64, src: n/a, gw: n/a, prefsrc: n/a, scope: global, table: main, type: unicast
Jul 09 13:02:25 f000sx systemd-networkd[271]: eth0: Forgetting address: fe80::2fe:c8ff:fef7:108e/64 (valid forever)
Jul 09 13:02:25 f000sx systemd-networkd[271]: Sent message type=signal sender=n/a destination=n/a path=/org/freedesktop/network1/link/_36 interface=org.freedesktop.DBus.Properties member=PropertiesChanged cookie=45 reply_cookie=0 signature=sa{sv}as error-name=n/a error-message=n/a
Jul 09 13:02:25 f000sx systemd-networkd[271]: eth0: State changed: configured -> linger
Jul 09 13:02:25 f000sx systemd-networkd[271]: Sent message type=signal sender=n/a destination=n/a path=/org/freedesktop/network1/link/_36 interface=org.freedesktop.DBus.Properties member=PropertiesChanged cookie=46 reply_cookie=0 signature=sa{sv}as error-name=n/a error-message=n/a
Jul 09 13:02:25 f000sx systemd-networkd[271]: eth0: Link removed
Jul 09 13:02:25 f000sx systemd-networkd[271]: DHCP CLIENT (0x0): FREE
Jul 09 13:02:25 f000sx systemd-networkd[271]: eth0: Ignoring udev remove event for device.
```

**Comment by yuwata** [comment]
Ugh,
```
Jul 09 13:01:29 f000sx systemd-networkd[271]: eth0: Removing route: dst: ff00::/8, src: n/a, gw: n/a, prefsrc: n/a, scope: global, table: main, type: unicast
```
Hmm...

**Comment by ssahani** [comment]
What is the ```proto``` used . Again we don't remove if proto is ```kernel```.  Is ```KeepConfiguration=``` is not working ?

**Comment by yuwata** [comment]
`proto` seems not kernel:
> ```
> # ip -6 route ls table all
> local ::1 dev lo proto kernel metric 0 pref medium
> ::1 dev lo proto kernel metric 256 pref medium
> local 2003:*** dev eth0 proto kernel metric 0 pref medium
> 2003:***::/64 dev eth0 proto ra metric 1024 expires 7198sec pref medium
> 2003:***::/56 via fe80::ca0e:14ff:fe19:aa20 dev eth0 proto ra metric 1024 expires 1798sec pref medium
> local fe80::2fe:c8ff:fef7:108e dev eth0 proto kernel metric 0 pref medium
> fe80::/64 dev eth0 proto kernel metric 256 pref medium
> ff00::/8 dev eth0 metric 256 pref medium
> default via fe80::ca0e:14ff:fe19:aa20 dev eth0 proto ra metric 1024 expires 1798sec mtu 1492 pref medium
> ```

**Comment by yuwata** [comment]
The route is not added by networkd, but by kernel. However, proto is not kernel.

**Comment by yuwata** [comment]
@Tragetaschen I've updated #12977. Please test #12977 again. Thank you.

**Comment by Tragetaschen** [comment]
@yuwata Done. This works as advertised: `ff00::/8` remains and as a final consequence, systemd-resolved responds to LLMNR requests even after detaching / attaching the USB cable.

[…] Detaching for the first time
```
Jul 09 17:08:52 f000sx systemd-networkd[255]: eth0: Flags change: -LOWER_UP -RUNNING
Jul 09 17:08:52 f000sx systemd-networkd[255]: Sent message type=signal sender=n/a destination=n/a path=/org/freedesktop/network1/link/_36 interface=org.freedesktop.DBus.Properties member=PropertiesChanged cookie=30 reply_cookie=0 signature=sa{sv}as error-name=n/a error-message=n/a
Jul 09 17:08:52 f000sx systemd-networkd[255]: eth0: Lost carrier
Jul 09 17:08:52 f000sx systemd-networkd[255]: DHCP CLIENT (0xa6ad1711): STOPPED
Jul 09 17:08:52 f000sx systemd-networkd[255]: eth0: DHCP lease lost
Jul 09 17:08:52 f000sx systemd-networkd[255]: eth0: Removing route: dst: 192.168.1.1/32, src: n/a, gw: n/a, prefsrc: 192.168.1.183, scope: link, table: main, proto: 16, type: unicast
Jul 09 17:08:52 f000sx systemd-networkd[255]: eth0: Removing route: dst: n/a, src: n/a, gw: 192.168.1.1, prefsrc: 192.168.1.183, scope: global, table: main, proto: 16, type: unicast
Jul 09 17:08:52 f000sx systemd-networkd[255]: eth0: Removing address 192.168.1.183
Jul 09 17:08:52 f000sx systemd-networkd[255]: eth0: DHCPv6 lease lost
Jul 09 17:08:52 f000sx systemd-networkd[255]: NDISC: Stopping IPv6 Router Solicitation client
Jul 09 17:08:52 f000sx systemd-networkd[255]: eth0: Removing address 2003:***
Jul 09 17:08:52 f000sx systemd-networkd[255]: eth0: Removing address 192.168.1.183
Jul 09 17:08:52 f000sx systemd-networkd[255]: eth0: Removing route: dst: n/a, src: n/a, gw: 192.168.1.1, prefsrc: 192.168.1.183, scope: global, table: main, proto: 16, type: unicast
Jul 09 17:08:52 f000sx systemd-networkd[255]: eth0: Removing route: dst: 2003:***::/64, src: n/a, gw: n/a, prefsrc: n/a, scope: global, table: main, proto: 9, type: unicast
Jul 09 17:08:52 f000sx systemd-networkd[255]: eth0: Removing route: dst: n/a, src: n/a, gw: n/a, prefsrc: n/a, scope: global, table: main, proto: 0, type: unicast
Jul 09 17:08:52 f000sx systemd-networkd[255]: eth0: Removing route: dst: n/a, src: n/a, gw: fe80::ca0e:14ff:fe19:aa20, prefsrc: n/a, scope: global, table: main, proto: 9, type: unicast
Jul 09 17:08:52 f000sx systemd-networkd[255]: eth0: Removing route: dst: 2003:***::/56, src: n/a, gw: n/a, prefsrc: n/a, scope: global, table: main, proto: 0, type: unicast
Jul 09 17:08:52 f000sx systemd-networkd[255]: eth0: Removing route: dst: 192.168.1.1/32, src: n/a, gw: n/a, prefsrc: 192.168.1.183, scope: link, table: main, proto: 16, type: unicast
Jul 09 17:08:52 f000sx systemd-networkd[255]: eth0: State is configured, dropping config
Jul 09 17:08:52 f000sx systemd-networkd[255]: eth0: Removing route: dst: 2003:***::/56, src: n/a, gw: fe80::ca0e:14ff:fe19:aa20, prefsrc: n/a, scope: global, table: main, proto: 9, type: unicast
Jul 09 17:08:52 f000sx systemd-networkd[255]: Sent message type=signal sender=n/a destination=n/a path=/org/freedesktop/network1 interface=org.freedesktop.DBus.Properties member=PropertiesChanged cookie=31 reply_cookie=0 signature=sa{sv}as error-name=n/a error-message=n/a
Jul 09 17:08:52 f000sx systemd-networkd[255]: eth0: Forgetting route: dst: 192.168.1.1/32, src: n/a, gw: n/a, prefsrc: 192.168.1.183, scope: link, table: main, proto: 16, type: unicast
Jul 09 17:08:52 f000sx systemd-networkd[255]: eth0: Forgetting route: dst: n/a, src: n/a, gw: 192.168.1.1, prefsrc: 192.168.1.183, scope: global, table: main, proto: 16, type: unicast
Jul 09 17:08:52 f000sx systemd-networkd[255]: eth0: Forgetting address: 192.168.1.183/23 (valid for 1w 2d 23h 59min 35s)
Jul 09 17:08:52 f000sx systemd-networkd[255]: eth0: Forgetting route: dst: 192.168.0.0/23, src: n/a, gw: n/a, prefsrc: 192.168.1.183, scope: link, table: main, proto: kernel, type: unicast
Jul 09 17:08:52 f000sx systemd-networkd[255]: eth0: Forgetting route: dst: 192.168.1.255/32, src: n/a, gw: n/a, prefsrc: 192.168.1.183, scope: link, table: local, proto: kernel, type: broadcast
Jul 09 17:08:52 f000sx systemd-networkd[255]: eth0: Forgetting route: dst: 192.168.0.0/32, src: n/a, gw: n/a, prefsrc: 192.168.1.183, scope: link, table: local, proto: kernel, type: broadcast
Jul 09 17:08:52 f000sx systemd-networkd[255]: eth0: Forgetting route: dst: 192.168.1.183/32, src: n/a, gw: n/a, prefsrc: 192.168.1.183, scope: host, table: local, proto: kernel, type: local
Jul 09 17:08:52 f000sx systemd-networkd[255]: eth0: Forgetting address: 2003:***/64 (valid for 1h 59min 37s)
Jul 09 17:08:52 f000sx systemd-networkd[255]: Sent message type=signal sender=n/a destination=n/a path=/org/freedesktop/network1/link/_36 interface=org.freedesktop.DBus.Properties member=PropertiesChanged cookie=32 reply_cookie=0 signature=sa{sv}as error-name=n/a error-message=n/a
Jul 09 17:08:52 f000sx systemd-networkd[255]: Sent message type=signal sender=n/a destination=n/a path=/org/freedesktop/network1 interface=org.freedesktop.DBus.Properties member=PropertiesChanged cookie=33 reply_cookie=0 signature=sa{sv}as error-name=n/a error-message=n/a
Jul 09 17:08:52 f000sx systemd-networkd[255]: eth0: Forgetting route: dst: 2003:***/128, src: n/a, gw: n/a, prefsrc: n/a, scope: global, table: main, proto: kernel, type: local
Jul 09 17:08:52 f000sx systemd-networkd[255]: eth0: Forgetting route: dst: 2003:***::/64, src: n/a, gw: n/a, prefsrc: n/a, scope: global, table: main, proto: 9, type: unicast
Jul 09 17:08:52 f000sx systemd-networkd[255]: eth0: Forgetting route: dst: n/a, src: n/a, gw: fe80::ca0e:14ff:fe19:aa20, prefsrc: n/a, scope: global, table: main, proto: 9, type: unicast
Jul 09 17:08:52 f000sx systemd-networkd[255]: eth0: Forgetting route: dst: 2003:***::/56, src: n/a, gw: fe80::ca0e:14ff:fe19:aa20, prefsrc: n/a, scope: global, table: main, proto: 9, type: unicast
Jul 09 17:09:05 f000sx systemd-networkd[255]: NDISC: Sent Router Solicitation, next solicitation in 1min 5s
```
Attaching the cable for the second time. Hey, there's IPv6 stuff going on 🎉 
```
Jul 09 17:09:36 f000sx systemd-networkd[255]: eth0: Flags change: +LOWER_UP +RUNNING
Jul 09 17:09:36 f000sx systemd-networkd[255]: Sent message type=signal sender=n/a destination=n/a path=/org/freedesktop/network1/link/_36 interface=org.freedesktop.DBus.Properties member=PropertiesChanged cookie=34 reply_cookie=0 signature=sa{sv}as error-name=n/a error-message=n/a
Jul 09 17:09:36 f000sx systemd-networkd[255]: eth0: Gained carrier
Jul 09 17:09:36 f000sx systemd-networkd[255]: eth0: Acquiring DHCPv4 lease
Jul 09 17:09:36 f000sx systemd-networkd[255]: DHCP CLIENT (0x2fa9fd2f): STARTED on ifindex 6
Jul 09 17:09:36 f000sx systemd-networkd[255]: eth0: Discovering IPv6 routers
Jul 09 17:09:36 f000sx systemd-networkd[255]: NDISC: Started IPv6 Router Solicitation client
Jul 09 17:09:36 f000sx systemd-networkd[255]: eth0: State changed: configured -> configuring
Jul 09 17:09:36 f000sx systemd-networkd[255]: Sent message type=signal sender=n/a destination=n/a path=/org/freedesktop/network1/link/_36 interface=org.freedesktop.DBus.Properties member=PropertiesChanged cookie=35 reply_cookie=0 signature=sa{sv}as error-name=n/a error-message=n/a
Jul 09 17:09:36 f000sx systemd-networkd[255]: NDISC: Sent Router Solicitation, next solicitation in 3s
Jul 09 17:09:36 f000sx systemd-networkd[255]: DHCP CLIENT (0x2fa9fd2f): REQUEST (init-reboot)
Jul 09 17:09:36 f000sx systemd-networkd[255]: NDISC: Received Router Advertisement: flags OTHER preference medium lifetime 1800 sec
Jul 09 17:09:36 f000sx systemd-networkd[255]: NDISC: Invoking callback for 'router' event.
Jul 09 17:09:36 f000sx systemd-networkd[255]: DHCPv6 CLIENT: Started in Information request mode
Jul 09 17:09:36 f000sx systemd-networkd[255]: eth0: Acquiring DHCPv6 lease on NDisc request
Jul 09 17:09:36 f000sx systemd-networkd[255]: eth0: Configuring route: dst: n/a, src: n/a, gw: fe80::ca0e:14ff:fe19:aa20, prefsrc: n/a, scope: global, table: main, proto: 9, type: unicast
Jul 09 17:09:36 f000sx systemd-networkd[255]: eth0: Configuring route: dst: 2003:***::/64, src: n/a, gw: n/a, prefsrc: n/a, scope: global, table: main, proto: 9, type: unicast
Jul 09 17:09:36 f000sx systemd-networkd[255]: eth0: Configuring route: dst: n/a, src: n/a, gw: fe80::ca0e:14ff:fe19:aa20, prefsrc: n/a, scope: global, table: main, proto: 9, type: unicast
Jul 09 17:09:36 f000sx systemd-networkd[255]: eth0: Configuring route: dst: 2003:***::/56, src: n/a, gw: fe80::ca0e:14ff:fe19:aa20, prefsrc: n/a, scope: global, table: main, proto: 9, type: unicast
Jul 09 17:09:36 f000sx systemd-networkd[255]: DHCPv6 CLIENT: Sent INFORMATION-REQUEST
Jul 09 17:09:36 f000sx systemd-networkd[255]: DHCPv6 CLIENT: Next retransmission in 967ms
Jul 09 17:09:36 f000sx systemd-networkd[255]: DHCP CLIENT (0x2fa9fd2f): ACK
Jul 09 17:09:36 f000sx systemd-networkd[255]: DHCP CLIENT (0x2fa9fd2f): lease expires in 1w 2d 23h 59min 58s
Jul 09 17:09:36 f000sx systemd-networkd[255]: DHCP CLIENT (0x2fa9fd2f): T2 expires in 1w 1d 17h 59min 57s
Jul 09 17:09:36 f000sx systemd-networkd[255]: DHCP CLIENT (0x2fa9fd2f): T1 expires in 4d 23h 59min 57s
Jul 09 17:09:36 f000sx systemd-networkd[255]: eth0: DHCPv4 address 192.168.1.183/23 via 192.168.1.1
Jul 09 17:09:36 f000sx systemd-networkd[255]: eth0: Updating remembered route: dst: n/a, src: n/a, gw: fe80::ca0e:14ff:fe19:aa20, prefsrc: n/a, scope: global, table: main, proto: 9, type: unicast
Jul 09 17:09:36 f000sx systemd-networkd[255]: eth0: Updating remembered route: dst: 2003:***::/64, src: n/a, gw: n/a, prefsrc: n/a, scope: global, table: main, proto: 9, type: unicast
Jul 09 17:09:36 f000sx systemd-networkd[255]: eth0: Remembering updated address: 2003:***/64 (valid for 2h)
Jul 09 17:09:36 f000sx systemd-networkd[255]: eth0: Remembering route: dst: 2003:***::/56, src: n/a, gw: fe80::ca0e:14ff:fe19:aa20, prefsrc: n/a, scope: global, table: main, proto: 9, type: unicast
Jul 09 17:09:36 f000sx systemd-networkd[255]: eth0: Remembering updated address: 192.168.1.183/23 (valid for 1w 3d)
Jul 09 17:09:36 f000sx systemd-networkd[255]: Sent message type=signal sender=n/a destination=n/a path=/org/freedesktop/network1/link/_36 interface=org.freedesktop.DBus.Properties member=PropertiesChanged cookie=36 reply_cookie=0 signature=sa{sv}as error-name=n/a error-message=n/a
Jul 09 17:09:36 f000sx systemd-networkd[255]: DHCPv6 CLIENT: Recv REPLY
Jul 09 17:09:36 f000sx systemd-networkd[255]: Sent message type=signal sender=n/a destination=n/a path=/org/freedesktop/network1 interface=org.freedesktop.DBus.Properties member=PropertiesChanged cookie=37 reply_cookie=0 signature=sa{sv}as error-name=n/a error-message=n/a
Jul 09 17:09:36 f000sx systemd-networkd[255]: eth0: Remembering route: dst: 192.168.1.183/32, src: n/a, gw: n/a, prefsrc: 192.168.1.183, scope: host, table: local, proto: kernel, type: local
Jul 09 17:09:36 f000sx systemd-networkd[255]: eth0: Remembering route: dst: 192.168.1.255/32, src: n/a, gw: n/a, prefsrc: 192.168.1.183, scope: link, table: local, proto: kernel, type: broadcast
Jul 09 17:09:36 f000sx systemd-networkd[255]: eth0: Remembering route: dst: 192.168.0.0/23, src: n/a, gw: n/a, prefsrc: 192.168.1.183, scope: link, table: main, proto: kernel, type: unicast
Jul 09 17:09:36 f000sx systemd-networkd[255]: eth0: Remembering route: dst: 192.168.0.0/32, src: n/a, gw: n/a, prefsrc: 192.168.1.183, scope: link, table: local, proto: kernel, type: broadcast
Jul 09 17:09:36 f000sx systemd-networkd[255]: eth0: DHCP: No routes received from DHCP server: No data available
Jul 09 17:09:36 f000sx systemd-networkd[255]: eth0: Configuring route: dst: 192.168.1.1/32, src: n/a, gw: n/a, prefsrc: 192.168.1.183, scope: link, table: main, proto: 16, type: unicast
Jul 09 17:09:36 f000sx systemd-networkd[255]: eth0: Configuring route: dst: n/a, src: n/a, gw: 192.168.1.1, prefsrc: 192.168.1.183, scope: global, table: main, proto: 16, type: unicast
Jul 09 17:09:36 f000sx systemd-networkd[255]: eth0: Updating remembered route: dst: 192.168.1.1/32, src: n/a, gw: n/a, prefsrc: 192.168.1.183, scope: link, table: main, proto: 16, type: unicast
Jul 09 17:09:36 f000sx systemd-networkd[255]: eth0: Updating remembered route: dst: n/a, src: n/a, gw: 192.168.1.1, prefsrc: 192.168.1.183, scope: global, table: main, proto: 16, type: unicast
Jul 09 17:09:37 f000sx systemd-networkd[255]: eth0: Remembering updated address: 2003:***/64 (valid for 1h 59min 59s)
Jul 09 17:09:37 f000sx systemd-networkd[255]: eth0: Configured
Jul 09 17:09:37 f000sx systemd-networkd[255]: eth0: State changed: configuring -> configured
Jul 09 17:09:37 f000sx systemd-networkd[255]: Sent message type=signal sender=n/a destination=n/a path=/org/freedesktop/network1/link/_36 interface=org.freedesktop.DBus.Properties member=PropertiesChanged cookie=38 reply_cookie=0 signature=sa{sv}as error-name=n/a error-message=n/a
Jul 09 17:09:37 f000sx systemd-networkd[255]: eth0: Remembering route: dst: 2003:***/128, src: n/a, gw: n/a, prefsrc: n/a, scope: global, table: main, proto: kernel, type: local
Jul 09 17:09:48 f000sx systemd-networkd[255]: NDISC: No RA received before link confirmation timeout
Jul 09 17:09:48 f000sx systemd-networkd[255]: NDISC: Invoking callback for 'timeout' event.
```
Detaching for the second time
```
Jul 09 17:09:52 f000sx systemd-networkd[255]: eth0: Flags change: -LOWER_UP -RUNNING
Jul 09 17:09:52 f000sx systemd-networkd[255]: Sent message type=signal sender=n/a destination=n/a path=/org/freedesktop/network1/link/_36 interface=org.freedesktop.DBus.Properties member=PropertiesChanged cookie=39 reply_cookie=0 signature=sa{sv}as error-name=n/a error-message=n/a
Jul 09 17:09:52 f000sx systemd-networkd[255]: eth0: Lost carrier
Jul 09 17:09:52 f000sx systemd-networkd[255]: DHCP CLIENT (0x2fa9fd2f): STOPPED
Jul 09 17:09:52 f000sx systemd-networkd[255]: eth0: DHCP lease lost
Jul 09 17:09:52 f000sx systemd-networkd[255]: eth0: Removing route: dst: 192.168.1.1/32, src: n/a, gw: n/a, prefsrc: 192.168.1.183, scope: link, table: main, proto: 16, type: unicast
Jul 09 17:09:52 f000sx systemd-networkd[255]: eth0: Removing route: dst: n/a, src: n/a, gw: 192.168.1.1, prefsrc: 192.168.1.183, scope: global, table: main, proto: 16, type: unicast
Jul 09 17:09:52 f000sx systemd-networkd[255]: eth0: Removing address 192.168.1.183
Jul 09 17:09:52 f000sx systemd-networkd[255]: eth0: DHCPv6 lease lost
Jul 09 17:09:52 f000sx systemd-networkd[255]: NDISC: Stopping IPv6 Router Solicitation client
Jul 09 17:09:52 f000sx systemd-networkd[255]: eth0: Removing address 2003:***
Jul 09 17:09:52 f000sx systemd-networkd[255]: eth0: Removing address 192.168.1.183
Jul 09 17:09:52 f000sx systemd-networkd[255]: eth0: Removing route: dst: n/a, src: n/a, gw: 192.168.1.1, prefsrc: 192.168.1.183, scope: global, table: main, proto: 16, type: unicast
Jul 09 17:09:52 f000sx systemd-networkd[255]: eth0: Removing route: dst: 2003:***::/64, src: n/a, gw: n/a, prefsrc: n/a, scope: global, table: main, proto: 9, type: unicast
Jul 09 17:09:52 f000sx systemd-networkd[255]: eth0: Removing route: dst: n/a, src: n/a, gw: n/a, prefsrc: n/a, scope: global, table: main, proto: 0, type: unicast
Jul 09 17:09:52 f000sx systemd-networkd[255]: eth0: Removing route: dst: 2003:***::/56, src: n/a, gw: n/a, prefsrc: n/a, scope: global, table: main, proto: 0, type: unicast
Jul 09 17:09:52 f000sx systemd-networkd[255]: eth0: Removing route: dst: n/a, src: n/a, gw: fe80::ca0e:14ff:fe19:aa20, prefsrc: n/a, scope: global, table: main, proto: 9, type: unicast
Jul 09 17:09:52 f000sx systemd-networkd[255]: eth0: Removing route: dst: 192.168.1.1/32, src: n/a, gw: n/a, prefsrc: 192.168.1.183, scope: link, table: main, proto: 16, type: unicast
Jul 09 17:09:52 f000sx systemd-networkd[255]: eth0: State is configured, dropping config
Jul 09 17:09:52 f000sx systemd-networkd[255]: eth0: Removing route: dst: 2003:***::/56, src: n/a, gw: fe80::ca0e:14ff:fe19:aa20, prefsrc: n/a, scope: global, table: main, proto: 9, type: unicast
Jul 09 17:09:52 f000sx systemd-networkd[255]: Sent message type=signal sender=n/a destination=n/a path=/org/freedesktop/network1 interface=org.freedesktop.DBus.Properties member=PropertiesChanged cookie=40 reply_cookie=0 signature=sa{sv}as error-name=n/a error-message=n/a
Jul 09 17:09:52 f000sx systemd-networkd[255]: eth0: Forgetting route: dst: 192.168.1.1/32, src: n/a, gw: n/a, prefsrc: 192.168.1.183, scope: link, table: main, proto: 16, type: unicast
Jul 09 17:09:52 f000sx systemd-networkd[255]: eth0: Forgetting route: dst: n/a, src: n/a, gw: 192.168.1.1, prefsrc: 192.168.1.183, scope: global, table: main, proto: 16, type: unicast
Jul 09 17:09:52 f000sx systemd-networkd[255]: eth0: Forgetting address: 192.168.1.183/23 (valid for 1w 2d 23h 59min 44s)
Jul 09 17:09:52 f000sx systemd-networkd[255]: eth0: Forgetting route: dst: 192.168.0.0/23, src: n/a, gw: n/a, prefsrc: 192.168.1.183, scope: link, table: main, proto: kernel, type: unicast
Jul 09 17:09:52 f000sx systemd-networkd[255]: eth0: Forgetting route: dst: 192.168.1.255/32, src: n/a, gw: n/a, prefsrc: 192.168.1.183, scope: link, table: local, proto: kernel, type: broadcast
Jul 09 17:09:52 f000sx systemd-networkd[255]: eth0: Forgetting route: dst: 192.168.0.0/32, src: n/a, gw: n/a, prefsrc: 192.168.1.183, scope: link, table: local, proto: kernel, type: broadcast
Jul 09 17:09:52 f000sx systemd-networkd[255]: eth0: Forgetting route: dst: 192.168.1.183/32, src: n/a, gw: n/a, prefsrc: 192.168.1.183, scope: host, table: local, proto: kernel, type: local
Jul 09 17:09:52 f000sx systemd-networkd[255]: eth0: Forgetting address: 2003:***/64 (valid for 1h 59min 44s)
Jul 09 17:09:52 f000sx systemd-networkd[255]: Sent message type=signal sender=n/a destination=n/a path=/org/freedesktop/network1/link/_36 interface=org.freedesktop.DBus.Properties member=PropertiesChanged cookie=41 reply_cookie=0 signature=sa{sv}as error-name=n/a error-message=n/a
Jul 09 17:09:52 f000sx systemd-networkd[255]: Sent message type=signal sender=n/a destination=n/a path=/org/freedesktop/network1 interface=org.freedesktop.DBus.Properties member=PropertiesChanged cookie=42 reply_cookie=0 signature=sa{sv}as error-name=n/a error-message=n/a
Jul 09 17:09:52 f000sx systemd-networkd[255]: eth0: Forgetting route: dst: 2003:***/128, src: n/a, gw: n/a, prefsrc: n/a, scope: global, table: main, proto: kernel, type: local
Jul 09 17:09:52 f000sx systemd-networkd[255]: eth0: Forgetting route: dst: 2003:***::/64, src: n/a, gw: n/a, prefsrc: n/a, scope: global, table: main, proto: 9, type: unicast
Jul 09 17:09:52 f000sx systemd-networkd[255]: eth0: Forgetting route: dst: n/a, src: n/a, gw: fe80::ca0e:14ff:fe19:aa20, prefsrc: n/a, scope: global, table: main, proto: 9, type: unicast
Jul 09 17:09:52 f000sx systemd-networkd[255]: eth0: Forgetting route: dst: 2003:***::/56, src: n/a, gw: fe80::ca0e:14ff:fe19:aa20, prefsrc: n/a, scope: global, table: main, proto: 9, type: unicast
Jul 09 17:10:10 f000sx systemd-networkd[255]: NDISC: Sent Router Solicitation, next solicitation in 2min 16s
```
Removing the adapter
```
Jul 09 17:10:19 f000sx systemd-networkd[255]: eth0: Flags change: -UP
Jul 09 17:10:19 f000sx systemd-networkd[255]: Sent message type=signal sender=n/a destination=n/a path=/org/freedesktop/network1/link/_36 interface=org.freedesktop.DBus.Properties member=PropertiesChanged cookie=43 reply_cookie=0 signature=sa{sv}as error-name=n/a error-message=n/a
Jul 09 17:10:19 f000sx systemd-networkd[255]: LLDP: Stopping LLDP client
Jul 09 17:10:19 f000sx systemd-networkd[255]: eth0: Stopped LLDP.
Jul 09 17:10:19 f000sx systemd-networkd[255]: eth0: Forgetting route: dst: fe80::2fe:c8ff:fef7:108e/128, src: n/a, gw: n/a, prefsrc: n/a, scope: global, table: main, proto: kernel, type: local
Jul 09 17:10:19 f000sx systemd-networkd[255]: eth0: Forgetting route: dst: fe80::/64, src: n/a, gw: n/a, prefsrc: n/a, scope: global, table: main, proto: kernel, type: unicast
Jul 09 17:10:19 f000sx systemd-networkd[255]: eth0: Forgetting route: dst: ff00::/8, src: n/a, gw: n/a, prefsrc: n/a, scope: global, table: main, proto: boot, type: unicast
Jul 09 17:10:19 f000sx systemd-networkd[255]: eth0: Forgetting address: fe80::2fe:c8ff:fef7:108e/64 (valid forever)
Jul 09 17:10:19 f000sx systemd-networkd[255]: Sent message type=signal sender=n/a destination=n/a path=/org/freedesktop/network1/link/_36 interface=org.freedesktop.DBus.Properties member=PropertiesChanged cookie=44 reply_cookie=0 signature=sa{sv}as error-name=n/a error-message=n/a
Jul 09 17:10:19 f000sx systemd-networkd[255]: eth0: State changed: configured -> linger
Jul 09 17:10:19 f000sx systemd-networkd[255]: Sent message type=signal sender=n/a destination=n/a path=/org/freedesktop/network1/link/_36 interface=org.freedesktop.DBus.Properties member=PropertiesChanged cookie=45 reply_cookie=0 signature=sa{sv}as error-name=n/a error-message=n/a
Jul 09 17:10:19 f000sx systemd-networkd[255]: eth0: Link removed
Jul 09 17:10:19 f000sx systemd-networkd[255]: DHCP CLIENT (0x0): FREE
Jul 09 17:10:19 f000sx systemd-networkd[255]: eth0: Ignoring udev remove event for device.
```

**Comment by yuwata** [comment]
@Tragetaschen Thanks a lot!
