### ISSUE TITLE
Disabling RapidCommit doesn't work.

### ISSUE THREAD

**Issue by janfrode** [systemd/systemd#22633]
**systemd version the issue has been seen with**
 249.7 

**Used distribution**

Nixos 21.11

**Linux kernel version used** (`uname -a`)

`Linux hjemmerouter 5.10.101 #1-NixOS SMP Wed Feb 16 11:54:31 UTC 2022 x86_64 GNU/Linux`

**CPU architecture issue was seen on**

x86_64

**Expected behaviour you didn't see**

Sniffing traffic from interface with  with the following networkd config:

```
[Match]
Name=wan
[Network]
DHCP=yes
Domains=tanso.net
[DHCPv6]
RapidCommit=no
```

shows Rapid Commit in the packet dump

```
DHCPv6
    Message type: Solicit (1)
    Transaction ID: 0x89be01
    Rapid Commit.                   <-----------------
        Option: Rapid Commit (14)           <-----------------
        Length: 0
    Identity Association for Non-temporary Address
        Option: Identity Association for Non-temporary Address (3)
        Length: 12
        IAID: e887e9bd
        T1: 0
        T2: 0
    Client Fully Qualified Domain Name
        Option: Client Fully Qualified Domain Name (39)
        Length: 14
        Flags: 0x01  [CLIENT wants SERVER to update both its AAAA and PTR RRs]
            .... .0.. = N bit: Server SHOULD perform PTR RR updates
            .... ...1 = S bit: Server SHOULD perform AAAA RR updates
        Partial domain name: hjemmerouter 
```

I believe this is what's causing my IPv6 delegation to fail. Systemd-networkd logs:

```
systemd-networkd[100123]: wan: DHCPv6 client: Sent SOLICIT
systemd-networkd[100123]: wan: DHCPv6 client: Next retransmission in 1min 58s
systemd-networkd[100123]: wan: DHCPv6 client: ADVERTISE Status Unspecified failure
systemd-networkd[100123]: wan: DHCPv6 client: Recv ADVERTISE
```

and all I see of replies from the DHCPv6 server is an "Advertise" with status code  UnspecFail.

**Comment by janfrode** [comment]
Ooops, I might be confused. I see now that RapidCommit yes/no controls the sending of option request Rapid Commit, and that part is working. I was just confused about seeing the Rapid Commit section in the start of the decode no matter if it was enabled or not.

```
    Option Request
        Option: Option Request (6)
        Length: 10
        Requested Option code: DNS recursive name server (23)
        Requested Option code: Domain Search List (24)
        Requested Option code: NTP Server (56)
        Requested Option code: Simple Network Time Protocol Server (31)
        Requested Option code: Rapid Commit (14)
```

**Comment by yuwata** [comment]
Note, the `RapidCommit=` setting is removed by 308d01f3c4decf3240ca0c6c7f91049953df7299 (v250). And the option will never be appended to `Option Request` field.

**Comment by yuwata** [comment]
@janfrode Are there any chance to test v250 or the current git HEAD?

**Comment by yuwata** [comment]
Also, could you show the complete dump in hex? Both REQUEST and ADVERTISE please.

**Comment by janfrode** [comment]
For every solicit, I receive 2 advertise with Status Unspecified failure

```
# tshark -P -w /tmp/dhcpv6.pcat -s 0 -c 3  -i wan -n '(udp port 546 and port 547)'
1 0.000000000 fe80::eea8:6bff:fef4:8183 → ff02::1:2    DHCPv6 181 Solicit XID: 0xee0d15 CID: 0001000100000000eca86bf48183
2 0.002910349 fe80::202:ff:fe01:5 → fe80::eea8:6bff:fef4:8183 DHCPv6 104 Advertise XID: 0xee0d15 CID: 0001000100000000eca86bf48183
3 0.002910420 fe80::202:ff:fe01:5 → fe80::eea8:6bff:fef4:8183 DHCPv6 104 Advertise XID: 0xee0d15 CID: 0001000100000000eca86bf48183
```

```
# tcpdump -r /tmp/dhcpv6.pcat -X -n -s 0
reading from file /tmp/dhcpv6.pcat, link-type EN10MB (Ethernet), snapshot length 262144
08:58:53.794683 IP6 fe80::eea8:6bff:fef4:8183.546 > ff02::1:2.547: dhcp6 solicit
	0x0000:  6007 e6f0 007f 1101 fe80 0000 0000 0000  `...............
	0x0010:  eea8 6bff fef4 8183 ff02 0000 0000 0000  ..k.............
	0x0020:  0000 0000 0001 0002 0222 0223 007f d937  .........".#...7
	0x0030:  01ee 0d15 000e 0000 0003 000c e887 e9bd  ................
	0x0040:  0000 0000 0000 0000 0027 000a 0108 6a61  .........'....ja
	0x0050:  6e66 726f 6465 0019 0029 e887 e9bd 0000  nfrode...)......
	0x0060:  0000 0000 0000 001a 0019 0000 0000 0000  ................
	0x0070:  0000 3800 0000 0000 0000 0000 0000 0000  ..8.............
	0x0080:  0000 0000 0600 0800 1700 1800 3800 1f00  ............8...
	0x0090:  0100 0e00 0100 0100 0000 00ec a86b f481  .............k..
	0x00a0:  8300 0800 02ff ff                        .......
08:58:53.797594 IP6 fe80::202:ff:fe01:5.547 > fe80::eea8:6bff:fef4:8183.546: dhcp6 advertise
	0x0000:  6e00 0000 0032 111e fe80 0000 0000 0000  n....2..........
	0x0010:  0202 00ff fe01 0005 fe80 0000 0000 0000  ................
	0x0020:  eea8 6bff fef4 8183 0223 0222 0032 44fa  ..k......#.".2D.
	0x0030:  02ee 0d15 0002 000a 0003 0001 e4c7 224c  .............."L
	0x0040:  ebb7 0001 000e 0001 0001 0000 0000 eca8  ................
	0x0050:  6bf4 8183 000d 0002 0001                 k.........
08:58:53.797594 IP6 fe80::202:ff:fe01:5.547 > fe80::eea8:6bff:fef4:8183.546: dhcp6 advertise
	0x0000:  6e00 0000 0032 111e fe80 0000 0000 0000  n....2..........
	0x0010:  0202 00ff fe01 0005 fe80 0000 0000 0000  ................
	0x0020:  eea8 6bff fef4 8183 0223 0222 0032 44fa  ..k......#.".2D.
	0x0030:  02ee 0d15 0002 000a 0003 0001 e4c7 224c  .............."L
	0x0040:  ebb7 0001 000e 0001 0001 0000 0000 eca8  ................
	0x0050:  6bf4 8183 000d 0002 0001                 k.........

```

**Comment by janfrode** [comment]
Unfortunately I don't quite see how I can upgrade top v250, as it isn't available in the NixOS 21.11 or unstable repositories. Installing systemd from source is a bit beyond my NixOS skills at the moment..

**Comment by yuwata** [comment]
Thanks.

- SOLICIT message

IP header
```
6007 e6f0 007f 1101 fe80 0000 0000 0000
eea8 6bff fef4 8183 ff02 0000 0000 0000
0000 0000 0001 0002
```
UDP header
```
0222 0223 007f d937
```
DHCP message header
```
01ee 0d15
```
RAPID COMMIT
```
000e 0000
```
IA_NA
```
0003 000c e887 e9bd 0000 0000 0000 0000
```
CLIENT FQDN
```
0027 000a 0108 6a61 6e66 726f 6465
```
IA_PD
```
0019 0029
e887 e9bd 0000 0000 0000 0000 001a 0019
0000 0000 0000 0000 3800 0000 0000 0000
0000 0000 0000 0000 00
```
ORO
```
0006 0008 0017 0018 0038 001f
```
CLIENT ID
```
0001 000e 0001 0001 0000 0000 eca8 6bf4 8183
```
ELAPSED TIME
```
0008 0002 ffff
```
- ADVERTISE message

IP header
```
6e00 0000 0032 111e fe80 0000 0000 0000
0202 00ff fe01 0005 fe80 0000 0000 0000
eea8 6bff fef4 8183
```

UDP header
```
0223 0222 0032 44fa
```
DHCP message header
```
02ee 0d15
```
SERVER ID
```
0002 000a 0003 0001 e4c7 224c ebb7
```
CLIENT ID
```
0001 000e 0001 0001 0000 0000 eca8 6bf4 8183
```
STATUS CODE (UNSPEC_FAIL)
```
000d 0002 0001
```

**Comment by yuwata** [comment]
One strange point is that elapsed time option is `ffff`, which means the transaction is started more than 2^16 * 10 sec ~ 1 week.
@janfrode When did you restart systemd-networkd last time?

**Comment by janfrode** [comment]
I restarted systemd-networkd it several times yesterday.. Clock on this server is in sync with NTP,  server was rebooted 3 days ago.

**Comment by yuwata** [comment]
Hmm. Does the last 2 bytes of the SOLICIT message are always `ffff` even if just after networkd is restarted? Could you try to restart networkd one more time?

**Comment by janfrode** [comment]
Restarted now, and the tshark decode says Elapsed time: 0ms on first advertise, 10 ms on next, then 1070ms...

**Comment by janfrode** [comment]
[dhcpv6.pcap.gz](https://github.com/systemd/systemd/files/8160766/dhcpv6.pcap.gz)

the first few packages captured after restarting networkd.

**Comment by yuwata** [comment]
Oops. I misuderstand the value. the value `ffff` means 2^16 * 10 msec (not sec) ~ 65 sec, then that's not strange.

So, only skeptical point seems RAPID COMMIT option as you first commented.

Are there any chance to use other dhcp clients, e.g. dnsmasq or dhcpcd? If they work fine, could you provide messages?

**Comment by janfrode** [comment]
dhcpcd works fine for simple IPv6 address assignment (I switched to networkd for prefix delegation).  Tried dhcpcd again now:

**Comment by janfrode** [comment]
No rapid commit in the solicit, which I suspect is what's making the dhcp server fail..

```
DHCPv6
    Message type: Solicit (1)
    Transaction ID: 0x8c8e0e
    Client Identifier
        Option: Client Identifier (1)
        Length: 18
        DUID: 000404d3138047b911e2909ceca86bf48183
        DUID Type: Universally Unique IDentifier (UUID) (4)
        UUID: 04d3138047b911e2909ceca86bf48183
    Elapsed time
        Option: Elapsed time (8)
        Length: 2
        Elapsed time: 0ms
    Vendor Class
        Option: Vendor Class (16)
        Length: 53
        Enterprise ID: DHCPCD Project (40712)
        vendor-class-data: dhcpcd-8.1.4:Linux-5.10.101:x86_64:GenuineIntel
    Identity Association for Non-temporary Address
        Option: Identity Association for Non-temporary Address (3)
        Length: 12
        IAID: ff00000a
        T1: 0
        T2: 0
    Reconfigure Accept
        Option: Reconfigure Accept (20)
        Length: 0
    Option Request
        Option: Option Request (6)
        Length: 4
        Requested Option code: SOL_MAX_RT (82)
        Requested Option code: INF_MAX_RT (83)
```

**Comment by yuwata** [comment]
Okay, thanks. Let's re-introduce `RapidCommit=` setting. I will prep a patch soon later.

**Comment by janfrode** [comment]
I'm surprised you want to re-introduce RapidCommit setting.. I expected it was more a need of properly removing it.. But I don't understand the difference between "Requested Option code: Rapid Commit" and the Rapid Commit "header"?

Do you think the problem here is a DHCP server issue -- That it's getting UnSpecFail if this "header" is included, or is networkd sending a malformed solicit here?

**Comment by yuwata** [comment]
Re-introducing `RapidCommit=` does not means reverting 308d01f3c4decf3240ca0c6c7f91049953df7299. But the setting controls whether RAPID COMMIT is appended or not.
RAPID COMMIT must not be included in ORO (Requested Option code), even if `RapidCommit=` is enabled.

> Do you think the problem here is a DHCP server issue -- That it's getting UnSpecFail if this "header" is included, or is networkd sending a malformed solicit here?

I guess this is a bug or mis-implementation of RAPID COMMIT support in your DHCP server.

**Comment by yuwata** [comment]
Before re-implementing `RapidCommit=` setting, could you enable the RAPID COMMIT option in dhcpcd, and checks the server returned an error code?

**Comment by yuwata** [comment]
Hmmm, so the rapid commit option is not relevant to your issue...

With dhcpcd, you use UUID as the client ID. Does your server filter incoming SOLICIT messages with the client ID? What happens when you use the same UUID as the client ID in networkd, or use a different client ID in dhcpcd?

**Comment by janfrode** [comment]
Last weekend I had some success with getting an IPv6 address assigned after changing DUID to UUID (ref: https://discourse.nixos.org/t/dhcpv6-with-networkd-not-triggering/17899/7 ), but it failed as soon as I added "DHCPv6PrefixDelegation=yes" on one of my internal interfaces. But for some reason I can no longer get back to this state now..

ISP told me that they have this distribution of DUIDs:

~60% Type 1 - Link-layer address plus time (DUID-LLT)
~40% Type 3 - Link-layer address (DUID-LL)
12 instances Type 4 - Universally Unique Identifier (DUID-UUID)
0 of Type 2  - Vendor Based on Enterprise Number (DUID-EN)

I don't think they filter on DUID-EN, but it might look like not the best option..  I'll switch to DUID-LLT (which is what the server uses in its advertise).

**Comment by yuwata** [comment]
Hmm... Then, there is almost nothing we can do. At least I have no idea about why it is so unstable. Please try to contact to your ISP.

**Comment by janfrode** [comment]
Yes, I'm working with my ISP. He sees my solicit on the DHCP server, and gives out successful advertise messages.. but apparently the DHCP relay agent on their service routers is messing it up, and adds the unspecfail... I'll update this case when we have a solution (in case you're interested).

**Comment by yuwata** [comment]
OK. Let's close this at least temporary, as this smells like a server side issue. Please request to reopen if we need to fix or support something. Thanks.

**Comment by ti-mo** [comment]
@yuwata Sorry to dig up this thread. Why was disabling RapidCommit removed? My ISP's router (CH7465LG) sends a reply with a valid IA_PD to a solicit with the rapid commit option set, but doesn't actually commit that prefix to its routing table..

However, it does work when using 4-message exchange, or when sending a `renew` message after the solicit/reply. Unfortunately, `networkctl renew <iface>` does not seem to be implemented for the networkd dhcpv6 client.

This process needs to be repeated each time the modem reboots, as it doesn't seem to persist any state. Currently working around this by running a custom Go dhcp6 client on a separate LL address that runs the 4-message exchange every 5 mins. It would be nice if this could be replaced by a `networkctl reconfigure <iface>` cron job, but networkd would have to implement 4-message exchange for that.

**Comment by yuwata** [comment]
@ti-mo Could you open a new issue with dumped packets?

**Comment by ti-mo** [comment]
@yuwata Thanks for the response, created an issue for this: https://github.com/systemd/systemd/issues/24065.
