### ISSUE TITLE
Drops order of nameservers

### ISSUE THREAD

**Issue by AlexRydzewski** [systemd/systemd#22581]
**systemd version the issue has been seen with**
 > 237

**Used distribution**
 > Ubuntu 18.04.3 LTS

**Linux kernel version used** (`uname -a`)

 > `4.15.0-167-generic`

**CPU architecture issue was seen on**
 > x86_64

**Expected behaviour you didn't see**
 > resolve following the list of nameservers

**Unexpected behaviour you saw**
> Host receive dns configuration trhough DHCP. Some time later the first server in the nameserver list become ignored.
```
~ # systemd-resolve --status
Global
          DNSSEC NTA: 10.in-addr.arpa
                      16.172.in-addr.arpa
                      ...
                      31.172.in-addr.arpa
                      corp
                      ...
                      test
Link 2 (eth0)
      Current Scopes: DNS
       LLMNR setting: yes
MulticastDNS setting: no
      DNSSEC setting: no
    DNSSEC supported: no
         DNS Servers: 10.10.10.10
                      1.1.1.1
          DNS Domain: my.rfc1918.domain
~ # host somename
Host somename not found: 2(SERVFAIL)
~ # tcpdump -i eth0 -n port 53
11:35:42.278202 IP 172.28.2.184.49413 > 1.1.1.1.53: 21427+ [1au] A? somename.my.rfc1918.domain. (91)
11:35:42.278394 IP 172.28.2.184.60364 > 1.1.1.1.53: 2261+ [1au] AAAA? somename.my.rfc1918.domain. (91)
11:35:42.305203 IP 1.1.1.1.53 > 172.28.2.184.49413: 21427 NXDomain 0/1/1 (153)
11:35:42.305377 IP 172.28.2.184.49413 > 1.1.1.1.53: 21427+ A? somename.my.rfc1918.domain. (80)
11:35:42.311126 IP 1.1.1.1.53 > 172.28.2.184.49413: 21427 NXDomain 0/1/0 (142)
11:35:42.311326 IP 1.1.1.1.53 > 172.28.2.184.60364: 2261 NXDomain 0/1/1 (153)
~ # host someserver 10.10.10.10
Using domain server:
Name: 10.10.10.10
Address: 10.10.10.10#53
Aliases: 
someserver.my.rfc1918.domain is an alias for router.my.rfc1918.domain.
router.my.rfc1918.domain has address 10.10.10.1
```

**Steps to reproduce the problem**
 > The problem explanation contain enough.

**Additional program output to the terminal or log subsystem illustrating the issue**

```
    Restarting systemd-resolve return normal state.
    Journals do not contain any relevant to the problem, however I don't used debug option.
    How I can understand the reason of the problem?
    What I can do for that?
```

**Comment by poettering** [comment]
I am sorry, but what's the issue precisely? You defined two DNS servers on the same iface, but you don't want one of them to be used? why do you set it then? 

Or as you just asking for #5755?

generally: if systemd-resolved switches to the next DNS server on some failure, and sticks to it. When it reached the end it starts from the beginning, i.e. round robin. But to speed things up it remembers this between queries, i.e. sticks as long with the same DNS server as it can.

in the debug output you'll find a note whenever it switches to the next.
