### ISSUE TITLE
resolved: manage caches smarter when having multiple matching scopes: always collect all replies even when we got a good reply, do not issue packets when any scope already has cached reply

### ISSUE THREAD

**Issue by rpigott** [systemd/systemd#31688]
### systemd version the issue has been seen with

255

### Used distribution

Arch Linux

### Linux kernel version used

6.7.9-arch1-1

### CPU architectures issue was seen on

x86_64

### Component

systemd-resolved

### Expected behaviour you didn't see

Multi-scoped questions in sd-resolved may send requests to multiple dns servers. This is reproducible for example with one default route with a dns server configured, and one global unicast dns server defined in resolved.conf. The expectation is that queries are sent only with the first request, and subsequent queries are handled by the cache.

### Unexpected behaviour you saw

Instead, sd-resolved abandons the query as soon as it can be resolved, and the remaining transactions are gc'd before they complete, never filling the cache. As a consequence, each subsequent request also generates new questions which are promptly abandoned as the query is immediately filled from the one positive cache entry.

sd-resolved should not send new network requests in this case, especially requests where it does not intended to listen for the answer. Either by waiting until all transactions complete to fill the cache, or by suppressing new transactions when a query can be resolved from the cache.

### Steps to reproduce the problem

Add a global dns server in /etc/resolved.conf

```
[Resolve]
DNS=1.1.1.1
```

Add a link-scope dns server to a default route link:

```
[Network]
DNS=1.0.0.1
```

Send several resolve requests
```
$ repeat 5 resolvectl query -t A example.com
``` 

Observe that sd-resolved always generates new network queries for each new request toward whichever server who's cache has been starved.

### Additional program output to the terminal or log subsystem illustrating the issue

```sh
$ resolvectl status
Global
           Protocols: +LLMNR +mDNS -DNSOverTLS DNSSEC=no/unsupported
    resolv.conf mode: stub
  Current DNS Server: 1.1.1.1
         DNS Servers: 1.1.1.1

Link 2 (enp7s0)
    Current Scopes: DNS LLMNR/IPv4 LLMNR/IPv6 mDNS/IPv4 mDNS/IPv6
         Protocols: +DefaultRoute +LLMNR +mDNS -DNSOverTLS DNSSEC=no/unsupported
Current DNS Server: 1.0.0.1
       DNS Servers: 1.0.0.1

$ sudo resolvectl show-cache
Scope protocol=dns ifindex=2 ifname=enp7s0
No entries.
Scope protocol=dns
example.com IN A 93.184.216.34

$ sudo tcpdump -nli enp7s0 port domain # repeat 5 resolvectl query -t A example.com
tcpdump: verbose output suppressed, use -v[v]... for full protocol decode
listening on enp7s0, link-type EN10MB (Ethernet), snapshot length 262144 bytes
14:08:53.789847 IP 10.3.0.5.38813 > 1.1.1.1.53: 59511+ [1au] A? example.com. (40)
14:08:53.789861 IP 10.3.0.5.36410 > 1.0.0.1.53: 26084+ [1au] A? example.com. (40)
14:08:53.821228 IP 1.1.1.1.53 > 10.3.0.5.38813: 59511 1/0/1 A 93.184.216.34 (56)
14:08:53.821571 IP 1.0.0.1.53 > 10.3.0.5.36410: 26084 1/0/1 A 93.184.216.34 (56)
14:08:55.550342 IP 10.3.0.5.60184 > 1.0.0.1.53: 44311+ [1au] A? example.com. (40)
14:08:55.581758 IP 1.0.0.1.53 > 10.3.0.5.60184: 44311 1/0/1 A 93.184.216.34 (56)
14:08:56.320633 IP 10.3.0.5.59888 > 1.0.0.1.53: 35979+ [1au] A? example.com. (40)
14:08:56.351344 IP 1.0.0.1.53 > 10.3.0.5.59888: 35979 1/0/1 A 93.184.216.34 (56)
14:08:58.493605 IP 10.3.0.5.44639 > 1.0.0.1.53: 53478+ [1au] A? example.com. (40)
14:08:58.525040 IP 1.0.0.1.53 > 10.3.0.5.44639: 53478 1/0/1 A 93.184.216.34 (56)
14:08:58.893562 IP 10.3.0.5.60516 > 1.0.0.1.53: 4004+ [1au] A? example.com. (40)
14:08:58.925069 IP 1.0.0.1.53 > 10.3.0.5.60516: 4004 1/0/1 A 93.184.216.34 (56)
```

**Comment by rpigott** [comment]
I'm not really sure what the purpose of the multiple queries is, so I'm not sure what the expected behavior is in this case, but we really shouldn't be asking questions we don't want the answer to.

**Comment by poettering** [comment]
yeah, i guess it makes sense to keep the transactions open until we received a response to cache. And we also should probably to iterations through the scopes: in the first we only query the caches, and the 2nd one we actually start transactions if the caches didn't work.
